Index,followers,rt,text
0,10162,1,edpartn revbtrfli
1,10162,1,revbtrfli
2,10162,0,faith commun partnership whitehous
3,10162,5,case miss want thank support past 8 year
4,10162,416,whitehous meet eight peopl work bring faith commun govern togeth help serv need
5,10162,5,hhsgov partnership faithbas commun org made posit differ peopl live
6,10162,11,cecilia44 thank faithbasedorg commun organ help us better serv need partners4good
7,10162,1,mind remain done look forward continu work commun leader partners4good faithbasedorg
8,10162,1,read accomplish work last 8 year visit whitehous blog partners4good
9,10162,2,also celebr presid interfaith amp commun servic campu challeng faithbasedorg partners4good
10,10162,0,whitehous faithbas amp neighborhood partnership work wcommun org creat partnerships4good
11,10162,19,usdol faithbasedorg commun partner work us promot econom opportun nationwid
12,10162,3,join us reflect work amp look forward ahead partners4good faithbasedorg
13,10162,8,commercegov blog impact faithbas neighborhood partnership faithbasedorg partners4good whitehous
14,10162,275,johnking respons make sure classroom amp campus safe support place student al
15,10162,0,edpartn advanc dampi report releas ed today
16,10162,1,thank jack kent cook foundat bring power student leader share stori divers ampinclus
17,10162,0,congrat rini thank introduc john king stori
18,10162,1,cecilia muniz saysamerica colleg promis worth celebr way increas colleg access opportun americaspromis
19,10162,1,revbtrfli new student come straight hs first gen adult return equiti experi design
20,10162,2,could made differ acknowledg amp someon dedic train help divers student
21,10162,1,tchkrieger
22,10162,1,thank leadership educ divers america invest incred young voic
23,10162,1,equiti design w student mind key success divers effort student revbtrfli
24,10162,1,translat research practic
25,10162,0,turn back even go sideway
26,10162,0,anecdot data valu tell stori
27,10162,0,enorm expertis within commun
28,10162,0,congrat former sga presid get involvedstep chang campu cultur includ see someth say someth also act
29,10162,8,payton u miss grad take time understand histori student enter door take time know stori
30,10162,1,need think abt altern way assess talent k12 pathway feed colleg must fit realiti commun
31,10162,0,edpartn lesson fisher data crucial need evid record go forward
32,10162,0,edpartn revbtrfli ferguson commun event provid context need racial diversityfish len
33,10162,25,divers inclus essenti element great educ divers classroom encourag creativ thought edundersec
34,10162,2,edundersecthi lifelong pursuit mani youw believ divers amp inclus
35,10162,1,great whitehous today summit advanc postsecondari divers inclus join us
36,10162,4,teachtolead live periscop ruthabuck close ttlsummit
37,10162,2,amandafbarney teach import profess futur countri ruthabuck ttlsummit
38,10162,6,amandafbarney teacher front line dispel myth lost human ruthabuck ttlsummit
39,10162,10,nbpt teacher salv wound countri ruthabuck ttlsummit ttlsummit
40,10162,0,tfitz7 hey ill give mic facilit pic anna
41,10162,9,nbpt richmond teacher resid program model singapor teacher prep power reflect model terri dozi
42,10162,7,teachtolead live periscop secretari ed john king discuss terri dozier 1985 us toy teach lead sum
43,10162,4,nbpt nyc public school teacher save life teacher look hope possibl johnking ttlsummit
44,10162,48,usedgov much chang ahead rest leadership educ johnking
45,10162,1,bertocikimberli resourc job induct train nbc strong nbpt teachtolead ttlsummit
46,10162,5,ascd teachtolead stream speech teacherprep ttlsummit today tomorrow watch
47,10162,10,nbpt dont learn teach text book ttlsummit
48,10162,8,jlatchana rigor rigor practic cant differenti 30 hs student without practic drrluceroaact
49,10162,16,nbpt overheard ttlsummit school need stronger collabor cultur need teacher leadership mindset help us ser
50,10162,4,teachtolead get readi lunch break follow along lunch panel 12 est ttlsummit
51,10162,8,room happen dont want room happensfollow ttlsummit teachtolead
52,10162,8,plkelly27 prepar teacher lead student opportun ttlsummit
53,10162,9,bburn school amp univers better togeth 6 word stori ttlsummit
54,10162,13,shellyfuru teacher prepar produc exponenti ripplettlsummit
55,10162,6,azulzr teacher prep respect profess ttlsummit
56,10162,19,eckertjon teach make profess possibl ttlsummit teachingqu barnettctq
57,10162,3,danbrownteach beauti day teacher leadership teachtolead teacher prep summit usedgov dc ttlsummit
58,10162,7,teachtolead cant believ ttlsummit dc tomorrow getreadi
59,10162,1,join us onlin next two day focu teacher prepar program ttlsummit
60,10162,1,fskmsprincip dr girtonmitchel usd director enjoy media product class goodjobmrv edpartn
61,10162,123,nelsonmandela 3 principl madiba live life free free other amp serv everyday serv humankind
62,10162,1,star staff help eagl fli fskmsprincip
63,10162,1,bloom plant fskmsprincip
64,10162,1,walk w purpos fskmsprincip
65,10162,0,edpartn morn announc franci scott key
66,10162,0,morn show fskmsprincip edpartn find mr v great geographi lesson
67,10162,0,one particip breakout lead wrote great piec picscc cant believ month
68,10162,239,whitehous highqual earli educ one best invest makew ad 60000 children head start
69,10162,229,whitehous africanamerican latino student graduat ever potu progress
70,10162,566,whitehous good news america high school graduat rate reach new record high 83 tune 1125am et
71,10162,220,fafsa fafsa launch earli year got question ask us use askfafsa cover detail tomorrow
72,10162,16386,potu democraci spectat sport dont give power shape futur countri love vote
73,10162,3,thank made picscc possibl gallaudetu usedgov whitehous nationalservic guberkleycent intlshintofdn hartsem
74,10162,0,thank guilfordcolleg northeastern gvsu statedept hhsgov share creat welcom commun challeng
75,10162,5,toolkit statedept campus welcom refuge help return campu picscc
76,10162,1,great first stop exist commun work think begin picscc
77,10162,1,gvsu focus campu amp commun campu servic mosqu commun piec educ comm amp connect resourc picscc
78,10162,1,gvsu began local refuge agenc ask help also heard call within picscc
79,10162,2,northeastern began boston bomb start initi love boston recogn love greatest fight hate picscc
80,10162,1,imagin summer month roomshous go unusedwhat poor use resourc innov think exist resourc picscc
81,10162,5,arab word campu mean sanctuari refug guilfordcolleg picscc
82,10162,1,guilfordcolleg began everi campu refug feel despair need done picscc
83,10162,3,hartsem explor refuge crisi colleg univers campus help picscc everycampusarefug
84,10162,53,johnking call serv deepli person underestim power voiceact improv opportuniti
85,10162,1,join countless other carri nation legaci servic inclus picscc
86,10162,0,beyond civic engag promot discuss crisi possibl host commun forum think solut togeth picscc
87,10162,1,us gather today commit work refuge local commun result would incred picscc
88,10162,0,student org mani campus found volunteersthey welcom refuge wfood drivesgreet airport introduc commun picscc
89,10162,1,student huge part play find solut simpli develop friendship refuge power picscc
90,10162,0,colleg play critic role live refuge continu rebuild live us picscc
91,10162,1,regardless age address crisi colleg uniqu posit serv resourc picscc
92,10162,1,younger gener perhap greatest humanitarian crisi lifetim must address john mccullough picscc
93,10162,3,right 65 million peopl around world displac everyday 34000 peopl forc feel home picscc
94,10162,1,wendycnc student volunt increas likelihood get job 27 picscc
95,10162,1,congrat georgetown guberkleycent win 2015 honor roll interfaith servic picscc
96,10162,0,wendycnc kick celebr presid higher educ honor roll winner congrat thank inspir us picscc
97,10162,0,havent work nationalservic yet interfaith servic wait picscc
98,10162,1,cant believ ittim last plenari picscc potu administr live
99,10162,2,settl close plenari vision picscc commun go share us
100,10162,0,wow plenari give follow johnking dmogah eboopatel ifyc chrisdstedman gucsj thank share us
101,10162,3,saralaugh goal interfaith work creat space ident ident other rabbi daniel roth p
102,10162,8,katieraegordon interfaith servic civic engag campus opportun bring togeth spiritu scholar
103,10162,3,leahsiskin chrisdstedman said take youv learn divers gather like picscc take back less divers area
104,10162,14,melodyfoxahm social justic work everyon matter liber conserv injustic affect us andria wi
105,10162,3,ljelte06 say social justic room amp one disagre social justic mean your divers room pic
106,10162,3,emmagracebw interfaith methodolog allow us move beyond disagr relationship varon soni picscc
107,10162,1,without understand side thrown stone fear go overcom picscc
108,10162,5,panelist interfaith leader speak intersect interfaith academi picscc
109,10162,2,eboopatel remind us potu young interfaith leader 80 bring togeth commun leader common good picscc
110,10162,2,dialogu convers laid brick build cathedr healthi religi divers democraci eboopatel picscc
111,10162,2,hartsem picscc eboo patel easi build healthi religi divers democraci ifyc
112,10162,1,sreynolds05 colleg univers hub nurtur skill build healthi religi divers democraci picscc eboo
113,10162,7,colleg mini cathedr healthi religi divers democraciesprepar leader build reflect nation eboopatel picscc
114,10162,5,divers isnt differ like also differ dont like eboopatel picscc
115,10162,11,work educ deepli shape servic undergrad commit servic give back johnking picscc
116,10162,1,folk could given didnt believ deepli ppl get better make decis chang live picscc
117,10162,6,public school teacher save johnking life open world beyond brooklyn picscc
118,10162,0,work deepli import event celebr work movement forward build upon johnking picscc
119,10162,2,servic colleg deepen learn servic way meaning engag divers amp build bridg understand picscc
120,10162,3,johnking first ever picscc thank join us secretari king
121,10162,1,good morn readi anoth day picscc join us second plenari onlin via link
122,10162,1,met intern particip hope look campu iheilf picscc
123,10162,0,welcom back campu let catch highlight breakout session yesterday tweet picscc repli back
124,10162,0,morn picscc remind shuttl nomagallaudet metro station elstad auditorium return shuttl later
125,10162,1,breakout happen across campu learn
126,10162,0,here campu map head first breakout session take note share picscc tweet
127,10162,1,shoutout plenari speaker give follow gallaudetu peacecorpsdir marthakant guberkleycent thank share wu
128,10162,1,glad friend marthakant edundersec picscc start 2011
129,10162,3,picscc cant let angri voic one peopl hear
130,10162,2,must answer question picscc
131,10162,3,peopl invit ppl maintain sens self reach folk commun diff self picscc
132,10162,0,
133,10162,6,know whitehous liaison jewish muslim commun meet zaki channon picscc
134,10162,2,repres choic make togeth move forward recognit variou differ build bridg picscc
135,10162,0,6 year ago presid interfaith advisori council advis potu creat initi picscc
136,10162,0,picscc wind beneath wing
137,10162,0,melissa roger whitehous us last 6 year amp sat us think futur amp built thank picscc
138,10162,0,
139,10162,0,beauti danc gallaudet danc compani picscc
140,10162,2,interfaith servic illumin pathway common ground creat fearless action human peacecorpsdir picscc
141,10162,3,hartsem faithbas organ uniqu qualifi lift margin picscc
142,10162,2,weve seen campus develop countri interfaith cooper build broken peacecorpsdir picscc
143,10162,0,there take action piec go click countri amp see projectlearn issu volunt eye
144,10162,2,35 countri 2800 volunt implement 280 distinct amp differ project 34000 girl 25 impact letgirlslearn picscc
145,10162,0,challeng commun base chang global that peacecorp came play becam ground troop picscc
146,10162,3,excit kickoff picscc flotu chief staff tina tchen peacecorpsdir learn letgirlslearn
147,10162,6,excit welcom gallaudetu sixth annual campu challeng gather join us onlin picscc
148,10162,2,grate work move gallaudetu roll sleev learn amp collabor melissarog picscc
149,10162,2,hope weve built someth endur amp continu foster notion much unit us cecilia44 picscc
150,10162,1,cecilia44 share stori commun servic colleg transform direct picscc
151,10162,2,laurenmaman interfaith servic close gap bring togeth peopl picscc
152,10162,2,challeng true testament power interfaith cooper amp commun servic build understand edundersec picscc
153,10162,2,presid white hous meet senior leader thank edundersec open picscc
154,10162,0,good morn picscc look agenda click gt need campu resourc gt
155,10162,1,look forward welcom particip dc tomorrow picscc let us know come safe travel
156,10162,5,guberkleycent interfaith dialogu iheilf picscc
157,10162,2,presenc amp insight bring today enrich convers around global interfaith dialogu amp servicehartford pre iheilf
158,10162,3,intern guest leadership guberkleycent intlshintofdn amp hartford seminari thank picscc iheilf
159,10162,4,3 year ago wonder take picscc global excit welcom second year 60 guest 31 countri iheilf
160,10162,3,potu vision student gather share commit commun serviceprovid dialogu interfaith learn picscc
161,10162,1,excit iheilf guberkleycent w intlshintofdn intern guest begin preconf picscc
162,10162,13,teacherscolleg tc alum mrdavidjohn write civil right movement isnt thing past ht
163,10162,3,johnking ttlsummit edpartn honor human other requir start
164,10162,3,johnking edpartn ttlsummit big question make sure children experi equiti learn 2 see kid serv
165,10162,8,ruthabuck amaz open panel ttlsummit mn thank newleadersorg ed4excel hiawathaleadsmn mpsnew candid
166,10162,80,johnking humbl trust amp person stori share w today philando memori live inspir
167,10162,44,johnking glad teachtolead ttlsummit support teacher leadership key improv learn student
168,10162,33,johnking also grate power convers today youth mayorhodg minneapoli mybrotherskeep
169,10162,4,edpartn ttlsummit great teacher want 2 know r part team w coach amp mentor 2 help grow team bldg must intent
170,10162,6,bcchsprincip ed4excel pd need root caus problem 2 deal w bias ttlsummit
171,10162,14,mrdavidjohn way stop discrimin basi race speak openli candidli subject race hon sonya
172,10162,6,montysay teach must becom open collabor profess silo oneperson direct meet ttlsummit
173,10162,8,ttlsummit chang classroom requir involv teacher leadersfamili commun
174,10162,6,teacher leader step drive convers race edpartn ttlsummit
175,10162,19,reachhigh via theundef flotu collegebound student know struggl beatingth
176,10162,1022,whitehous valu part american famili potu muslim american today eid alfitr recept
177,10162,10,edcivilright catherin lhamon speak ocr religi discrimin work read blog
178,10162,11,flotu beatingtheodd
179,10162,4,bettermakeroom internship import plan start hustl even get campu
180,10162,5,bettermakeroom figur your go use summer flotu beatingtheodd bettermakeroom
181,10162,5,reachhigh hear johnking share becam teacher pay forward help other beatingtheodd
182,10162,10,bettermakeroom everyth touch touch everyth chang chang jidenna speak colleg experi
183,10162,9,find mentor sometim youll push comfort zone find peer flotu beatingtheodd
184,10162,6,bettermakeroom saw smart women master degre advoc hero flotu mentor colleg
185,10162,0,colleg best invest make lifetim payoff must fill fafsa everi year johnking beatingtheodd
186,10162,4,success come dont give that advic would give younger self jidenna beatingtheodd reachhigh
187,10162,0,import learn take pressur focu make though jidenna beatingtheodd
188,10162,12,import share
189,10162,90,bettermakeroom dont sweat small stuff rachel scott beatingtheodd panelist
190,10162,3,understand financi aid use school hair shoe take aid serious get know counselor flotu
191,10162,4,wouldnt abl anyth field creativ without educ tyleroakley beatingtheodd bettermakeroom
192,10162,3,bettermakeroom school chang live johnking
193,10162,13,one grew south side first gen student today educ flotu
194,10162,68,reachhigh right beatingtheodd start wflotu tyleroakley jidenna johnking
195,10162,744,tyleroakley im moder beatingtheodd panel whitehous today 11am est watch
196,10162,0,dont think peopl doubt think peopl see potenti see
197,10162,1,next question lean advers hit keep go bettermakeroom beatingtheodd
