Index,text
0,visit learn wildfir
1,santa ana wind lead extrem fire weather condit wind gust exceed 60 mph expect across por
2,select nioshcertifi n95 p100 particul respir two strap go around head word ni
3,dust mask enough protect wildfir smoke particl wildfiresafeti
4,liberaljaxx readygov evacuationemerg messag would like come local polic fire depart
5,warm lake cold wnw wind lake effect snow get detail snow forecast locat
6,satellit play major role fire detect weather forecast incid
7,great advic readygov multipl way get inform emerg radio tv trust
8,fun composit photo weather balloon launch
9,18 inch snow possibl heaviest persist snow band gusti wind result
10,santa ana wind caus explos fire growth southwest california
11,northern hemispher winter actual occur earth closest sun learn
12,strong santa ana wind combin low humid lead continu critic extrem criti
13,plenti cold air flow stillwarm great lake frontal passag today begin period good
14,year numer camper hiker allterrain vehicl rider injur due wind
15,nwslosangel damag santaanawind critic fire weather condit today late wed nightthu main impact inclu
16,know everi nw offic nation twitter account share valuabl local
17,noaasatellit suominpp captur fast move activ fire socal burn overnight spread due strong santaanawind event
18,power storm system bring heavi snow blizzard condit upper midwest spread area heavi
19,santa ana event potenti strongest longest durat season
20,arctic air togeth brisk wind lead danger cold wind chill valu
21,line thunderstorm form across mo iowa afternoon sever weather possibl sever
22,new noaa stori map highlight import work agenc amp partner reduc impact tsunami
23,glad abl find solut scienc
24,speak great lake
25,red green blue aurora chang color chemistri spaceweath
26,lake effect snow usual get headlin great lake anoth great lake produc snow today ch
27,forecast nwsspc busi today track threat sever thunderstorm ms valley extrem crit
28,winter return northern plain snow blizzard condit expect afternoon even expec
29,nw storm predict center outlin extrem critic fire weather risk across portion southern c
30,nwswpc develop system current move thru intermountain west approach plain pm system move across
31,storm predict center continu highlight likelihood critic fire weather condit southern cal
32,strong cold front sweep across central eastern us midweek much colder temperatur expect al
33,strong low pressur system cold front bring potenti heavi snow strong wind hazard travel
34,local heavi snow high elev northwest us weekend unseason warm us cou
35,storm predict center continu highlight potenti critic fire weather condit southern
36,strong cold front sweep central eastern us middl next week set
37,windi slow keep two hand wheel avoid larg truck powerlin amp tree
38,noaasatellit goes16 perform drift maneuv goe east oper posit look himawari8 imageri like
39,half flood fatal vehiclerel turn around drown floodsafeti
40,get readi winter weather hazard visit winter safeti websit wintersafeti
41,half flood fatal vehiclerel turn around drown floodsafeti
42,noaasatellit noaa satellit kept watch everi hurrican atlant season provid data critic forecast model
43,noaa extrem activ 2017 atlant hurricaneseason final end today 1130 see thing net
44,dream white christma latest drought outlook show us part countri might ex
45,nwscpc decemb forecast warmer normal west alaska colder normal temperatur like east
46,power storm pack windi punch knock power readi windsafeti
47,nwswpc nearli locat lower 48 forecast normal high temperatur today howev pattern chang expec
48,recent meteorolog graduat look start career mani intern posit avail western r
49,light moder rainsnow pacif northwest averag temperatur continu lower
50,decemb right around corner thought itd good time everyon brush winter weat
51,noaasatellit noaa goes16 captur smoke fire burn across larg area southeast state yesterday see satellit
52,dust mask enough protect wildfir smoke particl wildfiresafeti
53,interest wind chill calcul your go want bookmark gem
54,solar flare energet explos sun amp caus radio blackout minut hour
55,high wind bill bismark today gust 5060 mph use caution your travel i94
56,noaasatellit night view noaa20 abl see look earth see satellit look u
57,nwsgaylord thank frank youngman awesom shot virga virga precipit fall cloud evapor befo
58,color sunset western louisiana even
59,flood occur anytim year prepar visit floodsafeti fallsafeti
60,beauti
61,isol thunderstorm possibl across southeast florida northern oklahomasouthern kansa ozark
62,nasagoddard much sunlight reach earth affect climat live solarpow planet tsi mission scient
63,northern light visibl increas space weather activ check
64,know 1 meter 328084 feet meterologistpickuplin
65,great imageri goes16which offici becom goeseast middecemb
66,check perspect weather balloon journey
67,picturesqu orang sunset tonight across much mid atlant seen across wisconsin sun set
68,nwschicago even sunset cirru cloud combin stun
69,nwstucson littl dusti today brief isol dust street across interst 10 possibl rapid reduct
70,drive fog hazard take caution learn fogsafeti visit
71,nwscpc high forecast probabl exist 610 day period amplifi midlevel pattern forecast along cyclon lik
72,strong wind blow dust creat danger travel condit littl warn prepar
73,nwsbayarea winter wonderland yosemit right report snow valley floor earli morn
74,commun system critic vulner sun
75,noaaresearch social scienc research goal minim impact hazard weather societi noaanssl
76,noaanceiocngeo holiday shop onlin today cybermonday download crowdmagapp help noaa gather magnet data
77,awesom weather trivia fact
78,windi much west tonight monday drive caution mountain pass especi ca n
79,nwssacramento wet road sierra snow level drop pass level 10 pm midnight prepar
80,deep tropic moistur strong easterli flow keep hawaiian island wet windi come wee
81,hurrican forc wind forecast tonight sea high 53 feet portion central aleutia
82,us near normal temperatur week
83,anoth raini windi storm west coast soil satur western washington increas potenti fo
84,activ weather pattern continu western us strong wind mountain snow
85,nwscwsuzs nice start day surfac wind ramp later today tonight across northwest ca amp area northward w
86,gorgeou photo mt rainier morn follow nwsseattl go informati
87,nwsboston approach cold front current central new york mostli sunni sky southern new england
88,nwswpc light moder snow possibl western us portion northeast next day here percen
89,monthli record snowfal yet juneau despit snowi novemb still time least make top
90,high pressur center southwestern us continu produc well normal temperatur
91,anoth weather system bring rain high elev snow much west coast later today sunday
92,amaz detail popocat petl volcan erupt mexico occur two day ago goes16 preliminari dat
93,check avalanch safeti tip hit slope wintersafeti
94,flood water level rate water flow quickli chang
95,know scientif evid suggest everi larg galaxi contain supermass black hole c
96,nwstwinciti took us nearli 562 hour thank daylight save time weve final reach 50 f twin citi fi
97,happi thanksgiv nw countri enjoy benign weather today one except area
98,nwsspc 646pm cst spc day1 outlook
99,flood occur anytim year prepar visit floodsafeti fallsafeti
100,get famili safe destin know weather encount
101,well least wont worri thaw turkey may want get bird oven k
102,bad weather forecast drive absolut necessari check forecast
103,solar flare energet explos sun amp caus radio blackout minut hour
104,thanksgiv nw thank red purpl sever shade pink three four differ green
105,noaa droughtmonitor 1121 moder wors drought affect 15 contig usa 33m peopl detail htt
106,nwswpc earli morn satellit imag observ weather plot nwswpc show thanksgiv travel may challeng
107,50 million peopl road enough worri let us worri weather get forecast
108,nwsatlanta real doe wildlif nw properti handl caution well notifi facil
109,noaasatellit thank cheer jpss1 rocket space satellit orbit offici name
110,nw offic seattl keep close eye number threat creat extend period rain
111,wonder wear friendsgiv year nw rescu nation forecast
112,windi slow keep two hand wheel avoid larg truck powerlin amp tree
113,hit road visit grandma week check forecast departur destin nw
114,nwswpc thanksgiv travel forecast thursday morn show showersstorm southeast rain continu northw
115,nwssanantonio dri condit sinc hurrican harvey allow moder drought burnt orang return part hill countr
116,flood warn mean take action floodsafeti fallsafeti
117,1 yr ago goes16 rocket orbit usher new era satellit observ send back data like w
118,noaaclim locat climat scienc servic center help build resili us climat resili toolki
119,noaasatellit dont see often hybrid tropic cyclon numa mediterranean develop welldefin eye
120,take snow ice caus problem road especi vehicl travel thanksgiv
121,even common item becom danger object pick carri wind
122,thanksgiv forecast featur tale two temperatur cool east warm west
123,sun bare goes16 alreadi show georgiadom poof
124,critic fire weather condit possibl portion plain desert southwest monday v
125,heavi rainfal mountain snow strong wind impact pacif northwest northern california week
126,make plan travel thanksgiv week check weather stori holiday creat nwswpc
127,winter weather advisori effect lower michigan afternoon midnight tonight th
128,windi weather surround passag cold front gradual diminish west east afternoon
129,yesterday sun set winter along north slope alaska watch condit utqiagvik former
130,blizzard condit continu today westcentr alaska includ seward peninsula
131,strong wind like mid atlant northeast new england sunday gust 50 mph could
132,sever weather threat continu mid south ohio valley sunday morn damag wind larg
133,updat thanksgiv week forecast inform follow nwswpc go websit
134,nwsspc 1108am cst spcwatch ww 516 sever tstm il ky mo oh 181705z 182300z
135,sever thunderstorm possibl today tn oh valley greatest threat damag wind
136,robwwooten alway truck snow anchorag ceremoni start start citi st
137,high pressur across interior alaska produc frigid temperatur well zero strong weather system w
138,150 year ago today us virgin island worst tsunami nw caribbean tsunami warn program support tsunamiprep
139,bit chilli across interior alaska right
140,potenti sever weather margin sever hail damag wind brief tornado northern ms
141,potenti sever weather morn margin sever hail along warm front missouri indiana
142,strong cold front bring shower strong thunderstorm ohio valley saturday strong gusti wind wi
143,shovel snow health risk rememb take easi learn
144,nwscpc warmer drier normal condit forecast across much central us first half decemb today
145,noaanceiclim get summari global climat condit event octob 2017 stateofclim
146,earli riser check next launch attempt newest weather satellit jpss1 schedul 447 est
147,easter impact million eastern us heavi snow strong wind prepar
148,hit road thanksgiv follow forecast nwswpc local forecast offic
149,plan head great outdoor nationaltakeahikeday sure dress element
150,noaasatellit thanksgiv around corner feel thank beauti planet today happi fulldisk
151,nwsbuffalo 3 year ago today first two epic backtoback lakeeffect snow storm began first storm left 45 feet v
152,earli get deep cool vid though scienc
153,heavi snow strong wind impact central southern rocki saturday 2 feet snow possib
154,nwsboulder winter storm warn northern amp central mountain midnight tonightsat morn heavi snow amp strong wind impact
155,windi slow keep two hand wheel avoid larg truck powerlin amp tree
156,nwsspc 1253pm cst spc day2 firewx critic eastcentr new mexico eastward portion texa panhandl
157,part keep everyon safe road winter learn wintersafeti
158,refresh memori differ winter storm watch amp winter storm warn
159,widespread drought develop possibl across much southern half us come month read
160,thank nw 3month outlook help plan winter holiday nwscpc
161,noaasatellit interest seri graviti wave cloud southeast coast captur geocolor goes16 yesterday mo
162,nwslubbock know easi get local creat nw forecast watch warn right phone
163,high wind heavi rain amp mountain snow persist across pacif northwest amp california
164,nwssacramento nwswpc forecast chanc excess rainfal portion norcal tonight could lead local
165,heavi snow strong wind heavi rainfal flood possibl good portion western us th
166,nwssacramento heavi precipit begin tonight amp continu thursday morn prepar local flood heavier rai
167,offici amp natur tsunami warn import learn respond tsunamiprep
168,start 1987 three straight year signific tornado outbreak occur novemb 15th
169,check strike visual 2017 hurrican aerosol courtesi nasa
170,plenti new snow mountain expect next 48 hour get detail forecast locat
171,take slow drive snow ohand pleas pleas use blinker
172,nwsmobil wintersafeti tip regardless sever winter weather alway prepar order remain sa
173,great photo power wave caus strong storm along west coast
174,nwsportland build snowpack cascad week thursday sever feet expect south washington cascad 12
175,odd white thanksgiv live
176,nwsfairbank anoth round heavi snow wednesday night mid day friday interior latest forecast go
177,wet windi weather impact pacif northwest spread south california next coupl
178,great graphic explan caus differ type precipit winter
179,underestim power water turn around drown floodsafeti fallsafeti
180,travel long distanc get thanksgiv dinner
181,kellyclow dhsgov ye mobil devic allow opt immin threat amber alert
182,wireless emerg alert use help keep famili safe danger weather visit
183,noaasatellit sea surfac temperatur anomali show lani condit emerg across pacif ocean like affect temp
184,power storm pack windi punch knock power readi windsafeti
185,go wet 7 day across portion west coast get detail
186,today launch noaa jpss1 postpon reschedul nov 15 147 pst
187,wrnambassador nation weather servic nw 122 weather forecast offic local reach commun across 50 state
188,heavi rain strong wind down tree power line western washington today
189,taku local alaska panhandl name downslop wind wind could gust high 65 mph tonight juneau
190,larrywilliam wave caus strong wind
191,nwsjuneau taku local alaska panhandl name downslop wind wind could gust high 65mph juneau ak tonight
192,harryre88828486 pacificwid tsunami gener costa rican earthquak wave gener strong wind
193,strong cold storm origin siberia pass alaska eastern pacif keep condi
194,whoa steep rise wave height buoy 41
195,snow across portion northeast taper tonight next chanc snow arriv mid late week
196,half flood fatal vehiclerel turn around drown floodsafeti
197,jpss1 countdowntolaunch tomorrow 1114 447am est satellit play critic role detect amp mo
198,due uncertainti time line thunderstorm frifri night larg area outlin
199,imposs know deep water look turn around drown
