Index,followers,rt,text
675,886293,24,ohnationalguard red hors airmen use demolit train war peac time mission
676,886293,31,airforc implement chang improv law enforc databas report amp sever correct measur
677,886293,40,furri servic member joint base langleyeusti help defend ensur safeti airmen civilian
678,886293,109,20fighterw wild weasel train next fight
679,886293,316,airmanmagazin usairforc b52 bomber recent struck taliban homemad explos product facil helmand provinc
680,886293,123,day airforc histori
681,886293,108,usaf bomber train raaf strengthen tie alli nation pacaf
682,886293,125,extra extra read 300 airmen 12 f35 deploy japan support theater securit
683,886293,30,face defens airman keep civil engin unit afghanistan task
684,886293,27,airforc senior leader announc continu pay rate
685,886293,110,airmobilitycmd father son reunit train littl rock air forc base airmen colonel airman armentrout
686,886293,62,sudden death quadrupl heart bypass surgeri col boudreaux surviv continu thrive read stori
687,886293,102,wrap 200 airmen amp 7 f16 return avianoairbas 2week exercis isra air base
688,886293,230,deptofdefens ear grand master jedi member usairforc wound warrior program sit servic dog
689,886293,181,day airforc histori
690,886293,82,fire doesnt burn accord schedul that train situat time day
691,886293,55,afacademi student tennesse rhode scholar attend uniofoxford
692,886293,62,patrickafb airman give thank father wwii veteran honor congression gold medal h
693,886293,150,day airforc histori
694,886293,170,strike taliban opium facil among first major use new bomb author afghanistan
695,886293,84,veteransinblu ret col kathi cosand 1 9 femal offic first graduat air forc undergradua
696,886293,134,day airforc histori
697,886293,55,senior airman selina n okyer one goal life teach nation ghana basic lifesav skill
698,886293,60,week followfriday good friend travis60amw check recent assist usnavi
699,886293,119,day airforc histori
700,886293,264,time unplug spend time famili friend share holiday craft photo well wish ov
701,886293,196,day airforc histori
702,886293,58,moral stori one better prepar win foreign soil unit state airforc
703,886293,27,face defens talent airforc nco sent spain mission support liaison
704,886293,176,someon call uber captionthi airforc photo
705,886293,29,dyk flatrat per diem norm tdi longer 30 day get complet polici detail
706,886293,470,deptofdefens parachut salut member usafwingsofblu parachut demonstr team jump aircraft nellisafb ne
707,886293,612,day airforc histori
708,886293,46,teammisawa airmen host japan ground selfdefens forc servic member
709,886293,77,moral stori one better prepar win foreign soil unit state airforc
710,886293,290,learn x37b orbit test vehicl goe orbit amp featur help unman space platform bold
711,886293,31,high school academ team mentor afresearchlab scientist earn gold medal 2017 intern genet
712,886293,31,airmen demonstr airnationalguard dual mission downrang
713,886293,1165,great sad announc pass one injuri anoth airman plane
714,886293,33,icymi secafoffici logist airmen fail logist bring mighti
715,886293,197,airmobilitycmd aircraft two c17 c5 deliv usnavi undersea rescu capabl argentina
716,886293,123,teameglin 96th test wing fight falcon head test sorti motiv mondaymotiv 96 tw perform
717,886293,151,mess one us mess us oneteamonefight
718,886293,12,macdillafb teammacdil proudtobeamc salut sra manz
719,886293,188,pacaf brrrrr take look cool pictur recent trip mcmurdo antarctica airforc nsf pacificcommand
720,886293,150,day airforc histori
721,886293,37,defi odd airman focus journey
722,886293,158,day airforc histori
723,886293,85,veteransinblu young airman 1983 cmsgt ret brown work presidenti airlift group
724,886293,245,day airforc histori
725,886293,6,afcar offer followon option airmen take short tour program
726,886293,39,week followfriday hafb follow hill airforc base support air expeditionari forc oper
727,886293,42,that high prais one best coach histori nfl patriot
728,886293,32,usaf men women basketbal team overcom advers finish top three 2017 armedforcesbasketbal tour
729,886293,118,air amp sea join forc conduct interoper train western pacif usnavi
730,886293,48,flashbackfriday
731,886293,18,go airshow watch afthunderbird instead work honeydo list flybywirefight notsohumblebrag
732,886293,17,plane train automobil longer heavi weak advancedcomposit tootingourhorn
733,886293,17,watch sister wed video much fun footag done fli camera drone alsotheairforc
734,886293,19,middl seat redey still better spend 20 hour car annoy littl brother
735,886293,60,longer need master map folder gp thankanairman
736,886293,276,patriot highfli surpris usairforc wing blue
737,886293,182,gendavegoldfein lanc p sijan believ freedom amp fellow airmen live code conduct last breath amp left lega
738,886293,89,day airforc histori
739,886293,83,dyk afthunderbird demo team see usaf f22raptor demo team showcas airpow
740,886293,462,feel needforspe usaf f22
741,886293,38,icymi edit aroundtheairforc highlight sotaf hous arm servic readi subcommitte
742,886293,39,airman recount feel fear anger abandon share stori famili servic wake
743,886293,28,nbcsboston patriot awe usairforc stori surviv train mikegiardi
744,886293,83,happen usaf team appl find
745,886293,47,travel jberoffici airmen journey histori w tuskegeeairman ssgt lesli edward
746,886293,130,usafc last day dubaiairshow what favorit part 45 minut aerial demonstratio
747,886293,369,deptofdefens may often think take keep aircraft go airmen sure watch keep travis6
748,886293,97,patriot patriot wrap first day practic afacademi look ahead raider
749,886293,34,secafoffici valu driven mission focus peopl orient everi day usaf continu keeper sa
750,886293,142,day airforc histori
751,886293,43,shawafb gambler head downrang use combat capabl support operationfreedomsentinel
752,886293,28,prepar emerg idahoairnationalguard airmen
753,886293,32,teammisawa correct f35a
754,886293,161,icymi first japanesemad f35b land teammisawa
755,886293,60,air mobil airmen continu aroundtheclock support caribbean
756,886293,24,wyoguard airman demonstr servicebeforeself serv other duti
757,886293,23,usafc heidi h grant deputi secretari air forc intern affair speak f22 pilot dubaiai
758,886293,77,airmanmagazin f15e strike eagl 492nd fighter squadron take royal air forc lakenheath england nov 6 4
759,886293,369,day airforc histori
760,886293,173,ever seen 48thfighterw fli squadron fill sky
761,886293,50,dualstatu airmen serv air reserv technician never stop support usaf mission
762,886293,41,deploy airmen find way increas war fight capabl amp stay mental fit fight
763,886293,44,vonmil swap jersey player time uniform swap need makeithappen
764,886293,40,start bast turkey amp deck hall take minut think safeti safetyfirst
765,886293,30,icymi gendavegoldfein secafoffici discuss budget sotaf
766,886293,26,gendavegoldfein icymi vcsaf wilson recent showcas militarytomilitari partnership dubai intern air chief conf
767,886293,66,laraseligman dod corral flight line das17 usnavi mh60 knighthawk usairforc f15e strike eagl f
768,886293,43,usafc readi day three dubaiairshow das17
769,886293,124,day airforc histori
770,886293,53,airmen gain new friendship experi w german air forc counterpart exercis blue flag 2017
771,886293,56,checker flag wave teamtyndal airmen gather showcas capabl amp warfight pow
772,886293,24,moral greater moral transport airmen hqusafepa deliv
773,886293,35,airman help commun come togeth aid californiawildfir victim
774,886293,42,icymi gendavegoldfein honor veteran quantico nation cemeteri
775,886293,52,vcsaf gener wilson usaf buy new capabl use old way read speed lead innov
776,886293,57,fresh clean
777,886293,138,day airforc histori
778,886293,70,usafacc sponsor exercis test joint intern partnership combatsearchandrescu oper
779,886293,89,astro2fish lucki tonightalway treat see afacademi cadet serious look size flag
780,886293,45,hqusafepa congratul norway plane nato secretari gener jen stoltenberg note make atlant ocean narrow
781,886293,317,day airforc histori
782,886293,57,airmen soldier put rapid deploy capabl test joint exercis vigil shield 18
783,886293,42,hqafmc gen ellen pawlikowski serv honorari grand marshal new york citi veteran day parad paul william bucha
784,886293,118,veteransinblu lt col toni bevacqua spent major servic fli u2 dragon ladi amp sr71 blackbir
785,886293,61,gendavegoldfein honor spoken war hero legendari aviat amp airforc veteran col eugen deatrick today veteran
786,886293,331,gendavegoldfein thank answer call servic throughout nation histori thank uniform
787,886293,164,secafoffici today honor 22 million american veteran includ 4 million usaf veteran join thank vet
788,886293,2418,deptofdefens salut veteran past amp present serv great nation thank servic amp protect fr
789,886293,99,day airforc histori
790,886293,59,meet airmen peteafb defend space
791,886293,1382,deptofdefens happi 242nd birthday usmc thank protect freedom anoth slice pt tomorrow semper
792,886293,223,rememb amp honor came us veteransday honorthem
793,886293,88,day airforc histori
794,886293,112,usaf pit stop provid life blood aircraft keep fight
795,886293,41,militarybroth share bond goe beyond call duti airmen soldier
796,886293,65,secafoffici intern review find happen kelley case amp look
797,886293,22,secafoffici respons explain author trust congress make dec
798,886293,24,gendavegoldfein count continu bomber presenc pacif continu deter defend mission sotaf
799,886293,33,gendavegoldfein keep night move past sequest current form go break forc sotaf
800,886293,13,15 mobil airmen train advis latin american expeditionari forc support un peacekeep mission
801,886293,9,dodfinr br checklist step 5 5 make decis retir system right blendedretir
802,886293,29,followfriday check 22arw home first activeduti led main oper base new boe kc4
803,886293,8,dodfinr br checklist step 4 5 yet schedul appoint consult instal person financia
804,886293,147,day airforc histori
805,886293,59,whether home station deploy train prioriti airmen eod
806,886293,64,rpa fli 44k hour amp employ 20 coalit strike effort liber raqqah syria isi
807,886293,21,behind mask usafreserv airman use collect explain love serv africa
808,886293,95,illinoi air nation guard sole airrefuel wing earn eighth usaf outstand unit award
809,886293,38,joint space forc realign afspac command becom joint forc space compon command
810,886293,11,dodfinr br checklist step 3 5 educ use blendedretir calcul analyz estim benefit
811,886293,6124,deptofdefens date 76 year ago japan surpris world sneak attack pearlharbor rememb hero th
812,886293,105,day airforc histori
813,886293,44,deploy airman break barrier whole new way teach arab 379aew airmen
814,886293,35,secafoffici amp gendavegoldfein direct review usaf program
815,886293,29,know airman whose innov idea help improv effici oper readi across airforc subm
816,886293,21,secafoffici anyth separ space joint fight move us wrong direct
817,886293,115,may magic school buse world good young student haiti travis60amw
818,886293,29,airmen particip nation grid exercis simul respons cyber amp secur threat
819,886293,49,success complet transit enlist aircraft maintain pilot airman took h
820,886293,97,deptofdefens ye usairforc airmen particip combat warrior challeng avianoairbas itali
821,886293,98,day airforc histori
822,886293,98,might hard believ fli faster save fuel true read pilot put f22
823,886293,29,ti season give feel joy airman gift last famili lifetim
824,886293,73,icymi 386th aew celebr 75 year histori
825,886293,28,airmen help meet demand pilot train mission columbusafb
826,886293,19,nellisafb also f22 success isi syria easili give best strength schedul
827,886293,32,atmospher river hurricanehunt find
828,886293,45,cmsaf need airman take activ interest financi plan amp use everi resourc avail learn
829,886293,14,dodfinr br checklist step 2 5 take mandatori blendedretir optin cours either way go make sure
830,886293,167,day airforc histori
831,886293,60,icymi afghan air forc graduat first six uh60 black hawk pilot
832,886293,42,citizenairman use person struggl suicid encourag other seek help usafhealth
833,886293,42,dyk usaf program allow space oper work scholast expert research enviro
834,886293,57,usaf amp afghan air forc special tactic work togeth gain oper advantag
835,886293,71,96 airmen receiv illustri mackay trophi outstand result amp combat c
836,886293,11,dodfinr br checklist step 1 5 determin elig elig blendedretir militar
837,886293,124,hqusafepa quick look back 2017 usafeafafrica happi holiday useucom usafricacommand usairforc usnato alli
838,886293,55,afspac proud serv new joint forc space compon command gen jay raymond jfscc integr space oper
839,886293,233,day airforc histori
840,886293,51,dyk uniqu program doverafb uniqu one kind deptofdefens fin
841,886293,45,thankyou courag share stori greg militaryhealth
842,886293,30,gendavegoldfein thank reagandefens opportun part rndf panel 3 spoke import bud
843,886293,35,secafoffici import convers today space warfight domain rndf
844,886293,189,foxnew secafoffici low readi need restor readi forc win fight jengriff
845,886293,177,day airforc histori
846,886293,39,clear see receiv toplevel recognit
847,886293,92,veteransinblu becom countri music singer ryan daniel munit nco usaf
848,886293,155,day airforc histori
849,886293,90,find one uniqu airman chang game reaper train scenario
850,886293,32,icymi aroundtheairforc
851,886293,26,followfriday check cannonafbnew western home america air commando
852,886293,107,pacaf eielsonafbaklend ici runway f35 test thef35 winter
853,886293,39,gendavegoldfein special tactic airmen conduct multipl airfield survey w afghan air forc counterpart faryab provinc
854,886293,168,happybirthday total forc partner civilairpatrol
855,886293,153,day airforc histori
856,886293,54,usafricacommand senior enlist leader join fellow combat command enlist leader discuss oper nco
857,886293,104,team edwardsafb teamwork display multiservic flight test known orang flag
858,886293,78,tbt find coldwar spark evolut america power nuclear deterr edit
859,886293,31,eielsonafbak dirt boyz usual clear ice runway year get creat f35a
860,886293,21,think optingin blendedretirementsystem countdown begun
861,886293,25,97amw pilot bring commit camaraderi usaf cycl wind
862,886293,28,pacaf andersenafbguam keep o2 flow one two usairforc base capabl produc liquid oxygen scienc readin
863,886293,143,day airforc histori
864,886293,79,old jet break new barrier one teammisawa famou flightlin asset hit new mileston
865,886293,42,shop cloth peopl settl good enough fit aircrewflightequip help airmen find th
866,886293,216,b1 bomber train royal australian air forc lightn focu australia
867,886293,35,firehous schoolhous one afacademi airman use first respond mental train futur usaf
868,886293,55,teamtyndal select futur home mq9 reaper wing host 24 rpa
869,886293,55,power outag prep complic best condit see space system airmen get done 50 bel
870,886293,44,gendavegoldfein dr rachel abraham innov ultrahighstrength steel munit reduc cost gt50 innov afr
871,886293,188,day airforc histori
872,886293,64,joint intern partner wrapup exercis doubleeagl usaf usarmi
873,886293,38,15 airmen c17globemast iii aircraft humanitarian mission find
874,886293,31,wyoguard airmen faith support statesid intern mission provid aid call upon
875,886293,24,ohnationalguard red hors airmen use demolit train war peac time mission
876,886293,31,airforc implement chang improv law enforc databas report amp sever correct measur
877,886293,40,furri servic member joint base langleyeusti help defend ensur safeti airmen civilian
878,886293,109,20fighterw wild weasel train next fight
879,886293,316,airmanmagazin usairforc b52 bomber recent struck taliban homemad explos product facil helmand provinc
880,886293,123,day airforc histori
881,886293,108,usaf bomber train raaf strengthen tie alli nation pacaf
882,886293,125,extra extra read 300 airmen 12 f35 deploy japan support theater securit
883,886293,30,face defens airman keep civil engin unit afghanistan task
884,886293,27,airforc senior leader announc continu pay rate
885,886293,110,airmobilitycmd father son reunit train littl rock air forc base airmen colonel airman armentrout
886,886293,62,sudden death quadrupl heart bypass surgeri col boudreaux surviv continu thrive read stori
887,886293,102,wrap 200 airmen amp 7 f16 return avianoairbas 2week exercis isra air base
888,886293,230,deptofdefens ear grand master jedi member usairforc wound warrior program sit servic dog
889,886293,181,day airforc histori
890,886293,82,fire doesnt burn accord schedul that train situat time day
891,886293,55,afacademi student tennesse rhode scholar attend uniofoxford
892,886293,62,patrickafb airman give thank father wwii veteran honor congression gold medal h
893,886293,150,day airforc histori
894,886293,170,strike taliban opium facil among first major use new bomb author afghanistan
895,886293,84,veteransinblu ret col kathi cosand 1 9 femal offic first graduat air forc undergradua
896,886293,134,day airforc histori
897,886293,55,senior airman selina n okyer one goal life teach nation ghana basic lifesav skill
898,886293,60,week followfriday good friend travis60amw check recent assist usnavi
899,886293,119,day airforc histori
900,886293,264,time unplug spend time famili friend share holiday craft photo well wish ov
901,886293,196,day airforc histori
902,886293,58,moral stori one better prepar win foreign soil unit state airforc
903,886293,27,face defens talent airforc nco sent spain mission support liaison
904,886293,176,someon call uber captionthi airforc photo
905,886293,29,dyk flatrat per diem norm tdi longer 30 day get complet polici detail
906,886293,470,deptofdefens parachut salut member usafwingsofblu parachut demonstr team jump aircraft nellisafb ne
907,886293,612,day airforc histori
908,886293,46,teammisawa airmen host japan ground selfdefens forc servic member
909,886293,77,moral stori one better prepar win foreign soil unit state airforc
910,886293,290,learn x37b orbit test vehicl goe orbit amp featur help unman space platform bold
911,886293,31,high school academ team mentor afresearchlab scientist earn gold medal 2017 intern genet
912,886293,31,airmen demonstr airnationalguard dual mission downrang
913,886293,1165,great sad announc pass one injuri anoth airman plane
914,886293,33,icymi secafoffici logist airmen fail logist bring mighti
915,886293,197,airmobilitycmd aircraft two c17 c5 deliv usnavi undersea rescu capabl argentina
916,886293,123,teameglin 96th test wing fight falcon head test sorti motiv mondaymotiv 96 tw perform
917,886293,151,mess one us mess us oneteamonefight
918,886293,12,macdillafb teammacdil proudtobeamc salut sra manz
919,886293,188,pacaf brrrrr take look cool pictur recent trip mcmurdo antarctica airforc nsf pacificcommand
920,886293,150,day airforc histori
921,886293,37,defi odd airman focus journey
922,886293,158,day airforc histori
923,886293,85,veteransinblu young airman 1983 cmsgt ret brown work presidenti airlift group
924,886293,245,day airforc histori
925,886293,6,afcar offer followon option airmen take short tour program
926,886293,39,week followfriday hafb follow hill airforc base support air expeditionari forc oper
927,886293,42,that high prais one best coach histori nfl patriot
928,886293,32,usaf men women basketbal team overcom advers finish top three 2017 armedforcesbasketbal tour
929,886293,118,air amp sea join forc conduct interoper train western pacif usnavi
930,886293,48,flashbackfriday
931,886293,18,go airshow watch afthunderbird instead work honeydo list flybywirefight notsohumblebrag
932,886293,17,plane train automobil longer heavi weak advancedcomposit tootingourhorn
933,886293,17,watch sister wed video much fun footag done fli camera drone alsotheairforc
934,886293,19,middl seat redey still better spend 20 hour car annoy littl brother
935,886293,60,longer need master map folder gp thankanairman
936,886293,276,patriot highfli surpris usairforc wing blue
937,886293,182,gendavegoldfein lanc p sijan believ freedom amp fellow airmen live code conduct last breath amp left lega
938,886293,89,day airforc histori
939,886293,83,dyk afthunderbird demo team see usaf f22raptor demo team showcas airpow
940,886293,462,feel needforspe usaf f22
941,886293,38,icymi edit aroundtheairforc highlight sotaf hous arm servic readi subcommitte
942,886293,39,airman recount feel fear anger abandon share stori famili servic wake
943,886293,28,nbcsboston patriot awe usairforc stori surviv train mikegiardi
944,886293,83,happen usaf team appl find
945,886293,47,travel jberoffici airmen journey histori w tuskegeeairman ssgt lesli edward
946,886293,130,usafc last day dubaiairshow what favorit part 45 minut aerial demonstratio
947,886293,369,deptofdefens may often think take keep aircraft go airmen sure watch keep travis6
948,886293,97,patriot patriot wrap first day practic afacademi look ahead raider
949,886293,34,secafoffici valu driven mission focus peopl orient everi day usaf continu keeper sa
950,886293,142,day airforc histori
951,886293,43,shawafb gambler head downrang use combat capabl support operationfreedomsentinel
952,886293,28,prepar emerg idahoairnationalguard airmen
953,886293,32,teammisawa correct f35a
954,886293,161,icymi first japanesemad f35b land teammisawa
955,886293,60,air mobil airmen continu aroundtheclock support caribbean
956,886293,24,wyoguard airman demonstr servicebeforeself serv other duti
957,886293,23,usafc heidi h grant deputi secretari air forc intern affair speak f22 pilot dubaiai
958,886293,77,airmanmagazin f15e strike eagl 492nd fighter squadron take royal air forc lakenheath england nov 6 4
959,886293,369,day airforc histori
960,886293,173,ever seen 48thfighterw fli squadron fill sky
961,886293,50,dualstatu airmen serv air reserv technician never stop support usaf mission
962,886293,41,deploy airmen find way increas war fight capabl amp stay mental fit fight
963,886293,44,vonmil swap jersey player time uniform swap need makeithappen
964,886293,40,start bast turkey amp deck hall take minut think safeti safetyfirst
965,886293,30,icymi gendavegoldfein secafoffici discuss budget sotaf
966,886293,26,gendavegoldfein icymi vcsaf wilson recent showcas militarytomilitari partnership dubai intern air chief conf
967,886293,66,laraseligman dod corral flight line das17 usnavi mh60 knighthawk usairforc f15e strike eagl f
968,886293,43,usafc readi day three dubaiairshow das17
969,886293,124,day airforc histori
970,886293,53,airmen gain new friendship experi w german air forc counterpart exercis blue flag 2017
971,886293,56,checker flag wave teamtyndal airmen gather showcas capabl amp warfight pow
972,886293,24,moral greater moral transport airmen hqusafepa deliv
973,886293,35,airman help commun come togeth aid californiawildfir victim
974,886293,42,icymi gendavegoldfein honor veteran quantico nation cemeteri
975,886293,52,vcsaf gener wilson usaf buy new capabl use old way read speed lead innov
976,886293,57,fresh clean
977,886293,138,day airforc histori
978,886293,70,usafacc sponsor exercis test joint intern partnership combatsearchandrescu oper
979,886293,89,astro2fish lucki tonightalway treat see afacademi cadet serious look size flag
980,886293,45,hqusafepa congratul norway plane nato secretari gener jen stoltenberg note make atlant ocean narrow
981,886293,317,day airforc histori
982,886293,57,airmen soldier put rapid deploy capabl test joint exercis vigil shield 18
983,886293,42,hqafmc gen ellen pawlikowski serv honorari grand marshal new york citi veteran day parad paul william bucha
984,886293,118,veteransinblu lt col toni bevacqua spent major servic fli u2 dragon ladi amp sr71 blackbir
985,886293,61,gendavegoldfein honor spoken war hero legendari aviat amp airforc veteran col eugen deatrick today veteran
986,886293,331,gendavegoldfein thank answer call servic throughout nation histori thank uniform
987,886293,164,secafoffici today honor 22 million american veteran includ 4 million usaf veteran join thank vet
988,886293,2418,deptofdefens salut veteran past amp present serv great nation thank servic amp protect fr
989,886293,99,day airforc histori
990,886293,59,meet airmen peteafb defend space
991,886293,1382,deptofdefens happi 242nd birthday usmc thank protect freedom anoth slice pt tomorrow semper
992,886293,223,rememb amp honor came us veteransday honorthem
993,886293,88,day airforc histori
994,886293,112,usaf pit stop provid life blood aircraft keep fight
995,886293,41,militarybroth share bond goe beyond call duti airmen soldier
996,886293,65,secafoffici intern review find happen kelley case amp look
997,886293,22,secafoffici respons explain author trust congress make dec
998,886293,24,gendavegoldfein count continu bomber presenc pacif continu deter defend mission sotaf
999,886293,33,gendavegoldfein keep night move past sequest current form go break forc sotaf
