Index,followers,rt,text
339,886292,83,dyk afthunderbird demo team see usaf f22raptor demo team showcas airpow
340,886292,462,feel needforspe usaf f22
341,886292,38,icymi edit aroundtheairforc highlight sotaf hous arm servic readi subcommitte
342,886292,39,airman recount feel fear anger abandon share stori famili servic wake
343,886292,28,nbcsboston patriot awe usairforc stori surviv train mikegiardi
344,886292,83,happen usaf team appl find
345,886292,47,travel jberoffici airmen journey histori w tuskegeeairman ssgt lesli edward
346,886292,130,usafc last day dubaiairshow what favorit part 45 minut aerial demonstratio
347,886292,369,deptofdefens may often think take keep aircraft go airmen sure watch keep travis6
348,886292,97,patriot patriot wrap first day practic afacademi look ahead raider
349,886292,34,secafoffici valu driven mission focus peopl orient everi day usaf continu keeper sa
350,886292,142,day airforc histori
351,886292,43,shawafb gambler head downrang use combat capabl support operationfreedomsentinel
352,886292,28,prepar emerg idahoairnationalguard airmen
353,886292,32,teammisawa correct f35a
354,886292,161,icymi first japanesemad f35b land teammisawa
355,886292,60,air mobil airmen continu aroundtheclock support caribbean
356,886292,24,wyoguard airman demonstr servicebeforeself serv other duti
357,886292,23,usafc heidi h grant deputi secretari air forc intern affair speak f22 pilot dubaiai
358,886292,77,airmanmagazin f15e strike eagl 492nd fighter squadron take royal air forc lakenheath england nov 6 4
359,886292,369,day airforc histori
360,886292,173,ever seen 48thfighterw fli squadron fill sky
361,886292,50,dualstatu airmen serv air reserv technician never stop support usaf mission
362,886292,41,deploy airmen find way increas war fight capabl amp stay mental fit fight
363,886292,44,vonmil swap jersey player time uniform swap need makeithappen
364,886292,40,start bast turkey amp deck hall take minut think safeti safetyfirst
365,886292,30,icymi gendavegoldfein secafoffici discuss budget sotaf
366,886292,26,gendavegoldfein icymi vcsaf wilson recent showcas militarytomilitari partnership dubai intern air chief conf
367,886292,66,laraseligman dod corral flight line das17 usnavi mh60 knighthawk usairforc f15e strike eagl f
368,886292,43,usafc readi day three dubaiairshow das17
369,886292,124,day airforc histori
370,886292,53,airmen gain new friendship experi w german air forc counterpart exercis blue flag 2017
371,886292,56,checker flag wave teamtyndal airmen gather showcas capabl amp warfight pow
372,886292,24,moral greater moral transport airmen hqusafepa deliv
373,886292,35,airman help commun come togeth aid californiawildfir victim
374,886292,42,icymi gendavegoldfein honor veteran quantico nation cemeteri
375,886292,52,vcsaf gener wilson usaf buy new capabl use old way read speed lead innov
376,886292,57,fresh clean
377,886292,138,day airforc histori
378,886292,70,usafacc sponsor exercis test joint intern partnership combatsearchandrescu oper
379,886292,89,astro2fish lucki tonightalway treat see afacademi cadet serious look size flag
380,886292,45,hqusafepa congratul norway plane nato secretari gener jen stoltenberg note make atlant ocean narrow
381,886292,317,day airforc histori
382,886292,57,airmen soldier put rapid deploy capabl test joint exercis vigil shield 18
383,886292,42,hqafmc gen ellen pawlikowski serv honorari grand marshal new york citi veteran day parad paul william bucha
384,886292,118,veteransinblu lt col toni bevacqua spent major servic fli u2 dragon ladi amp sr71 blackbir
385,886292,61,gendavegoldfein honor spoken war hero legendari aviat amp airforc veteran col eugen deatrick today veteran
386,886292,331,gendavegoldfein thank answer call servic throughout nation histori thank uniform
387,886292,164,secafoffici today honor 22 million american veteran includ 4 million usaf veteran join thank vet
388,886292,2418,deptofdefens salut veteran past amp present serv great nation thank servic amp protect fr
389,886292,99,day airforc histori
390,886292,59,meet airmen peteafb defend space
391,886292,1382,deptofdefens happi 242nd birthday usmc thank protect freedom anoth slice pt tomorrow semper
392,886292,223,rememb amp honor came us veteransday honorthem
393,886292,88,day airforc histori
394,886292,112,usaf pit stop provid life blood aircraft keep fight
395,886292,41,militarybroth share bond goe beyond call duti airmen soldier
396,886292,65,secafoffici intern review find happen kelley case amp look
397,886292,22,secafoffici respons explain author trust congress make dec
398,886292,24,gendavegoldfein count continu bomber presenc pacif continu deter defend mission sotaf
399,886292,33,gendavegoldfein keep night move past sequest current form go break forc sotaf
400,886292,13,15 mobil airmen train advis latin american expeditionari forc support un peacekeep mission
401,886292,9,dodfinr br checklist step 5 5 make decis retir system right blendedretir
402,886292,29,followfriday check 22arw home first activeduti led main oper base new boe kc4
403,886292,8,dodfinr br checklist step 4 5 yet schedul appoint consult instal person financia
404,886292,147,day airforc histori
405,886292,59,whether home station deploy train prioriti airmen eod
406,886292,64,rpa fli 44k hour amp employ 20 coalit strike effort liber raqqah syria isi
407,886292,21,behind mask usafreserv airman use collect explain love serv africa
408,886292,95,illinoi air nation guard sole airrefuel wing earn eighth usaf outstand unit award
409,886292,38,joint space forc realign afspac command becom joint forc space compon command
410,886292,11,dodfinr br checklist step 3 5 educ use blendedretir calcul analyz estim benefit
411,886292,6124,deptofdefens date 76 year ago japan surpris world sneak attack pearlharbor rememb hero th
412,886292,105,day airforc histori
413,886292,44,deploy airman break barrier whole new way teach arab 379aew airmen
414,886292,35,secafoffici amp gendavegoldfein direct review usaf program
415,886292,29,know airman whose innov idea help improv effici oper readi across airforc subm
416,886292,21,secafoffici anyth separ space joint fight move us wrong direct
417,886292,115,may magic school buse world good young student haiti travis60amw
418,886292,29,airmen particip nation grid exercis simul respons cyber amp secur threat
419,886292,49,success complet transit enlist aircraft maintain pilot airman took h
420,886292,97,deptofdefens ye usairforc airmen particip combat warrior challeng avianoairbas itali
421,886292,98,day airforc histori
422,886292,98,might hard believ fli faster save fuel true read pilot put f22
423,886292,29,ti season give feel joy airman gift last famili lifetim
424,886292,73,icymi 386th aew celebr 75 year histori
425,886292,28,airmen help meet demand pilot train mission columbusafb
426,886292,19,nellisafb also f22 success isi syria easili give best strength schedul
427,886292,32,atmospher river hurricanehunt find
428,886292,45,cmsaf need airman take activ interest financi plan amp use everi resourc avail learn
429,886292,14,dodfinr br checklist step 2 5 take mandatori blendedretir optin cours either way go make sure
430,886292,167,day airforc histori
431,886292,60,icymi afghan air forc graduat first six uh60 black hawk pilot
432,886292,42,citizenairman use person struggl suicid encourag other seek help usafhealth
433,886292,42,dyk usaf program allow space oper work scholast expert research enviro
434,886292,57,usaf amp afghan air forc special tactic work togeth gain oper advantag
435,886292,71,96 airmen receiv illustri mackay trophi outstand result amp combat c
436,886292,11,dodfinr br checklist step 1 5 determin elig elig blendedretir militar
437,886292,124,hqusafepa quick look back 2017 usafeafafrica happi holiday useucom usafricacommand usairforc usnato alli
438,886292,55,afspac proud serv new joint forc space compon command gen jay raymond jfscc integr space oper
439,886292,233,day airforc histori
440,886292,51,dyk uniqu program doverafb uniqu one kind deptofdefens fin
441,886292,45,thankyou courag share stori greg militaryhealth
442,886292,30,gendavegoldfein thank reagandefens opportun part rndf panel 3 spoke import bud
443,886292,35,secafoffici import convers today space warfight domain rndf
444,886292,189,foxnew secafoffici low readi need restor readi forc win fight jengriff
445,886292,177,day airforc histori
446,886292,39,clear see receiv toplevel recognit
447,886292,92,veteransinblu becom countri music singer ryan daniel munit nco usaf
448,886292,155,day airforc histori
449,886292,90,find one uniqu airman chang game reaper train scenario
450,886292,32,icymi aroundtheairforc
451,886292,26,followfriday check cannonafbnew western home america air commando
452,886292,107,pacaf eielsonafbaklend ici runway f35 test thef35 winter
453,886292,39,gendavegoldfein special tactic airmen conduct multipl airfield survey w afghan air forc counterpart faryab provinc
454,886292,168,happybirthday total forc partner civilairpatrol
455,886292,153,day airforc histori
456,886292,54,usafricacommand senior enlist leader join fellow combat command enlist leader discuss oper nco
457,886292,104,team edwardsafb teamwork display multiservic flight test known orang flag
458,886292,78,tbt find coldwar spark evolut america power nuclear deterr edit
459,886292,31,eielsonafbak dirt boyz usual clear ice runway year get creat f35a
460,886292,21,think optingin blendedretirementsystem countdown begun
461,886292,25,97amw pilot bring commit camaraderi usaf cycl wind
462,886292,28,pacaf andersenafbguam keep o2 flow one two usairforc base capabl produc liquid oxygen scienc readin
463,886292,143,day airforc histori
464,886292,79,old jet break new barrier one teammisawa famou flightlin asset hit new mileston
465,886292,42,shop cloth peopl settl good enough fit aircrewflightequip help airmen find th
466,886292,216,b1 bomber train royal australian air forc lightn focu australia
467,886292,35,firehous schoolhous one afacademi airman use first respond mental train futur usaf
468,886292,55,teamtyndal select futur home mq9 reaper wing host 24 rpa
469,886292,55,power outag prep complic best condit see space system airmen get done 50 bel
470,886292,44,gendavegoldfein dr rachel abraham innov ultrahighstrength steel munit reduc cost gt50 innov afr
471,886292,188,day airforc histori
472,886292,64,joint intern partner wrapup exercis doubleeagl usaf usarmi
473,886292,38,15 airmen c17globemast iii aircraft humanitarian mission find
474,886292,31,wyoguard airmen faith support statesid intern mission provid aid call upon
475,886292,24,ohnationalguard red hors airmen use demolit train war peac time mission
476,886292,31,airforc implement chang improv law enforc databas report amp sever correct measur
477,886292,40,furri servic member joint base langleyeusti help defend ensur safeti airmen civilian
478,886292,109,20fighterw wild weasel train next fight
479,886292,316,airmanmagazin usairforc b52 bomber recent struck taliban homemad explos product facil helmand provinc
480,886292,123,day airforc histori
481,886292,108,usaf bomber train raaf strengthen tie alli nation pacaf
482,886292,125,extra extra read 300 airmen 12 f35 deploy japan support theater securit
483,886292,30,face defens airman keep civil engin unit afghanistan task
484,886292,27,airforc senior leader announc continu pay rate
485,886292,110,airmobilitycmd father son reunit train littl rock air forc base airmen colonel airman armentrout
486,886292,62,sudden death quadrupl heart bypass surgeri col boudreaux surviv continu thrive read stori
487,886292,102,wrap 200 airmen amp 7 f16 return avianoairbas 2week exercis isra air base
488,886292,230,deptofdefens ear grand master jedi member usairforc wound warrior program sit servic dog
489,886292,181,day airforc histori
490,886292,82,fire doesnt burn accord schedul that train situat time day
491,886292,55,afacademi student tennesse rhode scholar attend uniofoxford
492,886292,62,patrickafb airman give thank father wwii veteran honor congression gold medal h
493,886292,150,day airforc histori
494,886292,170,strike taliban opium facil among first major use new bomb author afghanistan
495,886292,84,veteransinblu ret col kathi cosand 1 9 femal offic first graduat air forc undergradua
496,886292,134,day airforc histori
497,886292,55,senior airman selina n okyer one goal life teach nation ghana basic lifesav skill
498,886292,60,week followfriday good friend travis60amw check recent assist usnavi
499,886292,119,day airforc histori
500,886292,264,time unplug spend time famili friend share holiday craft photo well wish ov
501,886292,196,day airforc histori
502,886292,58,moral stori one better prepar win foreign soil unit state airforc
503,886292,27,face defens talent airforc nco sent spain mission support liaison
504,886292,176,someon call uber captionthi airforc photo
505,886292,29,dyk flatrat per diem norm tdi longer 30 day get complet polici detail
506,886292,470,deptofdefens parachut salut member usafwingsofblu parachut demonstr team jump aircraft nellisafb ne
507,886292,612,day airforc histori
508,886292,46,teammisawa airmen host japan ground selfdefens forc servic member
509,886292,77,moral stori one better prepar win foreign soil unit state airforc
510,886292,290,learn x37b orbit test vehicl goe orbit amp featur help unman space platform bold
511,886292,31,high school academ team mentor afresearchlab scientist earn gold medal 2017 intern genet
512,886292,31,airmen demonstr airnationalguard dual mission downrang
513,886292,1165,great sad announc pass one injuri anoth airman plane
514,886292,33,icymi secafoffici logist airmen fail logist bring mighti
515,886292,197,airmobilitycmd aircraft two c17 c5 deliv usnavi undersea rescu capabl argentina
516,886292,123,teameglin 96th test wing fight falcon head test sorti motiv mondaymotiv 96 tw perform
517,886292,151,mess one us mess us oneteamonefight
518,886292,12,macdillafb teammacdil proudtobeamc salut sra manz
519,886292,188,pacaf brrrrr take look cool pictur recent trip mcmurdo antarctica airforc nsf pacificcommand
520,886292,150,day airforc histori
521,886292,37,defi odd airman focus journey
522,886292,158,day airforc histori
523,886292,85,veteransinblu young airman 1983 cmsgt ret brown work presidenti airlift group
524,886292,245,day airforc histori
525,886292,6,afcar offer followon option airmen take short tour program
526,886292,39,week followfriday hafb follow hill airforc base support air expeditionari forc oper
527,886292,42,that high prais one best coach histori nfl patriot
528,886292,32,usaf men women basketbal team overcom advers finish top three 2017 armedforcesbasketbal tour
529,886292,118,air amp sea join forc conduct interoper train western pacif usnavi
530,886292,48,flashbackfriday
531,886292,18,go airshow watch afthunderbird instead work honeydo list flybywirefight notsohumblebrag
532,886292,17,plane train automobil longer heavi weak advancedcomposit tootingourhorn
533,886292,17,watch sister wed video much fun footag done fli camera drone alsotheairforc
534,886292,19,middl seat redey still better spend 20 hour car annoy littl brother
535,886292,60,longer need master map folder gp thankanairman
536,886292,276,patriot highfli surpris usairforc wing blue
537,886292,182,gendavegoldfein lanc p sijan believ freedom amp fellow airmen live code conduct last breath amp left lega
538,886292,89,day airforc histori
539,886292,83,dyk afthunderbird demo team see usaf f22raptor demo team showcas airpow
540,886292,462,feel needforspe usaf f22
541,886292,38,icymi edit aroundtheairforc highlight sotaf hous arm servic readi subcommitte
542,886292,39,airman recount feel fear anger abandon share stori famili servic wake
543,886292,28,nbcsboston patriot awe usairforc stori surviv train mikegiardi
544,886292,83,happen usaf team appl find
545,886292,47,travel jberoffici airmen journey histori w tuskegeeairman ssgt lesli edward
546,886292,130,usafc last day dubaiairshow what favorit part 45 minut aerial demonstratio
547,886292,369,deptofdefens may often think take keep aircraft go airmen sure watch keep travis6
548,886292,97,patriot patriot wrap first day practic afacademi look ahead raider
549,886292,34,secafoffici valu driven mission focus peopl orient everi day usaf continu keeper sa
550,886292,142,day airforc histori
551,886292,43,shawafb gambler head downrang use combat capabl support operationfreedomsentinel
552,886292,28,prepar emerg idahoairnationalguard airmen
553,886292,32,teammisawa correct f35a
554,886292,161,icymi first japanesemad f35b land teammisawa
555,886292,60,air mobil airmen continu aroundtheclock support caribbean
556,886292,24,wyoguard airman demonstr servicebeforeself serv other duti
557,886292,23,usafc heidi h grant deputi secretari air forc intern affair speak f22 pilot dubaiai
558,886292,77,airmanmagazin f15e strike eagl 492nd fighter squadron take royal air forc lakenheath england nov 6 4
559,886292,369,day airforc histori
560,886292,173,ever seen 48thfighterw fli squadron fill sky
561,886292,50,dualstatu airmen serv air reserv technician never stop support usaf mission
562,886292,41,deploy airmen find way increas war fight capabl amp stay mental fit fight
563,886292,44,vonmil swap jersey player time uniform swap need makeithappen
564,886292,40,start bast turkey amp deck hall take minut think safeti safetyfirst
565,886292,30,icymi gendavegoldfein secafoffici discuss budget sotaf
566,886292,26,gendavegoldfein icymi vcsaf wilson recent showcas militarytomilitari partnership dubai intern air chief conf
567,886292,66,laraseligman dod corral flight line das17 usnavi mh60 knighthawk usairforc f15e strike eagl f
568,886292,43,usafc readi day three dubaiairshow das17
569,886292,124,day airforc histori
570,886292,53,airmen gain new friendship experi w german air forc counterpart exercis blue flag 2017
571,886292,56,checker flag wave teamtyndal airmen gather showcas capabl amp warfight pow
572,886292,24,moral greater moral transport airmen hqusafepa deliv
573,886292,35,airman help commun come togeth aid californiawildfir victim
574,886292,42,icymi gendavegoldfein honor veteran quantico nation cemeteri
575,886292,52,vcsaf gener wilson usaf buy new capabl use old way read speed lead innov
576,886292,57,fresh clean
577,886292,138,day airforc histori
578,886292,70,usafacc sponsor exercis test joint intern partnership combatsearchandrescu oper
579,886292,89,astro2fish lucki tonightalway treat see afacademi cadet serious look size flag
580,886292,45,hqusafepa congratul norway plane nato secretari gener jen stoltenberg note make atlant ocean narrow
581,886292,317,day airforc histori
582,886292,57,airmen soldier put rapid deploy capabl test joint exercis vigil shield 18
583,886292,42,hqafmc gen ellen pawlikowski serv honorari grand marshal new york citi veteran day parad paul william bucha
584,886292,118,veteransinblu lt col toni bevacqua spent major servic fli u2 dragon ladi amp sr71 blackbir
585,886292,61,gendavegoldfein honor spoken war hero legendari aviat amp airforc veteran col eugen deatrick today veteran
586,886292,331,gendavegoldfein thank answer call servic throughout nation histori thank uniform
587,886292,164,secafoffici today honor 22 million american veteran includ 4 million usaf veteran join thank vet
588,886292,2418,deptofdefens salut veteran past amp present serv great nation thank servic amp protect fr
589,886292,99,day airforc histori
590,886292,59,meet airmen peteafb defend space
591,886292,1382,deptofdefens happi 242nd birthday usmc thank protect freedom anoth slice pt tomorrow semper
592,886292,223,rememb amp honor came us veteransday honorthem
593,886292,88,day airforc histori
594,886292,112,usaf pit stop provid life blood aircraft keep fight
595,886292,41,militarybroth share bond goe beyond call duti airmen soldier
596,886292,65,secafoffici intern review find happen kelley case amp look
597,886292,22,secafoffici respons explain author trust congress make dec
598,886292,24,gendavegoldfein count continu bomber presenc pacif continu deter defend mission sotaf
599,886292,33,gendavegoldfein keep night move past sequest current form go break forc sotaf
600,886293,13,15 mobil airmen train advis latin american expeditionari forc support un peacekeep mission
601,886293,9,dodfinr br checklist step 5 5 make decis retir system right blendedretir
602,886293,29,followfriday check 22arw home first activeduti led main oper base new boe kc4
603,886293,8,dodfinr br checklist step 4 5 yet schedul appoint consult instal person financia
604,886293,147,day airforc histori
605,886293,59,whether home station deploy train prioriti airmen eod
606,886293,64,rpa fli 44k hour amp employ 20 coalit strike effort liber raqqah syria isi
607,886293,21,behind mask usafreserv airman use collect explain love serv africa
608,886293,95,illinoi air nation guard sole airrefuel wing earn eighth usaf outstand unit award
609,886293,38,joint space forc realign afspac command becom joint forc space compon command
610,886293,11,dodfinr br checklist step 3 5 educ use blendedretir calcul analyz estim benefit
611,886293,6124,deptofdefens date 76 year ago japan surpris world sneak attack pearlharbor rememb hero th
612,886293,105,day airforc histori
613,886293,44,deploy airman break barrier whole new way teach arab 379aew airmen
614,886293,35,secafoffici amp gendavegoldfein direct review usaf program
615,886293,29,know airman whose innov idea help improv effici oper readi across airforc subm
616,886293,21,secafoffici anyth separ space joint fight move us wrong direct
617,886293,115,may magic school buse world good young student haiti travis60amw
618,886293,29,airmen particip nation grid exercis simul respons cyber amp secur threat
619,886293,49,success complet transit enlist aircraft maintain pilot airman took h
620,886293,97,deptofdefens ye usairforc airmen particip combat warrior challeng avianoairbas itali
621,886293,98,day airforc histori
622,886293,98,might hard believ fli faster save fuel true read pilot put f22
623,886293,29,ti season give feel joy airman gift last famili lifetim
624,886293,73,icymi 386th aew celebr 75 year histori
625,886293,28,airmen help meet demand pilot train mission columbusafb
626,886293,19,nellisafb also f22 success isi syria easili give best strength schedul
627,886293,32,atmospher river hurricanehunt find
628,886293,45,cmsaf need airman take activ interest financi plan amp use everi resourc avail learn
629,886293,14,dodfinr br checklist step 2 5 take mandatori blendedretir optin cours either way go make sure
630,886293,167,day airforc histori
631,886293,60,icymi afghan air forc graduat first six uh60 black hawk pilot
632,886293,42,citizenairman use person struggl suicid encourag other seek help usafhealth
633,886293,42,dyk usaf program allow space oper work scholast expert research enviro
634,886293,57,usaf amp afghan air forc special tactic work togeth gain oper advantag
635,886293,71,96 airmen receiv illustri mackay trophi outstand result amp combat c
636,886293,11,dodfinr br checklist step 1 5 determin elig elig blendedretir militar
637,886293,124,hqusafepa quick look back 2017 usafeafafrica happi holiday useucom usafricacommand usairforc usnato alli
638,886293,55,afspac proud serv new joint forc space compon command gen jay raymond jfscc integr space oper
639,886293,233,day airforc histori
640,886293,51,dyk uniqu program doverafb uniqu one kind deptofdefens fin
641,886293,45,thankyou courag share stori greg militaryhealth
642,886293,30,gendavegoldfein thank reagandefens opportun part rndf panel 3 spoke import bud
643,886293,35,secafoffici import convers today space warfight domain rndf
644,886293,189,foxnew secafoffici low readi need restor readi forc win fight jengriff
645,886293,177,day airforc histori
646,886293,39,clear see receiv toplevel recognit
647,886293,92,veteransinblu becom countri music singer ryan daniel munit nco usaf
648,886293,155,day airforc histori
649,886293,90,find one uniqu airman chang game reaper train scenario
650,886293,32,icymi aroundtheairforc
651,886293,26,followfriday check cannonafbnew western home america air commando
652,886293,107,pacaf eielsonafbaklend ici runway f35 test thef35 winter
653,886293,39,gendavegoldfein special tactic airmen conduct multipl airfield survey w afghan air forc counterpart faryab provinc
654,886293,168,happybirthday total forc partner civilairpatrol
655,886293,153,day airforc histori
656,886293,54,usafricacommand senior enlist leader join fellow combat command enlist leader discuss oper nco
657,886293,104,team edwardsafb teamwork display multiservic flight test known orang flag
658,886293,78,tbt find coldwar spark evolut america power nuclear deterr edit
659,886293,31,eielsonafbak dirt boyz usual clear ice runway year get creat f35a
660,886293,21,think optingin blendedretirementsystem countdown begun
661,886293,25,97amw pilot bring commit camaraderi usaf cycl wind
662,886293,28,pacaf andersenafbguam keep o2 flow one two usairforc base capabl produc liquid oxygen scienc readin
663,886293,143,day airforc histori
664,886293,79,old jet break new barrier one teammisawa famou flightlin asset hit new mileston
665,886293,42,shop cloth peopl settl good enough fit aircrewflightequip help airmen find th
666,886293,216,b1 bomber train royal australian air forc lightn focu australia
667,886293,35,firehous schoolhous one afacademi airman use first respond mental train futur usaf
668,886293,55,teamtyndal select futur home mq9 reaper wing host 24 rpa
669,886293,55,power outag prep complic best condit see space system airmen get done 50 bel
670,886293,44,gendavegoldfein dr rachel abraham innov ultrahighstrength steel munit reduc cost gt50 innov afr
671,886293,188,day airforc histori
672,886293,64,joint intern partner wrapup exercis doubleeagl usaf usarmi
673,886293,38,15 airmen c17globemast iii aircraft humanitarian mission find
674,886293,31,wyoguard airmen faith support statesid intern mission provid aid call upon
