Index,followers,rt,text
659,986594,33,mt surfacewarrior surflant command radm wilson visit littor combat ship train facil navbasesd
660,986594,180,otd 1995 first super hornet make first flight two year super hornet initi sea trial seen
661,986594,19,adm moran schoolhous expens build send peopl much better bring
662,986594,30,adm moran build bigger sophist usnavi fail properli train sailor iitsec
663,986594,18,adm moran go push hard think need usnavi partnership industri iitsec
664,986594,14,adm moran want talk fundament train especi follow two collis past summer
665,986594,14,adm moran need pick pace us need look mirror messag pentagon wi
666,986594,40,vcno moran discuss transform usnavi train iitsec orlando
667,986594,31,soon vcno bill moran discuss transform usnavi train iitsec follow live
668,986594,40,morn vcno bill moran discuss transform usnavi train iitsec follow
669,986594,191,wednesdaywisdom shipmat never forget your part team greatest navi world usnavi
670,986594,152,initi usnavi japanbas cvw5 jet squadron flyin mca iwakuni file photo
671,986594,98,around fleet today usnavi photo day info download
672,986594,52,usnavi sailor submit tuition assist ncpace dl request januari term
673,986594,104,tuesdaythought navalacademi armynavi game navyfb uniform
674,986594,83,ussjohnsmccain depart subic bay en rout yokosuka repair return servic us7thfleet
675,986594,229,aloha ussillinoi arriv pearlharbor
676,986594,391,ussronaldreagan memori servic rememb honor three shipmat lost c2a crash
677,986594,114,around fleet today usnavi photo day info download
678,986594,41,mt amphib7flt usschief get underway water near hososhima begin 3ja jmsdf
679,986594,88,cybermonday rememb cyber threat real shop smart onlin know seller item
680,986594,443,ussronaldreagan memori servic rememb honor three shipmat lost c2a crash
681,986594,101,ussfitzgerald return fleet activ yokosuka aboard mv transshelf repair two punctur hull caus
682,986594,197,usnavi photo nov 2022
683,986594,487,mt secnav76 today join entir navi famili mourn loss lt steven comb airman matthew chiala
684,986594,352,cnorichardson loss three shipmat c2a greyhound crash navi team stick togeth ea
685,986594,112,ussfitzgerald depart fleet activ yokosuka begin journey pascagoula mississippi repair
686,986594,1355,break usnavi identifi sailor lost c2a crash
687,986594,64,stronger famili stronger fleet icymi cnorichardson releas usnavi famili framework outlin goal way ah
688,986594,505,otd 1961 usnavi first nuclearpow aircraft carrier ussenterpris cvan 65 commiss look back
689,986594,74,around fleet today usnavi photo day info download
690,986594,101,icymi ussfitzgerald depart fleet activ yokosuka begin journey pascagoula mississippi
691,986594,189,search end three usnavi sailor c2a crash investig underway file pic
692,986594,125,thank vp spend thanksgiv shipmat
693,986594,255,alwaysthankfulfor offic view
694,986594,260,break search end three usnavi sailor c2a crash file pic
695,986594,106,sinc forward navi mani shipmat away famili thanksgiv still go
696,986594,54,secnav76 secretari navi richard v spencer spent first thanksgiv secnav76 us5thfleet marin sailor
697,986594,92,mt us7thfleet ussfitzgerald ddg 62 depart fleet activ yokosuka meet heavi lift transport vessel
698,986594,259,think stress cook thanksgiv dinner famili tri cook meal 324000 peopl
699,986594,1698,happi thanksgiv usnavi thank opportun protect defend nation
700,986594,151,icymi search three sailor expand philippin sea follow c2a greyhound aircraft crash
701,986594,74,around fleet wednesday usnavi photo day info download
702,986594,252,search three sailor expand philippin sea follow c2a greyhound aircraft crash
703,986594,102,around fleet today usnavi photo day info download
704,986594,46,mt usnavyeurop sideboy salut secnav76 aboard ussmountwhitney coast napl itali
705,986594,58,fall 2017 petti offic advanc result releas via usnpeopl
706,986594,58,live watch usnavi newest sailor graduat boot camp
707,986594,26,today 11a et fall 2017 petti offic advanc result releas post allhandsmag
708,986594,594,cnorichardson statement c2a aircraft crash
709,986594,11326,realdonaldtrump usnavi conduct search rescu follow aircraft crash monitor situat prayer
710,986594,52,live 945a et watch usnavi newest sailor graduat boot camp
711,986594,154,inform latest updat
712,986594,1833,break updat eight personnel recov follow c2a greyhound crash transfer ussronaldreagan
713,986594,1018,break usnavi aircraft crash philippinesea carri 11 crew passeng en rout ussronaldreagan
714,986594,34,mt capgaznew navalacademi get littl nerdi first ever navycon
715,986594,19,icymi fall 2017 usnavi petti offic advanc quota releas via usnpeopl
716,986594,43,mt amphib7flt way usswasp sail atlant ocean head japan 2 month relief effort
717,986594,50,stronger famili stronger fleet cnorichardson releas usnavi famili framework outlin goal way ahead
718,986594,687,mt flynavi second usnavi p8a poseidon multimiss maritim aircraft deploy join ongo intern se
719,986594,54,mt uspacificfleet usshiggin depart sandiego deploy us7thfleet us5thfleet
720,986594,93,one done cnorichardson elimin threeyear pepper spray recertif requir follow fleet feedbac
721,986594,110,around fleet today usnavi photo day info download
722,986594,93,usscoronado depart us7thfleet success indoasiapacif deploy file pic
723,986594,141,mt mscsealift usnscomfort return naval station norfolk monday complet medic mission
724,986594,70,otd 1942 usscincinnati amp usssom uncov norwegian ship ss skjilbr german blockad runner
725,986594,76,icymi around fleet monday usnavi photo day info download
726,986594,115,around fleet today usnavi photo day info download
727,986594,39,fall 2017 usnavi petti offic advanc quota releas via usnpeopl
728,986594,69,icymi usnavi set new physic fit standard start boot camp
729,986594,64,mt us7thfleet restrict place us servic member japan follow fatal accid sunday
730,986594,68,mt usnavyeurop ussdonaldcook back rota thanksgiv wearenato partnerstrong
731,986594,109,look mondaymotiv look look usnavi oper forward
732,986594,31,icymi navalacademi class 2018 receiv servic assign
733,986594,722,break usnavi deploy unman submers argentin submarin search file phot
734,986594,139,cnorichardson usnavi fleet readi earn titl best navi world
735,986594,194,usnavi photo nov 1217
736,986594,219,usswayneemey rescu three marin sink vessel
737,986594,1218,break first usairforc c17 globemast iii depart mcasmiramarca argentina rescu asset suppor
738,986594,1510,break submarin rescu chamber asset mobil mcasmiramarca support search argent
739,986594,92,mt uspacificfleet usspinckney join 20 ship 18 navi asean intern fleet review thailand
740,986594,1324,break undersea rescu command order deploy argentina support ongo search argentinean navi su
741,986594,65,vcno adm moran navalacademi superintend vadm carter readi beatnd
742,986594,107,gonavi navyfootbal cold rain snow way want beatnd raisethesail
743,986594,1,stennis74 nice job shipmat
744,986594,1,mogmurvin welcom usnavi famili
745,986594,3,jimsciutto thank famili servic
746,986594,0,lisssullivan want
747,986594,65,navalacademi class 2018 receiv servic assign
748,986594,726,usnavi p8a poseidon support argentina search submarin file photo
749,986594,112,mt us7thfleet japanes tug lost propuls drift ussbenfold tow exercis one
750,986594,432,love smell flight op morn ussiwojima bluegreenteam prepar deploy
751,986594,74,around fleet friday usnavi photo day info download
752,986594,101,around fleet today usnavi photo day info download
753,986594,142,navsurfor pass thoma j hudner jr lost true american hero ddg116 comm
754,986594,135,mt uspacificfleet usscarlvinson carrier strike group wrap sustain exercis pacif
755,986594,93,cnorichardson usnavi fleet readi earn titl best navi world
756,986594,232,800 famili friend servic member pay final respect retir medalofhonor receipi capt
757,986594,39,cnorichardson destroy crew ive got back
758,986594,59,live watch usnavi newest sailor graduat boot camp
759,986594,65,live 945a et watch usnavi newest sailor graduat boot camp
760,986594,79,around fleet thursday usnavi photo day info download
761,986594,0,malvarami otd day
762,986594,40,correct ussmakinisland commiss oct 24 2009
763,986594,79,correct got littl eager celebr ussenterpris commiss anniversari nov 25 1961
764,986594,206,otd 1961 uss enterpris us navi first nuclearpow aircraft carrier commiss newport new
765,986594,60,otd 2009 amphibi assault ship ussmakinisland commiss eighth final vessel usswasp
766,986594,22,onlin retir request readi
767,986594,93,tbt otd 1963 presid john f kennedi board uss observ island eag 154 wit uss andrew ja
768,986594,94,usnavi accept deliveri futur ussralphjohnson
769,986594,59,around fleet today usnavi photo day info download
770,986594,75,usnavi set new physic fit standard start boot camp
771,986594,75,mt cnorichardson cno visit sailor aboard usskentucki navalbasekitsap wednesday sailor serv
772,986594,163,thursdaythought flight op aboard aircraft carrier joke thank usnavi sailor best
773,986594,179,today usnavi japan maritim selfdefens forc set conduct annual exercis bilater train increa
774,986594,50,keel laid futur uss lenah h sutcliff higbe via navsea
775,986594,43,mt surfacewarrior navsurfor vadm rowden congratul newest warfar tactic instructor naval surfac
776,986594,33,mt navymedicin usnavi top doc vadm faison hand call naval hospit bremerton amaz
777,986594,33,mt navalwarcolleg congratul graduat welcom alumni rank photo
778,986594,110,around fleet today usnavi photo day info download
779,986594,52,mt mscsealift usnscomfort continu provid humanitarian relief work alongsid hhsgov disast medic
780,986594,17,mt secnav76 end day fiduciari respons buy best best valu th
781,986594,72,mt uspacificfleet usshalsey complet port visit guam deploy continu us7thfleet
782,986594,280,thegiftig sacrific usnavi sailor alway stand watch around world
783,986594,118,otd 1910 eugen eli pilot first aircraft takeoff warship ussbirmingham
784,986594,73,uniqu opportun rare aggreg forc way rear adm greg harr
785,986594,107,us7thfleet day night sailor aboard ussnimitz alway mission readi
786,986594,106,otd 1906 presid theodor roosevelt becom first presid visit foreign countri offic tra
787,986594,123,around fleet today usnavi photo day info download
788,986594,83,watch shipmat mt bostonglob thoma j hudner usnavi war hero veteran affair commission
789,986594,256,pacificcommand navi earth capabl coordin oper three carrier strike g
790,986594,49,ussdonaldcook depart aksaz turkey particip exercis dogu akdeniz 2017
791,986594,450,three usnavi carrier strike group exercis western pacif reinforc commit allianc partner
792,986594,33,mt navsurfor thank usnhistori amp uss san francisco memori foundat great veteransday amp
793,986594,84,mt secnav76 today usnavi lost legendari aviat retir usnavi captain thoma hudner pass away rest
794,986594,72,mt blueangel welcom aboard boss squadron held chang command sunday pleas welcom cmdr eric doyl
795,986594,211,otd 1942 five sullivan brother lost uss juneau cl 52 destroy naval battl gu
796,986594,130,around fleet today usnavi photo day info download
797,986594,32,live 1p et mt usnhistori join nhhc facebookl discuss import naval battl guadal
798,986594,266,around fleet sunday usnavi photo day info download
799,986594,77,usnavi usfleetforc adm davidson veteransday import quit simpl person day com
800,986594,13,former cmf deputi command award legion merit
801,986594,42,happi 50th anniversari navyjag celebr learn histori usnavi judg advoc usnjag50
802,986594,68,around fleet today usnavi photo day info download
803,986594,51,live watch usnavi newest sailor graduat boot camp
804,986594,80,usscoronado return san diego 18month deploy welcom home shipmat
805,986594,41,live 945a et watch usnavi newest sailor graduat boot camp
806,986594,56,4 chang need know navi portal
807,986594,148,dalla hold inactiv ceremoni 36 year servic
808,986594,50,lt cmdr robert lennon honor 2017 health care hero
809,986594,321,radioman 3rd class howard w bean assign ussoklahoma wwii laid rest arlingtonnatl yesterd
810,986594,150,usnhistori attack pearlharbor last one hour 15 minut check interest stori map th
811,986594,390,usnhistori attack pearlharbor 2403 total live lost includ 68 civilian read
812,986594,288,mt usnhistori otd 76 year ago japanes militari launch surpris attack us naval base
813,986594,313,live et pearlharbor76 remembr day ceremoni
814,986594,197,live 1245p et pearlharbor76 remembr day ceremoni
815,986594,117,around fleet today usnavi photo day info download
816,986594,122,namesak famili tiger embark usshoward
817,986594,108,new york board team forc maritim secur
818,986594,141,uss nimitz return naval base kitsap
819,986594,85,navi announc 2018 navi week schedul file photo
820,986594,137,around fleet today usnavi photo day info download
821,986594,45,mt secnav76 icymi morn secnav76 swore mr jame hondo geurt next assist secretari
822,986594,34,mt icymi secnav76 spoke us naval institut 2017 defens forum discuss prioriti amp sha
823,986594,204,navi launch new brand campaign taglin armynavi game
824,986594,37,mt icymi secnav76 swore mr thoma b modli monday dec 3 2017 usnavyundersec navi
825,986594,134,peopl make us navi best world around fleet today usnavi photo day info
826,986594,79,usslakeeri arriv hawaii seven month deploy 7th 5th fleet area oper
827,986594,119,icymi navi posthum award bronz star medal valor chief boatswain mate joseph l georg
828,986594,123,mondaymotiv hooyah one week closer holiday leav
829,986594,142,around fleet today usnavi photo day info download
830,986594,55,icymi usnavi spearhead deptofdefens hivaid prevent program via allhandsmag
831,986594,215,ussstethem return yokosuka japan fall patrol western pacif file pic
832,986594,93,mt amphib7flt usswasp make stop brazil steadili make way across atlant pacif
833,986594,121,usnavi doctor bring medic care amazon navymedicin
834,986594,143,usnavi posthum award bronz star medal valor pearlharbor via usnhistori
835,986594,387,usstheodoreroosevelt carrier strike group carrier air wing 17 began sorti friday arabiangulf supporti
836,986594,69,icymi around fleet friday usnavi photo day info download
837,986594,142,today ussfitzgerald depart fleet activ yokosuka aboard heavi lift transport vessel mv transshelf
838,986594,282,today usstheodoreroosevelt carrier strike group carrier air wing 17 begin sorti arabiangulf supporti
839,986594,57,navairnew look leverag vr tech flight simul trainer flynavi
840,986594,61,around fleet today usnavi photo day info download
841,986594,41,usnavi spearhead deptofdefens hivaid prevent program via allhandsmag
842,986594,426,today usstheodoreroosevelt carrier strike group carrier air wing 17 begin sorti arabiangulf supporti
843,986594,194,fridayfeel pictur say thousand word
844,986594,47,live watch usnavi newest sailor graduat boot camp
845,986594,74,live 945a et watch usnavi newest sailor graduat boot camp
846,986594,280,wwii usnavi veteran celebr 100th birthday
847,986594,41,usnavi weather radar support hurrican relief effort hurricaneseason
848,986594,64,usnavi doctor bring medic care amazon
849,986594,132,tbt 2017 hurrican season end today recogn hard work usnavi shipmat follow hur
850,986594,1,septiceyefanzz mustang904 jeff charact guid peopl annual mandatori computerbas
851,986594,64,oper safe digit environ protect usnavi cybersecur hand effort vigil
852,986594,272,thursdaythought one word wow
853,986594,33,secnav76 censur retir senior offic follow thorough review interact glenn defens marin
854,986594,89,ussvellagulf visit agadir morocco
855,986594,66,amphibi squadron 1 hold chang command ceremoni
856,986594,100,ussjamesewilliam arriv odessa ukrain
857,986594,108,around fleet today usnavi photo day info download
858,986594,48,amphib7flt final shot usschief 3ja wrap jmsdf
859,986594,33,mt surfacewarrior surflant command radm wilson visit littor combat ship train facil navbasesd
860,986594,180,otd 1995 first super hornet make first flight two year super hornet initi sea trial seen
861,986594,19,adm moran schoolhous expens build send peopl much better bring
862,986594,30,adm moran build bigger sophist usnavi fail properli train sailor iitsec
863,986594,18,adm moran go push hard think need usnavi partnership industri iitsec
864,986594,14,adm moran want talk fundament train especi follow two collis past summer
865,986594,14,adm moran need pick pace us need look mirror messag pentagon wi
866,986594,40,vcno moran discuss transform usnavi train iitsec orlando
867,986594,31,soon vcno bill moran discuss transform usnavi train iitsec follow live
868,986594,40,morn vcno bill moran discuss transform usnavi train iitsec follow
869,986594,191,wednesdaywisdom shipmat never forget your part team greatest navi world usnavi
870,986594,152,initi usnavi japanbas cvw5 jet squadron flyin mca iwakuni file photo
871,986594,98,around fleet today usnavi photo day info download
872,986594,52,usnavi sailor submit tuition assist ncpace dl request januari term
873,986594,104,tuesdaythought navalacademi armynavi game navyfb uniform
874,986594,83,ussjohnsmccain depart subic bay en rout yokosuka repair return servic us7thfleet
875,986594,229,aloha ussillinoi arriv pearlharbor
876,986594,391,ussronaldreagan memori servic rememb honor three shipmat lost c2a crash
877,986594,114,around fleet today usnavi photo day info download
878,986594,41,mt amphib7flt usschief get underway water near hososhima begin 3ja jmsdf
879,986594,88,cybermonday rememb cyber threat real shop smart onlin know seller item
880,986594,443,ussronaldreagan memori servic rememb honor three shipmat lost c2a crash
881,986594,101,ussfitzgerald return fleet activ yokosuka aboard mv transshelf repair two punctur hull caus
882,986594,197,usnavi photo nov 2022
883,986594,487,mt secnav76 today join entir navi famili mourn loss lt steven comb airman matthew chiala
884,986594,352,cnorichardson loss three shipmat c2a greyhound crash navi team stick togeth ea
885,986594,112,ussfitzgerald depart fleet activ yokosuka begin journey pascagoula mississippi repair
886,986594,1355,break usnavi identifi sailor lost c2a crash
887,986594,64,stronger famili stronger fleet icymi cnorichardson releas usnavi famili framework outlin goal way ah
888,986594,505,otd 1961 usnavi first nuclearpow aircraft carrier ussenterpris cvan 65 commiss look back
889,986594,74,around fleet today usnavi photo day info download
890,986594,101,icymi ussfitzgerald depart fleet activ yokosuka begin journey pascagoula mississippi
891,986594,189,search end three usnavi sailor c2a crash investig underway file pic
892,986594,125,thank vp spend thanksgiv shipmat
893,986594,255,alwaysthankfulfor offic view
894,986594,260,break search end three usnavi sailor c2a crash file pic
895,986594,106,sinc forward navi mani shipmat away famili thanksgiv still go
896,986594,54,secnav76 secretari navi richard v spencer spent first thanksgiv secnav76 us5thfleet marin sailor
897,986594,92,mt us7thfleet ussfitzgerald ddg 62 depart fleet activ yokosuka meet heavi lift transport vessel
898,986594,259,think stress cook thanksgiv dinner famili tri cook meal 324000 peopl
899,986594,1698,happi thanksgiv usnavi thank opportun protect defend nation
900,986594,151,icymi search three sailor expand philippin sea follow c2a greyhound aircraft crash
901,986594,74,around fleet wednesday usnavi photo day info download
902,986594,252,search three sailor expand philippin sea follow c2a greyhound aircraft crash
903,986594,102,around fleet today usnavi photo day info download
904,986594,46,mt usnavyeurop sideboy salut secnav76 aboard ussmountwhitney coast napl itali
905,986594,58,fall 2017 petti offic advanc result releas via usnpeopl
906,986594,58,live watch usnavi newest sailor graduat boot camp
907,986594,26,today 11a et fall 2017 petti offic advanc result releas post allhandsmag
908,986594,594,cnorichardson statement c2a aircraft crash
909,986594,11326,realdonaldtrump usnavi conduct search rescu follow aircraft crash monitor situat prayer
910,986594,52,live 945a et watch usnavi newest sailor graduat boot camp
911,986594,154,inform latest updat
912,986594,1833,break updat eight personnel recov follow c2a greyhound crash transfer ussronaldreagan
913,986594,1018,break usnavi aircraft crash philippinesea carri 11 crew passeng en rout ussronaldreagan
914,986594,34,mt capgaznew navalacademi get littl nerdi first ever navycon
915,986594,19,icymi fall 2017 usnavi petti offic advanc quota releas via usnpeopl
916,986594,43,mt amphib7flt way usswasp sail atlant ocean head japan 2 month relief effort
917,986594,50,stronger famili stronger fleet cnorichardson releas usnavi famili framework outlin goal way ahead
918,986594,687,mt flynavi second usnavi p8a poseidon multimiss maritim aircraft deploy join ongo intern se
919,986594,54,mt uspacificfleet usshiggin depart sandiego deploy us7thfleet us5thfleet
920,986594,93,one done cnorichardson elimin threeyear pepper spray recertif requir follow fleet feedbac
921,986594,110,around fleet today usnavi photo day info download
922,986594,93,usscoronado depart us7thfleet success indoasiapacif deploy file pic
923,986594,141,mt mscsealift usnscomfort return naval station norfolk monday complet medic mission
924,986594,70,otd 1942 usscincinnati amp usssom uncov norwegian ship ss skjilbr german blockad runner
925,986594,76,icymi around fleet monday usnavi photo day info download
926,986594,115,around fleet today usnavi photo day info download
927,986594,39,fall 2017 usnavi petti offic advanc quota releas via usnpeopl
928,986594,69,icymi usnavi set new physic fit standard start boot camp
929,986594,64,mt us7thfleet restrict place us servic member japan follow fatal accid sunday
930,986594,68,mt usnavyeurop ussdonaldcook back rota thanksgiv wearenato partnerstrong
931,986594,109,look mondaymotiv look look usnavi oper forward
932,986594,31,icymi navalacademi class 2018 receiv servic assign
933,986594,722,break usnavi deploy unman submers argentin submarin search file phot
934,986594,139,cnorichardson usnavi fleet readi earn titl best navi world
935,986594,194,usnavi photo nov 1217
936,986594,219,usswayneemey rescu three marin sink vessel
937,986594,1218,break first usairforc c17 globemast iii depart mcasmiramarca argentina rescu asset suppor
938,986594,1510,break submarin rescu chamber asset mobil mcasmiramarca support search argent
939,986594,92,mt uspacificfleet usspinckney join 20 ship 18 navi asean intern fleet review thailand
940,986594,1324,break undersea rescu command order deploy argentina support ongo search argentinean navi su
941,986594,65,vcno adm moran navalacademi superintend vadm carter readi beatnd
942,986594,107,gonavi navyfootbal cold rain snow way want beatnd raisethesail
943,986594,1,stennis74 nice job shipmat
944,986594,1,mogmurvin welcom usnavi famili
945,986594,3,jimsciutto thank famili servic
946,986594,0,lisssullivan want
947,986594,65,navalacademi class 2018 receiv servic assign
948,986594,726,usnavi p8a poseidon support argentina search submarin file photo
949,986594,112,mt us7thfleet japanes tug lost propuls drift ussbenfold tow exercis one
950,986594,432,love smell flight op morn ussiwojima bluegreenteam prepar deploy
951,986594,74,around fleet friday usnavi photo day info download
952,986594,101,around fleet today usnavi photo day info download
953,986594,142,navsurfor pass thoma j hudner jr lost true american hero ddg116 comm
954,986594,135,mt uspacificfleet usscarlvinson carrier strike group wrap sustain exercis pacif
955,986594,93,cnorichardson usnavi fleet readi earn titl best navi world
956,986594,232,800 famili friend servic member pay final respect retir medalofhonor receipi capt
957,986594,39,cnorichardson destroy crew ive got back
958,986594,59,live watch usnavi newest sailor graduat boot camp
959,986594,65,live 945a et watch usnavi newest sailor graduat boot camp
960,986594,79,around fleet thursday usnavi photo day info download
961,986594,0,malvarami otd day
962,986594,40,correct ussmakinisland commiss oct 24 2009
963,986594,79,correct got littl eager celebr ussenterpris commiss anniversari nov 25 1961
964,986594,206,otd 1961 uss enterpris us navi first nuclearpow aircraft carrier commiss newport new
965,986594,60,otd 2009 amphibi assault ship ussmakinisland commiss eighth final vessel usswasp
966,986594,22,onlin retir request readi
967,986594,93,tbt otd 1963 presid john f kennedi board uss observ island eag 154 wit uss andrew ja
968,986594,94,usnavi accept deliveri futur ussralphjohnson
969,986594,59,around fleet today usnavi photo day info download
970,986594,75,usnavi set new physic fit standard start boot camp
971,986594,75,mt cnorichardson cno visit sailor aboard usskentucki navalbasekitsap wednesday sailor serv
972,986594,163,thursdaythought flight op aboard aircraft carrier joke thank usnavi sailor best
973,986594,179,today usnavi japan maritim selfdefens forc set conduct annual exercis bilater train increa
974,986594,50,keel laid futur uss lenah h sutcliff higbe via navsea
975,986594,43,mt surfacewarrior navsurfor vadm rowden congratul newest warfar tactic instructor naval surfac
976,986594,33,mt navymedicin usnavi top doc vadm faison hand call naval hospit bremerton amaz
977,986594,33,mt navalwarcolleg congratul graduat welcom alumni rank photo
978,986594,110,around fleet today usnavi photo day info download
979,986594,52,mt mscsealift usnscomfort continu provid humanitarian relief work alongsid hhsgov disast medic
980,986594,17,mt secnav76 end day fiduciari respons buy best best valu th
981,986594,72,mt uspacificfleet usshalsey complet port visit guam deploy continu us7thfleet
982,986594,280,thegiftig sacrific usnavi sailor alway stand watch around world
983,986594,118,otd 1910 eugen eli pilot first aircraft takeoff warship ussbirmingham
984,986594,73,uniqu opportun rare aggreg forc way rear adm greg harr
985,986594,107,us7thfleet day night sailor aboard ussnimitz alway mission readi
