Index,followers,rt,text
986,986594,106,otd 1906 presid theodor roosevelt becom first presid visit foreign countri offic tra
987,986594,123,around fleet today usnavi photo day info download
988,986594,83,watch shipmat mt bostonglob thoma j hudner usnavi war hero veteran affair commission
989,986594,256,pacificcommand navi earth capabl coordin oper three carrier strike g
990,986594,49,ussdonaldcook depart aksaz turkey particip exercis dogu akdeniz 2017
991,986594,450,three usnavi carrier strike group exercis western pacif reinforc commit allianc partner
992,986594,33,mt navsurfor thank usnhistori amp uss san francisco memori foundat great veteransday amp
993,986594,84,mt secnav76 today usnavi lost legendari aviat retir usnavi captain thoma hudner pass away rest
994,986594,72,mt blueangel welcom aboard boss squadron held chang command sunday pleas welcom cmdr eric doyl
995,986594,211,otd 1942 five sullivan brother lost uss juneau cl 52 destroy naval battl gu
996,986594,130,around fleet today usnavi photo day info download
997,986594,32,live 1p et mt usnhistori join nhhc facebookl discuss import naval battl guadal
998,986594,266,around fleet sunday usnavi photo day info download
999,986594,77,usnavi usfleetforc adm davidson veteransday import quit simpl person day com
