Index,followers,rt,text
0,986594,13,former cmf deputi command award legion merit
1,986594,42,happi 50th anniversari navyjag celebr learn histori usnavi judg advoc usnjag50
2,986594,68,around fleet today usnavi photo day info download
3,986594,51,live watch usnavi newest sailor graduat boot camp
4,986594,80,usscoronado return san diego 18month deploy welcom home shipmat
5,986594,41,live 945a et watch usnavi newest sailor graduat boot camp
6,986594,56,4 chang need know navi portal
7,986594,148,dalla hold inactiv ceremoni 36 year servic
8,986594,50,lt cmdr robert lennon honor 2017 health care hero
9,986594,321,radioman 3rd class howard w bean assign ussoklahoma wwii laid rest arlingtonnatl yesterd
10,986594,150,usnhistori attack pearlharbor last one hour 15 minut check interest stori map th
11,986594,390,usnhistori attack pearlharbor 2403 total live lost includ 68 civilian read
12,986594,288,mt usnhistori otd 76 year ago japanes militari launch surpris attack us naval base
13,986594,313,live et pearlharbor76 remembr day ceremoni
14,986594,197,live 1245p et pearlharbor76 remembr day ceremoni
15,986594,117,around fleet today usnavi photo day info download
16,986594,122,namesak famili tiger embark usshoward
17,986594,108,new york board team forc maritim secur
18,986594,141,uss nimitz return naval base kitsap
19,986594,85,navi announc 2018 navi week schedul file photo
20,986594,137,around fleet today usnavi photo day info download
21,986594,45,mt secnav76 icymi morn secnav76 swore mr jame hondo geurt next assist secretari
22,986594,34,mt icymi secnav76 spoke us naval institut 2017 defens forum discuss prioriti amp sha
23,986594,204,navi launch new brand campaign taglin armynavi game
24,986594,37,mt icymi secnav76 swore mr thoma b modli monday dec 3 2017 usnavyundersec navi
25,986594,134,peopl make us navi best world around fleet today usnavi photo day info
26,986594,79,usslakeeri arriv hawaii seven month deploy 7th 5th fleet area oper
27,986594,119,icymi navi posthum award bronz star medal valor chief boatswain mate joseph l georg
28,986594,123,mondaymotiv hooyah one week closer holiday leav
29,986594,142,around fleet today usnavi photo day info download
30,986594,55,icymi usnavi spearhead deptofdefens hivaid prevent program via allhandsmag
31,986594,215,ussstethem return yokosuka japan fall patrol western pacif file pic
32,986594,93,mt amphib7flt usswasp make stop brazil steadili make way across atlant pacif
33,986594,121,usnavi doctor bring medic care amazon navymedicin
34,986594,143,usnavi posthum award bronz star medal valor pearlharbor via usnhistori
35,986594,387,usstheodoreroosevelt carrier strike group carrier air wing 17 began sorti friday arabiangulf supporti
36,986594,69,icymi around fleet friday usnavi photo day info download
37,986594,142,today ussfitzgerald depart fleet activ yokosuka aboard heavi lift transport vessel mv transshelf
38,986594,282,today usstheodoreroosevelt carrier strike group carrier air wing 17 begin sorti arabiangulf supporti
39,986594,57,navairnew look leverag vr tech flight simul trainer flynavi
40,986594,61,around fleet today usnavi photo day info download
41,986594,41,usnavi spearhead deptofdefens hivaid prevent program via allhandsmag
42,986594,426,today usstheodoreroosevelt carrier strike group carrier air wing 17 begin sorti arabiangulf supporti
43,986594,194,fridayfeel pictur say thousand word
44,986594,47,live watch usnavi newest sailor graduat boot camp
45,986594,74,live 945a et watch usnavi newest sailor graduat boot camp
46,986594,280,wwii usnavi veteran celebr 100th birthday
47,986594,41,usnavi weather radar support hurrican relief effort hurricaneseason
48,986594,64,usnavi doctor bring medic care amazon
49,986594,132,tbt 2017 hurrican season end today recogn hard work usnavi shipmat follow hur
50,986594,1,septiceyefanzz mustang904 jeff charact guid peopl annual mandatori computerbas
51,986594,64,oper safe digit environ protect usnavi cybersecur hand effort vigil
52,986594,272,thursdaythought one word wow
53,986594,33,secnav76 censur retir senior offic follow thorough review interact glenn defens marin
54,986594,89,ussvellagulf visit agadir morocco
55,986594,66,amphibi squadron 1 hold chang command ceremoni
56,986594,100,ussjamesewilliam arriv odessa ukrain
57,986594,108,around fleet today usnavi photo day info download
58,986594,48,amphib7flt final shot usschief 3ja wrap jmsdf
59,986594,33,mt surfacewarrior surflant command radm wilson visit littor combat ship train facil navbasesd
60,986594,180,otd 1995 first super hornet make first flight two year super hornet initi sea trial seen
61,986594,19,adm moran schoolhous expens build send peopl much better bring
62,986594,30,adm moran build bigger sophist usnavi fail properli train sailor iitsec
63,986594,18,adm moran go push hard think need usnavi partnership industri iitsec
64,986594,14,adm moran want talk fundament train especi follow two collis past summer
65,986594,14,adm moran need pick pace us need look mirror messag pentagon wi
66,986594,40,vcno moran discuss transform usnavi train iitsec orlando
67,986594,31,soon vcno bill moran discuss transform usnavi train iitsec follow live
68,986594,40,morn vcno bill moran discuss transform usnavi train iitsec follow
69,986594,191,wednesdaywisdom shipmat never forget your part team greatest navi world usnavi
70,986594,152,initi usnavi japanbas cvw5 jet squadron flyin mca iwakuni file photo
71,986594,98,around fleet today usnavi photo day info download
72,986594,52,usnavi sailor submit tuition assist ncpace dl request januari term
73,986594,104,tuesdaythought navalacademi armynavi game navyfb uniform
74,986594,83,ussjohnsmccain depart subic bay en rout yokosuka repair return servic us7thfleet
75,986594,229,aloha ussillinoi arriv pearlharbor
76,986594,391,ussronaldreagan memori servic rememb honor three shipmat lost c2a crash
77,986594,114,around fleet today usnavi photo day info download
78,986594,41,mt amphib7flt usschief get underway water near hososhima begin 3ja jmsdf
79,986594,88,cybermonday rememb cyber threat real shop smart onlin know seller item
80,986594,443,ussronaldreagan memori servic rememb honor three shipmat lost c2a crash
81,986594,101,ussfitzgerald return fleet activ yokosuka aboard mv transshelf repair two punctur hull caus
82,986594,197,usnavi photo nov 2022
83,986594,487,mt secnav76 today join entir navi famili mourn loss lt steven comb airman matthew chiala
84,986594,352,cnorichardson loss three shipmat c2a greyhound crash navi team stick togeth ea
85,986594,112,ussfitzgerald depart fleet activ yokosuka begin journey pascagoula mississippi repair
86,986594,1355,break usnavi identifi sailor lost c2a crash
87,986594,64,stronger famili stronger fleet icymi cnorichardson releas usnavi famili framework outlin goal way ah
88,986594,505,otd 1961 usnavi first nuclearpow aircraft carrier ussenterpris cvan 65 commiss look back
89,986594,74,around fleet today usnavi photo day info download
90,986594,101,icymi ussfitzgerald depart fleet activ yokosuka begin journey pascagoula mississippi
91,986594,189,search end three usnavi sailor c2a crash investig underway file pic
92,986594,125,thank vp spend thanksgiv shipmat
93,986594,255,alwaysthankfulfor offic view
94,986594,260,break search end three usnavi sailor c2a crash file pic
95,986594,106,sinc forward navi mani shipmat away famili thanksgiv still go
96,986594,54,secnav76 secretari navi richard v spencer spent first thanksgiv secnav76 us5thfleet marin sailor
97,986594,92,mt us7thfleet ussfitzgerald ddg 62 depart fleet activ yokosuka meet heavi lift transport vessel
98,986594,259,think stress cook thanksgiv dinner famili tri cook meal 324000 peopl
99,986594,1698,happi thanksgiv usnavi thank opportun protect defend nation
100,986594,151,icymi search three sailor expand philippin sea follow c2a greyhound aircraft crash
101,986594,74,around fleet wednesday usnavi photo day info download
102,986594,252,search three sailor expand philippin sea follow c2a greyhound aircraft crash
103,986594,102,around fleet today usnavi photo day info download
104,986594,46,mt usnavyeurop sideboy salut secnav76 aboard ussmountwhitney coast napl itali
105,986594,58,fall 2017 petti offic advanc result releas via usnpeopl
106,986594,58,live watch usnavi newest sailor graduat boot camp
107,986594,26,today 11a et fall 2017 petti offic advanc result releas post allhandsmag
108,986594,594,cnorichardson statement c2a aircraft crash
109,986594,11326,realdonaldtrump usnavi conduct search rescu follow aircraft crash monitor situat prayer
110,986594,52,live 945a et watch usnavi newest sailor graduat boot camp
111,986594,154,inform latest updat
112,986594,1833,break updat eight personnel recov follow c2a greyhound crash transfer ussronaldreagan
113,986594,1018,break usnavi aircraft crash philippinesea carri 11 crew passeng en rout ussronaldreagan
114,986594,34,mt capgaznew navalacademi get littl nerdi first ever navycon
115,986594,19,icymi fall 2017 usnavi petti offic advanc quota releas via usnpeopl
116,986594,43,mt amphib7flt way usswasp sail atlant ocean head japan 2 month relief effort
117,986594,50,stronger famili stronger fleet cnorichardson releas usnavi famili framework outlin goal way ahead
118,986594,687,mt flynavi second usnavi p8a poseidon multimiss maritim aircraft deploy join ongo intern se
119,986594,54,mt uspacificfleet usshiggin depart sandiego deploy us7thfleet us5thfleet
120,986594,93,one done cnorichardson elimin threeyear pepper spray recertif requir follow fleet feedbac
121,986594,110,around fleet today usnavi photo day info download
122,986594,93,usscoronado depart us7thfleet success indoasiapacif deploy file pic
123,986594,141,mt mscsealift usnscomfort return naval station norfolk monday complet medic mission
124,986594,70,otd 1942 usscincinnati amp usssom uncov norwegian ship ss skjilbr german blockad runner
125,986594,76,icymi around fleet monday usnavi photo day info download
126,986594,115,around fleet today usnavi photo day info download
127,986594,39,fall 2017 usnavi petti offic advanc quota releas via usnpeopl
128,986594,69,icymi usnavi set new physic fit standard start boot camp
129,986594,64,mt us7thfleet restrict place us servic member japan follow fatal accid sunday
130,986594,68,mt usnavyeurop ussdonaldcook back rota thanksgiv wearenato partnerstrong
131,986594,109,look mondaymotiv look look usnavi oper forward
132,986594,31,icymi navalacademi class 2018 receiv servic assign
133,986594,722,break usnavi deploy unman submers argentin submarin search file phot
134,986594,139,cnorichardson usnavi fleet readi earn titl best navi world
135,986594,194,usnavi photo nov 1217
136,986594,219,usswayneemey rescu three marin sink vessel
137,986594,1218,break first usairforc c17 globemast iii depart mcasmiramarca argentina rescu asset suppor
138,986594,1510,break submarin rescu chamber asset mobil mcasmiramarca support search argent
139,986594,92,mt uspacificfleet usspinckney join 20 ship 18 navi asean intern fleet review thailand
140,986594,1324,break undersea rescu command order deploy argentina support ongo search argentinean navi su
141,986594,65,vcno adm moran navalacademi superintend vadm carter readi beatnd
142,986594,107,gonavi navyfootbal cold rain snow way want beatnd raisethesail
143,986594,1,stennis74 nice job shipmat
144,986594,1,mogmurvin welcom usnavi famili
145,986594,3,jimsciutto thank famili servic
146,986594,0,lisssullivan want
147,986594,65,navalacademi class 2018 receiv servic assign
148,986594,726,usnavi p8a poseidon support argentina search submarin file photo
149,986594,112,mt us7thfleet japanes tug lost propuls drift ussbenfold tow exercis one
150,986594,432,love smell flight op morn ussiwojima bluegreenteam prepar deploy
151,986594,74,around fleet friday usnavi photo day info download
152,986594,101,around fleet today usnavi photo day info download
153,986594,142,navsurfor pass thoma j hudner jr lost true american hero ddg116 comm
154,986594,135,mt uspacificfleet usscarlvinson carrier strike group wrap sustain exercis pacif
155,986594,93,cnorichardson usnavi fleet readi earn titl best navi world
156,986594,232,800 famili friend servic member pay final respect retir medalofhonor receipi capt
157,986594,39,cnorichardson destroy crew ive got back
158,986594,59,live watch usnavi newest sailor graduat boot camp
159,986594,65,live 945a et watch usnavi newest sailor graduat boot camp
160,986594,79,around fleet thursday usnavi photo day info download
161,986594,0,malvarami otd day
162,986594,40,correct ussmakinisland commiss oct 24 2009
163,986594,79,correct got littl eager celebr ussenterpris commiss anniversari nov 25 1961
164,986594,206,otd 1961 uss enterpris us navi first nuclearpow aircraft carrier commiss newport new
165,986594,60,otd 2009 amphibi assault ship ussmakinisland commiss eighth final vessel usswasp
166,986594,22,onlin retir request readi
167,986594,93,tbt otd 1963 presid john f kennedi board uss observ island eag 154 wit uss andrew ja
168,986594,94,usnavi accept deliveri futur ussralphjohnson
169,986594,59,around fleet today usnavi photo day info download
170,986594,75,usnavi set new physic fit standard start boot camp
171,986594,75,mt cnorichardson cno visit sailor aboard usskentucki navalbasekitsap wednesday sailor serv
172,986594,163,thursdaythought flight op aboard aircraft carrier joke thank usnavi sailor best
173,986594,179,today usnavi japan maritim selfdefens forc set conduct annual exercis bilater train increa
174,986594,50,keel laid futur uss lenah h sutcliff higbe via navsea
175,986594,43,mt surfacewarrior navsurfor vadm rowden congratul newest warfar tactic instructor naval surfac
176,986594,33,mt navymedicin usnavi top doc vadm faison hand call naval hospit bremerton amaz
177,986594,33,mt navalwarcolleg congratul graduat welcom alumni rank photo
178,986594,110,around fleet today usnavi photo day info download
179,986594,52,mt mscsealift usnscomfort continu provid humanitarian relief work alongsid hhsgov disast medic
180,986594,17,mt secnav76 end day fiduciari respons buy best best valu th
181,986594,72,mt uspacificfleet usshalsey complet port visit guam deploy continu us7thfleet
182,986594,280,thegiftig sacrific usnavi sailor alway stand watch around world
183,986594,118,otd 1910 eugen eli pilot first aircraft takeoff warship ussbirmingham
184,986594,73,uniqu opportun rare aggreg forc way rear adm greg harr
185,986594,107,us7thfleet day night sailor aboard ussnimitz alway mission readi
186,986594,106,otd 1906 presid theodor roosevelt becom first presid visit foreign countri offic tra
187,986594,123,around fleet today usnavi photo day info download
188,986594,83,watch shipmat mt bostonglob thoma j hudner usnavi war hero veteran affair commission
189,986594,256,pacificcommand navi earth capabl coordin oper three carrier strike g
190,986594,49,ussdonaldcook depart aksaz turkey particip exercis dogu akdeniz 2017
191,986594,450,three usnavi carrier strike group exercis western pacif reinforc commit allianc partner
192,986594,33,mt navsurfor thank usnhistori amp uss san francisco memori foundat great veteransday amp
193,986594,84,mt secnav76 today usnavi lost legendari aviat retir usnavi captain thoma hudner pass away rest
194,986594,72,mt blueangel welcom aboard boss squadron held chang command sunday pleas welcom cmdr eric doyl
195,986594,211,otd 1942 five sullivan brother lost uss juneau cl 52 destroy naval battl gu
196,986594,130,around fleet today usnavi photo day info download
197,986594,32,live 1p et mt usnhistori join nhhc facebookl discuss import naval battl guadal
198,986594,266,around fleet sunday usnavi photo day info download
199,986594,77,usnavi usfleetforc adm davidson veteransday import quit simpl person day com
200,986594,13,former cmf deputi command award legion merit
201,986594,42,happi 50th anniversari navyjag celebr learn histori usnavi judg advoc usnjag50
202,986594,68,around fleet today usnavi photo day info download
203,986594,51,live watch usnavi newest sailor graduat boot camp
204,986594,80,usscoronado return san diego 18month deploy welcom home shipmat
205,986594,41,live 945a et watch usnavi newest sailor graduat boot camp
206,986594,56,4 chang need know navi portal
207,986594,148,dalla hold inactiv ceremoni 36 year servic
208,986594,50,lt cmdr robert lennon honor 2017 health care hero
209,986594,321,radioman 3rd class howard w bean assign ussoklahoma wwii laid rest arlingtonnatl yesterd
210,986594,150,usnhistori attack pearlharbor last one hour 15 minut check interest stori map th
211,986594,390,usnhistori attack pearlharbor 2403 total live lost includ 68 civilian read
212,986594,288,mt usnhistori otd 76 year ago japanes militari launch surpris attack us naval base
213,986594,313,live et pearlharbor76 remembr day ceremoni
214,986594,197,live 1245p et pearlharbor76 remembr day ceremoni
215,986594,117,around fleet today usnavi photo day info download
216,986594,122,namesak famili tiger embark usshoward
217,986594,108,new york board team forc maritim secur
218,986594,141,uss nimitz return naval base kitsap
219,986594,85,navi announc 2018 navi week schedul file photo
220,986594,137,around fleet today usnavi photo day info download
221,986594,45,mt secnav76 icymi morn secnav76 swore mr jame hondo geurt next assist secretari
222,986594,34,mt icymi secnav76 spoke us naval institut 2017 defens forum discuss prioriti amp sha
223,986594,204,navi launch new brand campaign taglin armynavi game
224,986594,37,mt icymi secnav76 swore mr thoma b modli monday dec 3 2017 usnavyundersec navi
225,986594,134,peopl make us navi best world around fleet today usnavi photo day info
226,986594,79,usslakeeri arriv hawaii seven month deploy 7th 5th fleet area oper
227,986594,119,icymi navi posthum award bronz star medal valor chief boatswain mate joseph l georg
228,986594,123,mondaymotiv hooyah one week closer holiday leav
229,986594,142,around fleet today usnavi photo day info download
230,986594,55,icymi usnavi spearhead deptofdefens hivaid prevent program via allhandsmag
231,986594,215,ussstethem return yokosuka japan fall patrol western pacif file pic
232,986594,93,mt amphib7flt usswasp make stop brazil steadili make way across atlant pacif
233,986594,121,usnavi doctor bring medic care amazon navymedicin
234,986594,143,usnavi posthum award bronz star medal valor pearlharbor via usnhistori
235,986594,387,usstheodoreroosevelt carrier strike group carrier air wing 17 began sorti friday arabiangulf supporti
236,986594,69,icymi around fleet friday usnavi photo day info download
237,986594,142,today ussfitzgerald depart fleet activ yokosuka aboard heavi lift transport vessel mv transshelf
238,986594,282,today usstheodoreroosevelt carrier strike group carrier air wing 17 begin sorti arabiangulf supporti
239,986594,57,navairnew look leverag vr tech flight simul trainer flynavi
240,986594,61,around fleet today usnavi photo day info download
241,986594,41,usnavi spearhead deptofdefens hivaid prevent program via allhandsmag
242,986594,426,today usstheodoreroosevelt carrier strike group carrier air wing 17 begin sorti arabiangulf supporti
243,986594,194,fridayfeel pictur say thousand word
244,986594,47,live watch usnavi newest sailor graduat boot camp
245,986594,74,live 945a et watch usnavi newest sailor graduat boot camp
246,986594,280,wwii usnavi veteran celebr 100th birthday
247,986594,41,usnavi weather radar support hurrican relief effort hurricaneseason
248,986594,64,usnavi doctor bring medic care amazon
249,986594,132,tbt 2017 hurrican season end today recogn hard work usnavi shipmat follow hur
250,986594,1,septiceyefanzz mustang904 jeff charact guid peopl annual mandatori computerbas
251,986594,64,oper safe digit environ protect usnavi cybersecur hand effort vigil
252,986594,272,thursdaythought one word wow
253,986594,33,secnav76 censur retir senior offic follow thorough review interact glenn defens marin
254,986594,89,ussvellagulf visit agadir morocco
255,986594,66,amphibi squadron 1 hold chang command ceremoni
256,986594,100,ussjamesewilliam arriv odessa ukrain
257,986594,108,around fleet today usnavi photo day info download
258,986594,48,amphib7flt final shot usschief 3ja wrap jmsdf
259,986594,33,mt surfacewarrior surflant command radm wilson visit littor combat ship train facil navbasesd
260,986594,180,otd 1995 first super hornet make first flight two year super hornet initi sea trial seen
261,986594,19,adm moran schoolhous expens build send peopl much better bring
262,986594,30,adm moran build bigger sophist usnavi fail properli train sailor iitsec
263,986594,18,adm moran go push hard think need usnavi partnership industri iitsec
264,986594,14,adm moran want talk fundament train especi follow two collis past summer
265,986594,14,adm moran need pick pace us need look mirror messag pentagon wi
266,986594,40,vcno moran discuss transform usnavi train iitsec orlando
267,986594,31,soon vcno bill moran discuss transform usnavi train iitsec follow live
268,986594,40,morn vcno bill moran discuss transform usnavi train iitsec follow
269,986594,191,wednesdaywisdom shipmat never forget your part team greatest navi world usnavi
270,986594,152,initi usnavi japanbas cvw5 jet squadron flyin mca iwakuni file photo
271,986594,98,around fleet today usnavi photo day info download
272,986594,52,usnavi sailor submit tuition assist ncpace dl request januari term
273,986594,104,tuesdaythought navalacademi armynavi game navyfb uniform
274,986594,83,ussjohnsmccain depart subic bay en rout yokosuka repair return servic us7thfleet
275,986594,229,aloha ussillinoi arriv pearlharbor
276,986594,391,ussronaldreagan memori servic rememb honor three shipmat lost c2a crash
277,986594,114,around fleet today usnavi photo day info download
278,986594,41,mt amphib7flt usschief get underway water near hososhima begin 3ja jmsdf
279,986594,88,cybermonday rememb cyber threat real shop smart onlin know seller item
280,986594,443,ussronaldreagan memori servic rememb honor three shipmat lost c2a crash
281,986594,101,ussfitzgerald return fleet activ yokosuka aboard mv transshelf repair two punctur hull caus
282,986594,197,usnavi photo nov 2022
283,986594,487,mt secnav76 today join entir navi famili mourn loss lt steven comb airman matthew chiala
284,986594,352,cnorichardson loss three shipmat c2a greyhound crash navi team stick togeth ea
285,986594,112,ussfitzgerald depart fleet activ yokosuka begin journey pascagoula mississippi repair
286,986594,1355,break usnavi identifi sailor lost c2a crash
287,986594,64,stronger famili stronger fleet icymi cnorichardson releas usnavi famili framework outlin goal way ah
288,986594,505,otd 1961 usnavi first nuclearpow aircraft carrier ussenterpris cvan 65 commiss look back
289,986594,74,around fleet today usnavi photo day info download
290,986594,101,icymi ussfitzgerald depart fleet activ yokosuka begin journey pascagoula mississippi
291,986594,189,search end three usnavi sailor c2a crash investig underway file pic
292,986594,125,thank vp spend thanksgiv shipmat
293,986594,255,alwaysthankfulfor offic view
294,986594,260,break search end three usnavi sailor c2a crash file pic
295,986594,106,sinc forward navi mani shipmat away famili thanksgiv still go
296,986594,54,secnav76 secretari navi richard v spencer spent first thanksgiv secnav76 us5thfleet marin sailor
297,986594,92,mt us7thfleet ussfitzgerald ddg 62 depart fleet activ yokosuka meet heavi lift transport vessel
298,986594,259,think stress cook thanksgiv dinner famili tri cook meal 324000 peopl
299,986594,1698,happi thanksgiv usnavi thank opportun protect defend nation
300,986594,151,icymi search three sailor expand philippin sea follow c2a greyhound aircraft crash
301,986594,74,around fleet wednesday usnavi photo day info download
302,986594,252,search three sailor expand philippin sea follow c2a greyhound aircraft crash
303,986594,102,around fleet today usnavi photo day info download
304,986594,46,mt usnavyeurop sideboy salut secnav76 aboard ussmountwhitney coast napl itali
305,986594,58,fall 2017 petti offic advanc result releas via usnpeopl
306,986594,58,live watch usnavi newest sailor graduat boot camp
307,986594,26,today 11a et fall 2017 petti offic advanc result releas post allhandsmag
308,986594,594,cnorichardson statement c2a aircraft crash
309,986594,11326,realdonaldtrump usnavi conduct search rescu follow aircraft crash monitor situat prayer
310,986594,52,live 945a et watch usnavi newest sailor graduat boot camp
311,986594,154,inform latest updat
312,986594,1833,break updat eight personnel recov follow c2a greyhound crash transfer ussronaldreagan
313,986594,1018,break usnavi aircraft crash philippinesea carri 11 crew passeng en rout ussronaldreagan
314,986594,34,mt capgaznew navalacademi get littl nerdi first ever navycon
315,986594,19,icymi fall 2017 usnavi petti offic advanc quota releas via usnpeopl
316,986594,43,mt amphib7flt way usswasp sail atlant ocean head japan 2 month relief effort
317,986594,50,stronger famili stronger fleet cnorichardson releas usnavi famili framework outlin goal way ahead
318,986594,687,mt flynavi second usnavi p8a poseidon multimiss maritim aircraft deploy join ongo intern se
319,986594,54,mt uspacificfleet usshiggin depart sandiego deploy us7thfleet us5thfleet
320,986594,93,one done cnorichardson elimin threeyear pepper spray recertif requir follow fleet feedbac
321,986594,110,around fleet today usnavi photo day info download
322,986594,93,usscoronado depart us7thfleet success indoasiapacif deploy file pic
323,986594,141,mt mscsealift usnscomfort return naval station norfolk monday complet medic mission
324,986594,70,otd 1942 usscincinnati amp usssom uncov norwegian ship ss skjilbr german blockad runner
325,986594,76,icymi around fleet monday usnavi photo day info download
326,986594,115,around fleet today usnavi photo day info download
327,986594,39,fall 2017 usnavi petti offic advanc quota releas via usnpeopl
328,986594,69,icymi usnavi set new physic fit standard start boot camp
