Index,followers,rt,text
329,986594,64,mt us7thfleet restrict place us servic member japan follow fatal accid sunday
330,986594,68,mt usnavyeurop ussdonaldcook back rota thanksgiv wearenato partnerstrong
331,986594,109,look mondaymotiv look look usnavi oper forward
332,986594,31,icymi navalacademi class 2018 receiv servic assign
333,986594,722,break usnavi deploy unman submers argentin submarin search file phot
334,986594,139,cnorichardson usnavi fleet readi earn titl best navi world
335,986594,194,usnavi photo nov 1217
336,986594,219,usswayneemey rescu three marin sink vessel
337,986594,1218,break first usairforc c17 globemast iii depart mcasmiramarca argentina rescu asset suppor
338,986594,1510,break submarin rescu chamber asset mobil mcasmiramarca support search argent
339,986594,92,mt uspacificfleet usspinckney join 20 ship 18 navi asean intern fleet review thailand
340,986594,1324,break undersea rescu command order deploy argentina support ongo search argentinean navi su
341,986594,65,vcno adm moran navalacademi superintend vadm carter readi beatnd
342,986594,107,gonavi navyfootbal cold rain snow way want beatnd raisethesail
343,986594,1,stennis74 nice job shipmat
344,986594,1,mogmurvin welcom usnavi famili
345,986594,3,jimsciutto thank famili servic
346,986594,0,lisssullivan want
347,986594,65,navalacademi class 2018 receiv servic assign
348,986594,726,usnavi p8a poseidon support argentina search submarin file photo
349,986594,112,mt us7thfleet japanes tug lost propuls drift ussbenfold tow exercis one
350,986594,432,love smell flight op morn ussiwojima bluegreenteam prepar deploy
351,986594,74,around fleet friday usnavi photo day info download
352,986594,101,around fleet today usnavi photo day info download
353,986594,142,navsurfor pass thoma j hudner jr lost true american hero ddg116 comm
354,986594,135,mt uspacificfleet usscarlvinson carrier strike group wrap sustain exercis pacif
355,986594,93,cnorichardson usnavi fleet readi earn titl best navi world
356,986594,232,800 famili friend servic member pay final respect retir medalofhonor receipi capt
357,986594,39,cnorichardson destroy crew ive got back
358,986594,59,live watch usnavi newest sailor graduat boot camp
359,986594,65,live 945a et watch usnavi newest sailor graduat boot camp
360,986594,79,around fleet thursday usnavi photo day info download
361,986594,0,malvarami otd day
362,986594,40,correct ussmakinisland commiss oct 24 2009
363,986594,79,correct got littl eager celebr ussenterpris commiss anniversari nov 25 1961
364,986594,206,otd 1961 uss enterpris us navi first nuclearpow aircraft carrier commiss newport new
365,986594,60,otd 2009 amphibi assault ship ussmakinisland commiss eighth final vessel usswasp
366,986594,22,onlin retir request readi
367,986594,93,tbt otd 1963 presid john f kennedi board uss observ island eag 154 wit uss andrew ja
368,986594,94,usnavi accept deliveri futur ussralphjohnson
369,986594,59,around fleet today usnavi photo day info download
370,986594,75,usnavi set new physic fit standard start boot camp
371,986594,75,mt cnorichardson cno visit sailor aboard usskentucki navalbasekitsap wednesday sailor serv
372,986594,163,thursdaythought flight op aboard aircraft carrier joke thank usnavi sailor best
373,986594,179,today usnavi japan maritim selfdefens forc set conduct annual exercis bilater train increa
374,986594,50,keel laid futur uss lenah h sutcliff higbe via navsea
375,986594,43,mt surfacewarrior navsurfor vadm rowden congratul newest warfar tactic instructor naval surfac
376,986594,33,mt navymedicin usnavi top doc vadm faison hand call naval hospit bremerton amaz
377,986594,33,mt navalwarcolleg congratul graduat welcom alumni rank photo
378,986594,110,around fleet today usnavi photo day info download
379,986594,52,mt mscsealift usnscomfort continu provid humanitarian relief work alongsid hhsgov disast medic
380,986594,17,mt secnav76 end day fiduciari respons buy best best valu th
381,986594,72,mt uspacificfleet usshalsey complet port visit guam deploy continu us7thfleet
382,986594,280,thegiftig sacrific usnavi sailor alway stand watch around world
383,986594,118,otd 1910 eugen eli pilot first aircraft takeoff warship ussbirmingham
384,986594,73,uniqu opportun rare aggreg forc way rear adm greg harr
385,986594,107,us7thfleet day night sailor aboard ussnimitz alway mission readi
386,986594,106,otd 1906 presid theodor roosevelt becom first presid visit foreign countri offic tra
387,986594,123,around fleet today usnavi photo day info download
388,986594,83,watch shipmat mt bostonglob thoma j hudner usnavi war hero veteran affair commission
389,986594,256,pacificcommand navi earth capabl coordin oper three carrier strike g
390,986594,49,ussdonaldcook depart aksaz turkey particip exercis dogu akdeniz 2017
391,986594,450,three usnavi carrier strike group exercis western pacif reinforc commit allianc partner
392,986594,33,mt navsurfor thank usnhistori amp uss san francisco memori foundat great veteransday amp
393,986594,84,mt secnav76 today usnavi lost legendari aviat retir usnavi captain thoma hudner pass away rest
394,986594,72,mt blueangel welcom aboard boss squadron held chang command sunday pleas welcom cmdr eric doyl
395,986594,211,otd 1942 five sullivan brother lost uss juneau cl 52 destroy naval battl gu
396,986594,130,around fleet today usnavi photo day info download
397,986594,32,live 1p et mt usnhistori join nhhc facebookl discuss import naval battl guadal
398,986594,266,around fleet sunday usnavi photo day info download
399,986594,77,usnavi usfleetforc adm davidson veteransday import quit simpl person day com
400,986594,13,former cmf deputi command award legion merit
401,986594,42,happi 50th anniversari navyjag celebr learn histori usnavi judg advoc usnjag50
402,986594,68,around fleet today usnavi photo day info download
403,986594,51,live watch usnavi newest sailor graduat boot camp
404,986594,80,usscoronado return san diego 18month deploy welcom home shipmat
405,986594,41,live 945a et watch usnavi newest sailor graduat boot camp
406,986594,56,4 chang need know navi portal
407,986594,148,dalla hold inactiv ceremoni 36 year servic
408,986594,50,lt cmdr robert lennon honor 2017 health care hero
409,986594,321,radioman 3rd class howard w bean assign ussoklahoma wwii laid rest arlingtonnatl yesterd
410,986594,150,usnhistori attack pearlharbor last one hour 15 minut check interest stori map th
411,986594,390,usnhistori attack pearlharbor 2403 total live lost includ 68 civilian read
412,986594,288,mt usnhistori otd 76 year ago japanes militari launch surpris attack us naval base
413,986594,313,live et pearlharbor76 remembr day ceremoni
414,986594,197,live 1245p et pearlharbor76 remembr day ceremoni
415,986594,117,around fleet today usnavi photo day info download
416,986594,122,namesak famili tiger embark usshoward
417,986594,108,new york board team forc maritim secur
418,986594,141,uss nimitz return naval base kitsap
419,986594,85,navi announc 2018 navi week schedul file photo
420,986594,137,around fleet today usnavi photo day info download
421,986594,45,mt secnav76 icymi morn secnav76 swore mr jame hondo geurt next assist secretari
422,986594,34,mt icymi secnav76 spoke us naval institut 2017 defens forum discuss prioriti amp sha
423,986594,204,navi launch new brand campaign taglin armynavi game
424,986594,37,mt icymi secnav76 swore mr thoma b modli monday dec 3 2017 usnavyundersec navi
425,986594,134,peopl make us navi best world around fleet today usnavi photo day info
426,986594,79,usslakeeri arriv hawaii seven month deploy 7th 5th fleet area oper
427,986594,119,icymi navi posthum award bronz star medal valor chief boatswain mate joseph l georg
428,986594,123,mondaymotiv hooyah one week closer holiday leav
429,986594,142,around fleet today usnavi photo day info download
430,986594,55,icymi usnavi spearhead deptofdefens hivaid prevent program via allhandsmag
431,986594,215,ussstethem return yokosuka japan fall patrol western pacif file pic
432,986594,93,mt amphib7flt usswasp make stop brazil steadili make way across atlant pacif
433,986594,121,usnavi doctor bring medic care amazon navymedicin
434,986594,143,usnavi posthum award bronz star medal valor pearlharbor via usnhistori
435,986594,387,usstheodoreroosevelt carrier strike group carrier air wing 17 began sorti friday arabiangulf supporti
436,986594,69,icymi around fleet friday usnavi photo day info download
437,986594,142,today ussfitzgerald depart fleet activ yokosuka aboard heavi lift transport vessel mv transshelf
438,986594,282,today usstheodoreroosevelt carrier strike group carrier air wing 17 begin sorti arabiangulf supporti
439,986594,57,navairnew look leverag vr tech flight simul trainer flynavi
440,986594,61,around fleet today usnavi photo day info download
441,986594,41,usnavi spearhead deptofdefens hivaid prevent program via allhandsmag
442,986594,426,today usstheodoreroosevelt carrier strike group carrier air wing 17 begin sorti arabiangulf supporti
443,986594,194,fridayfeel pictur say thousand word
444,986594,47,live watch usnavi newest sailor graduat boot camp
445,986594,74,live 945a et watch usnavi newest sailor graduat boot camp
446,986594,280,wwii usnavi veteran celebr 100th birthday
447,986594,41,usnavi weather radar support hurrican relief effort hurricaneseason
448,986594,64,usnavi doctor bring medic care amazon
449,986594,132,tbt 2017 hurrican season end today recogn hard work usnavi shipmat follow hur
450,986594,1,septiceyefanzz mustang904 jeff charact guid peopl annual mandatori computerbas
451,986594,64,oper safe digit environ protect usnavi cybersecur hand effort vigil
452,986594,272,thursdaythought one word wow
453,986594,33,secnav76 censur retir senior offic follow thorough review interact glenn defens marin
454,986594,89,ussvellagulf visit agadir morocco
455,986594,66,amphibi squadron 1 hold chang command ceremoni
456,986594,100,ussjamesewilliam arriv odessa ukrain
457,986594,108,around fleet today usnavi photo day info download
458,986594,48,amphib7flt final shot usschief 3ja wrap jmsdf
459,986594,33,mt surfacewarrior surflant command radm wilson visit littor combat ship train facil navbasesd
460,986594,180,otd 1995 first super hornet make first flight two year super hornet initi sea trial seen
461,986594,19,adm moran schoolhous expens build send peopl much better bring
462,986594,30,adm moran build bigger sophist usnavi fail properli train sailor iitsec
463,986594,18,adm moran go push hard think need usnavi partnership industri iitsec
464,986594,14,adm moran want talk fundament train especi follow two collis past summer
465,986594,14,adm moran need pick pace us need look mirror messag pentagon wi
466,986594,40,vcno moran discuss transform usnavi train iitsec orlando
467,986594,31,soon vcno bill moran discuss transform usnavi train iitsec follow live
468,986594,40,morn vcno bill moran discuss transform usnavi train iitsec follow
469,986594,191,wednesdaywisdom shipmat never forget your part team greatest navi world usnavi
470,986594,152,initi usnavi japanbas cvw5 jet squadron flyin mca iwakuni file photo
471,986594,98,around fleet today usnavi photo day info download
472,986594,52,usnavi sailor submit tuition assist ncpace dl request januari term
473,986594,104,tuesdaythought navalacademi armynavi game navyfb uniform
474,986594,83,ussjohnsmccain depart subic bay en rout yokosuka repair return servic us7thfleet
475,986594,229,aloha ussillinoi arriv pearlharbor
476,986594,391,ussronaldreagan memori servic rememb honor three shipmat lost c2a crash
477,986594,114,around fleet today usnavi photo day info download
478,986594,41,mt amphib7flt usschief get underway water near hososhima begin 3ja jmsdf
479,986594,88,cybermonday rememb cyber threat real shop smart onlin know seller item
480,986594,443,ussronaldreagan memori servic rememb honor three shipmat lost c2a crash
481,986594,101,ussfitzgerald return fleet activ yokosuka aboard mv transshelf repair two punctur hull caus
482,986594,197,usnavi photo nov 2022
483,986594,487,mt secnav76 today join entir navi famili mourn loss lt steven comb airman matthew chiala
484,986594,352,cnorichardson loss three shipmat c2a greyhound crash navi team stick togeth ea
485,986594,112,ussfitzgerald depart fleet activ yokosuka begin journey pascagoula mississippi repair
486,986594,1355,break usnavi identifi sailor lost c2a crash
487,986594,64,stronger famili stronger fleet icymi cnorichardson releas usnavi famili framework outlin goal way ah
488,986594,505,otd 1961 usnavi first nuclearpow aircraft carrier ussenterpris cvan 65 commiss look back
489,986594,74,around fleet today usnavi photo day info download
490,986594,101,icymi ussfitzgerald depart fleet activ yokosuka begin journey pascagoula mississippi
491,986594,189,search end three usnavi sailor c2a crash investig underway file pic
492,986594,125,thank vp spend thanksgiv shipmat
493,986594,255,alwaysthankfulfor offic view
494,986594,260,break search end three usnavi sailor c2a crash file pic
495,986594,106,sinc forward navi mani shipmat away famili thanksgiv still go
496,986594,54,secnav76 secretari navi richard v spencer spent first thanksgiv secnav76 us5thfleet marin sailor
497,986594,92,mt us7thfleet ussfitzgerald ddg 62 depart fleet activ yokosuka meet heavi lift transport vessel
498,986594,259,think stress cook thanksgiv dinner famili tri cook meal 324000 peopl
499,986594,1698,happi thanksgiv usnavi thank opportun protect defend nation
500,986594,151,icymi search three sailor expand philippin sea follow c2a greyhound aircraft crash
501,986594,74,around fleet wednesday usnavi photo day info download
502,986594,252,search three sailor expand philippin sea follow c2a greyhound aircraft crash
503,986594,102,around fleet today usnavi photo day info download
504,986594,46,mt usnavyeurop sideboy salut secnav76 aboard ussmountwhitney coast napl itali
505,986594,58,fall 2017 petti offic advanc result releas via usnpeopl
506,986594,58,live watch usnavi newest sailor graduat boot camp
507,986594,26,today 11a et fall 2017 petti offic advanc result releas post allhandsmag
508,986594,594,cnorichardson statement c2a aircraft crash
509,986594,11326,realdonaldtrump usnavi conduct search rescu follow aircraft crash monitor situat prayer
510,986594,52,live 945a et watch usnavi newest sailor graduat boot camp
511,986594,154,inform latest updat
512,986594,1833,break updat eight personnel recov follow c2a greyhound crash transfer ussronaldreagan
513,986594,1018,break usnavi aircraft crash philippinesea carri 11 crew passeng en rout ussronaldreagan
514,986594,34,mt capgaznew navalacademi get littl nerdi first ever navycon
515,986594,19,icymi fall 2017 usnavi petti offic advanc quota releas via usnpeopl
516,986594,43,mt amphib7flt way usswasp sail atlant ocean head japan 2 month relief effort
517,986594,50,stronger famili stronger fleet cnorichardson releas usnavi famili framework outlin goal way ahead
518,986594,687,mt flynavi second usnavi p8a poseidon multimiss maritim aircraft deploy join ongo intern se
519,986594,54,mt uspacificfleet usshiggin depart sandiego deploy us7thfleet us5thfleet
520,986594,93,one done cnorichardson elimin threeyear pepper spray recertif requir follow fleet feedbac
521,986594,110,around fleet today usnavi photo day info download
522,986594,93,usscoronado depart us7thfleet success indoasiapacif deploy file pic
523,986594,141,mt mscsealift usnscomfort return naval station norfolk monday complet medic mission
524,986594,70,otd 1942 usscincinnati amp usssom uncov norwegian ship ss skjilbr german blockad runner
525,986594,76,icymi around fleet monday usnavi photo day info download
526,986594,115,around fleet today usnavi photo day info download
527,986594,39,fall 2017 usnavi petti offic advanc quota releas via usnpeopl
528,986594,69,icymi usnavi set new physic fit standard start boot camp
529,986594,64,mt us7thfleet restrict place us servic member japan follow fatal accid sunday
530,986594,68,mt usnavyeurop ussdonaldcook back rota thanksgiv wearenato partnerstrong
531,986594,109,look mondaymotiv look look usnavi oper forward
532,986594,31,icymi navalacademi class 2018 receiv servic assign
533,986594,722,break usnavi deploy unman submers argentin submarin search file phot
534,986594,139,cnorichardson usnavi fleet readi earn titl best navi world
535,986594,194,usnavi photo nov 1217
536,986594,219,usswayneemey rescu three marin sink vessel
537,986594,1218,break first usairforc c17 globemast iii depart mcasmiramarca argentina rescu asset suppor
538,986594,1510,break submarin rescu chamber asset mobil mcasmiramarca support search argent
539,986594,92,mt uspacificfleet usspinckney join 20 ship 18 navi asean intern fleet review thailand
540,986594,1324,break undersea rescu command order deploy argentina support ongo search argentinean navi su
541,986594,65,vcno adm moran navalacademi superintend vadm carter readi beatnd
542,986594,107,gonavi navyfootbal cold rain snow way want beatnd raisethesail
543,986594,1,stennis74 nice job shipmat
544,986594,1,mogmurvin welcom usnavi famili
545,986594,3,jimsciutto thank famili servic
546,986594,0,lisssullivan want
547,986594,65,navalacademi class 2018 receiv servic assign
548,986594,726,usnavi p8a poseidon support argentina search submarin file photo
549,986594,112,mt us7thfleet japanes tug lost propuls drift ussbenfold tow exercis one
550,986594,432,love smell flight op morn ussiwojima bluegreenteam prepar deploy
551,986594,74,around fleet friday usnavi photo day info download
552,986594,101,around fleet today usnavi photo day info download
553,986594,142,navsurfor pass thoma j hudner jr lost true american hero ddg116 comm
554,986594,135,mt uspacificfleet usscarlvinson carrier strike group wrap sustain exercis pacif
555,986594,93,cnorichardson usnavi fleet readi earn titl best navi world
556,986594,232,800 famili friend servic member pay final respect retir medalofhonor receipi capt
557,986594,39,cnorichardson destroy crew ive got back
558,986594,59,live watch usnavi newest sailor graduat boot camp
559,986594,65,live 945a et watch usnavi newest sailor graduat boot camp
560,986594,79,around fleet thursday usnavi photo day info download
561,986594,0,malvarami otd day
562,986594,40,correct ussmakinisland commiss oct 24 2009
563,986594,79,correct got littl eager celebr ussenterpris commiss anniversari nov 25 1961
564,986594,206,otd 1961 uss enterpris us navi first nuclearpow aircraft carrier commiss newport new
565,986594,60,otd 2009 amphibi assault ship ussmakinisland commiss eighth final vessel usswasp
566,986594,22,onlin retir request readi
567,986594,93,tbt otd 1963 presid john f kennedi board uss observ island eag 154 wit uss andrew ja
568,986594,94,usnavi accept deliveri futur ussralphjohnson
569,986594,59,around fleet today usnavi photo day info download
570,986594,75,usnavi set new physic fit standard start boot camp
571,986594,75,mt cnorichardson cno visit sailor aboard usskentucki navalbasekitsap wednesday sailor serv
572,986594,163,thursdaythought flight op aboard aircraft carrier joke thank usnavi sailor best
573,986594,179,today usnavi japan maritim selfdefens forc set conduct annual exercis bilater train increa
574,986594,50,keel laid futur uss lenah h sutcliff higbe via navsea
575,986594,43,mt surfacewarrior navsurfor vadm rowden congratul newest warfar tactic instructor naval surfac
576,986594,33,mt navymedicin usnavi top doc vadm faison hand call naval hospit bremerton amaz
577,986594,33,mt navalwarcolleg congratul graduat welcom alumni rank photo
578,986594,110,around fleet today usnavi photo day info download
579,986594,52,mt mscsealift usnscomfort continu provid humanitarian relief work alongsid hhsgov disast medic
580,986594,17,mt secnav76 end day fiduciari respons buy best best valu th
581,986594,72,mt uspacificfleet usshalsey complet port visit guam deploy continu us7thfleet
582,986594,280,thegiftig sacrific usnavi sailor alway stand watch around world
583,986594,118,otd 1910 eugen eli pilot first aircraft takeoff warship ussbirmingham
584,986594,73,uniqu opportun rare aggreg forc way rear adm greg harr
585,986594,107,us7thfleet day night sailor aboard ussnimitz alway mission readi
586,986594,106,otd 1906 presid theodor roosevelt becom first presid visit foreign countri offic tra
587,986594,123,around fleet today usnavi photo day info download
588,986594,83,watch shipmat mt bostonglob thoma j hudner usnavi war hero veteran affair commission
589,986594,256,pacificcommand navi earth capabl coordin oper three carrier strike g
590,986594,49,ussdonaldcook depart aksaz turkey particip exercis dogu akdeniz 2017
591,986594,450,three usnavi carrier strike group exercis western pacif reinforc commit allianc partner
592,986594,33,mt navsurfor thank usnhistori amp uss san francisco memori foundat great veteransday amp
593,986594,84,mt secnav76 today usnavi lost legendari aviat retir usnavi captain thoma hudner pass away rest
594,986594,72,mt blueangel welcom aboard boss squadron held chang command sunday pleas welcom cmdr eric doyl
595,986594,211,otd 1942 five sullivan brother lost uss juneau cl 52 destroy naval battl gu
596,986594,130,around fleet today usnavi photo day info download
597,986594,32,live 1p et mt usnhistori join nhhc facebookl discuss import naval battl guadal
598,986594,266,around fleet sunday usnavi photo day info download
599,986594,77,usnavi usfleetforc adm davidson veteransday import quit simpl person day com
600,986594,13,former cmf deputi command award legion merit
601,986594,42,happi 50th anniversari navyjag celebr learn histori usnavi judg advoc usnjag50
602,986594,68,around fleet today usnavi photo day info download
603,986594,51,live watch usnavi newest sailor graduat boot camp
604,986594,80,usscoronado return san diego 18month deploy welcom home shipmat
605,986594,41,live 945a et watch usnavi newest sailor graduat boot camp
606,986594,56,4 chang need know navi portal
607,986594,148,dalla hold inactiv ceremoni 36 year servic
608,986594,50,lt cmdr robert lennon honor 2017 health care hero
609,986594,321,radioman 3rd class howard w bean assign ussoklahoma wwii laid rest arlingtonnatl yesterd
610,986594,150,usnhistori attack pearlharbor last one hour 15 minut check interest stori map th
611,986594,390,usnhistori attack pearlharbor 2403 total live lost includ 68 civilian read
612,986594,288,mt usnhistori otd 76 year ago japanes militari launch surpris attack us naval base
613,986594,313,live et pearlharbor76 remembr day ceremoni
614,986594,197,live 1245p et pearlharbor76 remembr day ceremoni
615,986594,117,around fleet today usnavi photo day info download
616,986594,122,namesak famili tiger embark usshoward
617,986594,108,new york board team forc maritim secur
618,986594,141,uss nimitz return naval base kitsap
619,986594,85,navi announc 2018 navi week schedul file photo
620,986594,137,around fleet today usnavi photo day info download
621,986594,45,mt secnav76 icymi morn secnav76 swore mr jame hondo geurt next assist secretari
622,986594,34,mt icymi secnav76 spoke us naval institut 2017 defens forum discuss prioriti amp sha
623,986594,204,navi launch new brand campaign taglin armynavi game
624,986594,37,mt icymi secnav76 swore mr thoma b modli monday dec 3 2017 usnavyundersec navi
625,986594,134,peopl make us navi best world around fleet today usnavi photo day info
626,986594,79,usslakeeri arriv hawaii seven month deploy 7th 5th fleet area oper
627,986594,119,icymi navi posthum award bronz star medal valor chief boatswain mate joseph l georg
628,986594,123,mondaymotiv hooyah one week closer holiday leav
629,986594,142,around fleet today usnavi photo day info download
630,986594,55,icymi usnavi spearhead deptofdefens hivaid prevent program via allhandsmag
631,986594,215,ussstethem return yokosuka japan fall patrol western pacif file pic
632,986594,93,mt amphib7flt usswasp make stop brazil steadili make way across atlant pacif
633,986594,121,usnavi doctor bring medic care amazon navymedicin
634,986594,143,usnavi posthum award bronz star medal valor pearlharbor via usnhistori
635,986594,387,usstheodoreroosevelt carrier strike group carrier air wing 17 began sorti friday arabiangulf supporti
636,986594,69,icymi around fleet friday usnavi photo day info download
637,986594,142,today ussfitzgerald depart fleet activ yokosuka aboard heavi lift transport vessel mv transshelf
638,986594,282,today usstheodoreroosevelt carrier strike group carrier air wing 17 begin sorti arabiangulf supporti
639,986594,57,navairnew look leverag vr tech flight simul trainer flynavi
640,986594,61,around fleet today usnavi photo day info download
641,986594,41,usnavi spearhead deptofdefens hivaid prevent program via allhandsmag
642,986594,426,today usstheodoreroosevelt carrier strike group carrier air wing 17 begin sorti arabiangulf supporti
643,986594,194,fridayfeel pictur say thousand word
644,986594,47,live watch usnavi newest sailor graduat boot camp
645,986594,74,live 945a et watch usnavi newest sailor graduat boot camp
646,986594,280,wwii usnavi veteran celebr 100th birthday
647,986594,41,usnavi weather radar support hurrican relief effort hurricaneseason
648,986594,64,usnavi doctor bring medic care amazon
649,986594,132,tbt 2017 hurrican season end today recogn hard work usnavi shipmat follow hur
650,986594,1,septiceyefanzz mustang904 jeff charact guid peopl annual mandatori computerbas
651,986594,64,oper safe digit environ protect usnavi cybersecur hand effort vigil
652,986594,272,thursdaythought one word wow
653,986594,33,secnav76 censur retir senior offic follow thorough review interact glenn defens marin
654,986594,89,ussvellagulf visit agadir morocco
655,986594,66,amphibi squadron 1 hold chang command ceremoni
656,986594,100,ussjamesewilliam arriv odessa ukrain
657,986594,108,around fleet today usnavi photo day info download
658,986594,48,amphib7flt final shot usschief 3ja wrap jmsdf
