Index,followers,rt,text
703,69331,4,nondeliveri hospit stay may rais clot risk pregnanc
704,69331,4,care someon alzheim need help find resourc check
705,69331,17,healthi diabetesfriendli recip quick weeknight dinner diabetesawar
706,69331,10,gestat diabet occur 38 pregnant women understand risk factor pregnant
707,69331,10,nation diabet month 108 us women diabet check medlineplu resourc
708,69331,7,screen hpv may better pap test studi suggest
709,69331,42,womenshealth women like alzheim like take care someon w alzheim
710,69331,8,primari caregiv stress forget take time
711,69331,26,womenshealth singl mom breastfe hear advic singl mom made work itsonlynatur
712,69331,11,nation famili caregiv monthwheth mother take care child child care parent celebr
713,69331,8,infant expos smoke womb risk infect death studi
714,69331,4,12 percent women 50 satisfi bodi
715,69331,2,scandinavia studi find hpv vaccin safe
716,69331,11,scientist uncov breast milk potenti secret weapon hiv
717,69331,2,famili caregiv live longer peer
718,69331,2,stalk take mental toll victim studi confirm
719,69331,6,women health initi reaffirm use shortterm hormon replac therapi younger women
720,69331,41,womenshealth pleas gt help friend abus dvam
721,69331,691,whitehous mammogram 0 birth control 0 prevent care need stay healthi extra cost priceless obamacar
722,69331,15,due laps govern fund new post respons may origin account appropri enact
723,69331,1,nlmdimrc nnlmscr last day disast prepared month check dimrc mobil app take go
724,69331,25,womenshealth marketplac plan must cover contracept cost share love 0 copay birth control
725,69331,6,nihpainresearch know 918 women 1864 yo may experi vulvar pain lifetim vulvodynia painawar h
726,69331,40,sept 26 world contracept day 222 million women want avoid pregnanc lack access birth control
727,69331,3,nlmosp video inform clinicaltri deal wreproductivehealth
728,69331,6,women 1849 interest breastcanc riskprevent help clheming phd candid gwu take survey
729,69331,25,womenshealth pregnant new mom need take extra step prepar emerg gt
730,69331,63,womenshealth pleas exercis lower risk 10 differ diseas ill injuri wow
731,69331,2,nlmosp need research inform womeninthemilitari here good info
732,69331,2,lack support worri often prompt new mother stop breastfeed
733,69331,22,womenshealth pleas join us 926 4et bilingu twitter chat latino amp aca use oursalud cuidadodesalud nlirh n
734,69331,18,womenshealth fact peopl like quit smoke support
735,69331,1,risk develop ovarian cancer reduc pregnanc breastfeed children els lower risk
736,69331,6,nlm4caregiv breastfeed mother use lactm find drug may affect babi
737,69331,13,kidshealth via nprnew succeed breastfeed new mom could use help
738,69331,0,emilydownsideup mani labor induc 39 week necessarili lead cesarean
739,69331,4,let babi set deliveri date wait 39 week
740,69331,8,healthymo miss hbo documentari seri weightofthen kid view seri amp learn nih obes resourc htt
741,69331,2,nation childhood obes month gut microb diet interact affect obes
742,69331,14,womenshealth food check water check umm els goe emerg kit
743,69331,6,fdawomen trivia time blood pressur often greater may need treatment
744,69331,13,septemb ovarian cancer awar month learn protect
745,69331,32,womenshealth prenat care breastfeed support wellchild visit extra cost gt marketplac
746,69331,3,womanshospit cancer treatment complic healthi eat dinner session help sur
747,69331,16,cdcstd hiv transmiss unprotect vagin sex much higher risk women menlt usecondom
748,69331,4,ncitechtransf nci avon foundat center advanc innov launch breast cancer startup challeng
749,69331,14,retweet amp help 186 million uninsur women get readi oct 1 amp start open enrol
750,69331,16,stanford rape mean get defin prof estel freedman examin polit sexual violenc
751,69331,146,healthcaregov start 2014 health insur cant charg women higher premium men learn
752,69331,12,womenshealth health insur marketplac come soon see qualifi lower cost
753,69331,5,nihprev nation prevent council annual statu report avail read nat l improv publichealth goal
754,69331,5,sex gender differ free cme credit avail ummslibrari
755,69331,8,md rn np need cme credit take nih ce sex gender differ ummslibrari
756,69331,26,cdcstd cervic cancer usual symptom critic women get regular screen std
757,69331,0,pleas free cme class sex gender differ md np rn ummslibrari
758,69331,5,fewer famili struggl pay medic bill cdc healthday may skip need care altogeth expert say
759,69331,14,latest women health mobil app ummslibrari resourc whlibguid
760,69331,6,attn women health research new resourc umass abt women health issu whlibguid
761,69331,3,umass women health libguid provid info resourc women health issu expert sourc whlibguid
762,69331,4,latest women health mobil app ummslibrari resourc whlibguid
763,69331,4,latest women health mobil app ummslibrari resourc whlibguid
764,69331,0,learn ebm research help md make angelinajolielik cancer tx decis whlibguid ummslibrari
765,69331,5,celebr women health week learn new ummslibrari resourc whlibguid
766,69331,8,women men brain respond differ hungri infant cri
767,69331,13,sex live often overlook casualti traumat brain injuri
768,69331,7,membran remodel yoga meet cell biolog
769,69331,14,new clue exercis may reduc breast cancer risk
770,69331,6,breast cancer death rate higher black women
771,69331,8,experiment vaccin show promis ovarian cancer
772,69331,8,older women miss mammogram tie wors breast cancer outcom
773,69331,5,iud safe contracept teen studi find
774,69331,13,brisk walk equal run heart health
775,69331,5,nearli 30 percent american high blood pressur cdc
776,69331,0,us coupl live togeth instead marri cdc find
777,69331,6,repeat birth teen girl still high cdc
778,69331,5,studi pinpoint women risk blood clot pregnanc
779,69331,4,breast cancer gene test wont help women
780,69331,2,consensu sex typic doesnt begin teen year studi find
781,69331,4,breast cancer spread lung surgeri may increas surviv
782,69331,12,fdawomen april minorityhealthmonth feel press health issu minor
783,69331,5,mani ovarian cancer patient deni bythebook care studi say
784,69331,10,million still lack access modern contracept studi say
785,69331,17,obes new mother may higher heart attack stroke risk
786,69331,3,heavier pregnant women may face higher csection risk
787,69331,5,petroleum jelli tie vagin infect risk studi
788,69331,5,african american breast cancer survivor face higher heart failur risk
789,69331,2,lessfrequ pap smear may miss cancer precursor
790,69331,1,combo treatment might beat epidur eas labor
791,69331,10,anxieti may common depress pregnanc
792,69331,3,motherhood may spur obsessivecompuls behavior
793,69331,4,csection rate vari wide us hospit
794,69331,3,progress wg intersect hivaid violenc women girl genderrel health dispar
795,69331,1,cdcstd hpv vaccin men particularli men sex w men std
796,69331,3,swhr check contribut writer newest articl endometriosi affect million women year
797,69331,2,dailyus hiv prevent approach prove ineffect among women nih studi
798,69331,10,evid smoke rais breast cancer risk
799,69331,4,advanc breast cancer inch young women
800,69331,25,intim partner violenc screen guidanc new issu journal women health
801,69331,10,account close get news nih research women health nihorwh amp janineclaytonmd ff
802,69331,5,account close follow nihorwh amp janineclaytonmd nih womenshealth news
803,69331,3,thank follow us account close pleas follow nihorwh amp janineclaytonmd womenshealth news nih
804,69331,10,fund opportun gt
805,69331,14,could dark chocol help eas poor leg circul gt
806,69331,8,join manupchat today 2pm et minorityhealth partner discuss men health
807,69331,25,vitamin key longer life gt
808,69331,8,womenshealthr check research wide rang topic import women health
809,69331,11,yalesph racial dispar persist breast cancer therapi
810,69331,39,veteranshealth women veteran know support line question specif women health care call 1
811,69331,25,swhr women 2x like men advers reaction prescript drug womenshealthmatt
812,69331,10,swhr focus sex gender differ obes 2014 nation scientif x confer washington
813,69331,14,yale leptin also influenc brain cell control appetit yale research find
814,69331,8,umsph new um studi found mammographi led less latestag breast cancer
815,69331,7,short birth space link preterm deliveri gt
816,69331,7,hormon level womb tie autism risk boy gt
817,69331,0,regist dcoe webinar seri june 12 130 concuss affect men differ women gt
818,69331,9,diabet may bigger threat femal heart studi gt
819,69331,5,nih studi link high cholesterol level lower fertil gt
820,69331,6,bebrightpink womenshealthnih pl take bebrightpink challeng amp assessyourrisk breastovarian cancer go
821,69331,77,hhsgov natl women health week take pledg schedul wellwoman visit nwhw
822,69331,8,cdcstd check cdc health dispar amp inequ report highlight key healthdispar data
823,69331,3,nihorwh dyk men get physic activ women check today womenshealth nwhw infograph learn
824,69331,11,pay attent mental health nwhw sure get enough sleep amp manag stress
825,69331,4,join women across countri pledg get activ nwhw
826,69331,8,nihorwh sever factor play role vision dispar btw women men age menopaus econom issu neichat
827,69331,3,nihorwh fact everi cell bodi sex woman femal cell skin lung heart brain eye neichat
828,69331,4,nihorwh health factor differ men women even beyond reproduct system neichat
829,69331,10,nateyeinstitut rememb dilat eye exam way detect common eye diseas earli stage neichat
830,69331,7,nihorwh eye chang signal presenc mani underli condit high blood pressur diabet cancer autoimmun diseas
831,69331,12,janineclaytonmd women tend live longer men women get eye diseas sinc age key risk factor vision pr
832,69331,5,masseyeandear know 23 blind visual impair occur women learn neichat
833,69331,32,nat l women checkupday take care health schedul wellwoman visit nwhw
834,69331,1,nateyeinstitut look forward today neichat women eye health join nei nihorwh amp janineclaytonmd 23p et
835,69331,0,nateyeinstitut neichat
836,69331,9,major women health studi paid big dividend gt
837,69331,6,freez techniqu may work women earli breast cancer gt
838,69331,3,jobless unwant side effect chemo breast cancer gt
839,69331,29,rocktalk listen new nih resubmiss polici blog thank extramur com
840,69331,8,facebook make women feel bad bodi gt
841,69331,4,nihorwh news janineclaytonmd announc fund admin supplement grant sexgend research
842,69331,4,fertil drug may rais breast cancer risk studi gt
843,69331,5,diet soft drink contribut heart troubl women gt
844,69331,4,two surgeri pelvic prolaps found similarli effect safe gt
845,69331,9,alzheim strike women harder men report
846,69331,6,fda panel recommend hpv test replac pap smear gt
847,69331,3,time move vp mr presid readi move potu let thing letsmov watch
848,69331,23,heart attack risk rise hour angri outburst studi gt
849,69331,4,obes birth control pill rais risk multipl sclerosi gt
850,69331,4,obgyn group issu guidelin lower csection rate gt
851,69331,4,blood clot risk remain higher normal least 12 week women deliv babi gt
852,69331,8,expand dna test might allow person breast cancer treatment gt
853,69331,17,nih studi find regular aspirin use may reduc ovarian cancer risk gt
854,69331,1,mani young american hiv delay treatment studi gt
855,69331,10,mani women hot flash last 10 year menopaus gt
856,69331,3,ff women health research updat nih offic research women health nihorwh womenshealth
857,69331,3,hear loss tie faster brain shrinkag age gt
858,69331,3,firsttim cesarean rate dip 2012 cdc gt
859,69331,1,fund opportun mobil research research resourc enhanc mhealth research gt
860,69331,8,cervic cancer screen found benefit older women new studi gt
861,69331,11,ear tube may longterm benefit kid ear infect gt
862,69331,17,cancer prevent guidelin seem pay older women gt
863,69331,7,breastfeed might reduc mom odd rheumatoid arthriti gt
864,69331,58,womenshealth cervicalcanc easiest femal cancer prevent regular screen amp follow
865,69331,5,today perfect day set healthi goal year check idea gt
866,69331,12,pleas rememb drink respons tonight call cab happi safe healthi nye
867,69331,6,midlif job stress link later health problem gt
868,69331,2,health tip avoid food poison holiday travel gt
869,69331,4,claim virgin birth us near 1 percent studi gt
870,69331,6,heart diseas link dementia older postmenopaus women gt
871,69331,5,antidepress use pregnanc link autism gt
872,69331,1,womenshealth merri miseri fdafood parti part holiday cheer merri chang miseri w food
873,69331,6,expert dont wast money multivitamin gt
874,69331,90,usfda buy antibacteri soap reduc risk get infect data suggest
875,69331,8,nlmnew lose sleep holiday season well 7 step better sleep busi season
876,69331,6,womenshealth share gt need idea holiday meal makeov tri
877,69331,7,womenshealth open enrol marketplac plan end march 31 wait enrol
878,69331,4,unsur eat fish pregnantbreastfeed import benefit babi recommend
879,69331,4,diabet drug may affect cancer risk women studi gt
880,69331,15,womenshealth buy gift kiddi life awar potenti lead hazard toy jewelri
881,69331,5,new test may help predict surviv ovarian cancer gt
882,69331,20,wash hand one import thing prevent ill gt handwashingawarenessweek
883,69331,25,womenshealth import 1 4 peopl live hiv us woman get test gt
884,69331,4,even breast cancer gene test neg risk persist studi gt
885,69331,16,womenshealth lead health issu nativ american relat lifestyl know risk give power htt
886,69331,33,womenshealth caregiv stress emot physic strain caregiv learn latest blog post
887,69331,6,much tylenol pregnanc could affect develop
888,69331,6,pleas mind safeti prepar thanksgiv dinner 3x fire thanksgiv
889,69331,3,nurs mother tri use lactm research whether substanc pass breast milk
890,69331,1,nurs mother lactm easi tool use verifi substanc pass breast milk
891,69331,7,nlmsi mt cdcflu cdc recommend peopl either type 1 type 2 diabet get annual flu shot
892,69331,4,antibiot alway answer danger antibiot resist gt
893,69331,3,tip manag holiday care love one gt
894,69331,0,onsafeti 1 reason stand pan 3x fire thanksgiv averag day
895,69331,8,womanshospit bad workout one womanshalf runpink
896,69331,13,fdawomen peopl symptom 50 peopl sex hpv point live
897,69331,2,time month may affect women concuss recoveri
898,69331,6,beverag choic huge impact diabet idea drink besid water wdd
899,69331,25,surgeongener sgreport fact smoker w diabet higher risk heart kidney amp eye diseas quit smoke nation dia
900,69331,8,femal caregiv higher risk depress pleas take care familycaregiversmonth
901,69331,0,health risk cost much higher multipl birth studi
902,69331,30,womenshealth pleas gt smoke caus cancer problem top 11 way hurt women
903,69331,4,nondeliveri hospit stay may rais clot risk pregnanc
904,69331,4,care someon alzheim need help find resourc check
905,69331,17,healthi diabetesfriendli recip quick weeknight dinner diabetesawar
906,69331,10,gestat diabet occur 38 pregnant women understand risk factor pregnant
907,69331,10,nation diabet month 108 us women diabet check medlineplu resourc
908,69331,7,screen hpv may better pap test studi suggest
909,69331,42,womenshealth women like alzheim like take care someon w alzheim
910,69331,8,primari caregiv stress forget take time
911,69331,26,womenshealth singl mom breastfe hear advic singl mom made work itsonlynatur
912,69331,11,nation famili caregiv monthwheth mother take care child child care parent celebr
913,69331,8,infant expos smoke womb risk infect death studi
914,69331,4,12 percent women 50 satisfi bodi
915,69331,2,scandinavia studi find hpv vaccin safe
916,69331,11,scientist uncov breast milk potenti secret weapon hiv
917,69331,2,famili caregiv live longer peer
918,69331,2,stalk take mental toll victim studi confirm
919,69331,6,women health initi reaffirm use shortterm hormon replac therapi younger women
920,69331,41,womenshealth pleas gt help friend abus dvam
921,69331,691,whitehous mammogram 0 birth control 0 prevent care need stay healthi extra cost priceless obamacar
922,69331,15,due laps govern fund new post respons may origin account appropri enact
923,69331,1,nlmdimrc nnlmscr last day disast prepared month check dimrc mobil app take go
924,69331,25,womenshealth marketplac plan must cover contracept cost share love 0 copay birth control
925,69331,6,nihpainresearch know 918 women 1864 yo may experi vulvar pain lifetim vulvodynia painawar h
926,69331,40,sept 26 world contracept day 222 million women want avoid pregnanc lack access birth control
927,69331,3,nlmosp video inform clinicaltri deal wreproductivehealth
928,69331,6,women 1849 interest breastcanc riskprevent help clheming phd candid gwu take survey
929,69331,25,womenshealth pregnant new mom need take extra step prepar emerg gt
930,69331,63,womenshealth pleas exercis lower risk 10 differ diseas ill injuri wow
931,69331,2,nlmosp need research inform womeninthemilitari here good info
932,69331,2,lack support worri often prompt new mother stop breastfeed
933,69331,22,womenshealth pleas join us 926 4et bilingu twitter chat latino amp aca use oursalud cuidadodesalud nlirh n
934,69331,18,womenshealth fact peopl like quit smoke support
935,69331,1,risk develop ovarian cancer reduc pregnanc breastfeed children els lower risk
936,69331,6,nlm4caregiv breastfeed mother use lactm find drug may affect babi
937,69331,13,kidshealth via nprnew succeed breastfeed new mom could use help
938,69331,0,emilydownsideup mani labor induc 39 week necessarili lead cesarean
939,69331,4,let babi set deliveri date wait 39 week
940,69331,8,healthymo miss hbo documentari seri weightofthen kid view seri amp learn nih obes resourc htt
941,69331,2,nation childhood obes month gut microb diet interact affect obes
942,69331,14,womenshealth food check water check umm els goe emerg kit
943,69331,6,fdawomen trivia time blood pressur often greater may need treatment
944,69331,13,septemb ovarian cancer awar month learn protect
945,69331,32,womenshealth prenat care breastfeed support wellchild visit extra cost gt marketplac
946,69331,3,womanshospit cancer treatment complic healthi eat dinner session help sur
947,69331,16,cdcstd hiv transmiss unprotect vagin sex much higher risk women menlt usecondom
948,69331,4,ncitechtransf nci avon foundat center advanc innov launch breast cancer startup challeng
949,69331,14,retweet amp help 186 million uninsur women get readi oct 1 amp start open enrol
950,69331,16,stanford rape mean get defin prof estel freedman examin polit sexual violenc
951,69331,146,healthcaregov start 2014 health insur cant charg women higher premium men learn
952,69331,12,womenshealth health insur marketplac come soon see qualifi lower cost
953,69331,5,nihprev nation prevent council annual statu report avail read nat l improv publichealth goal
954,69331,5,sex gender differ free cme credit avail ummslibrari
955,69331,8,md rn np need cme credit take nih ce sex gender differ ummslibrari
956,69331,26,cdcstd cervic cancer usual symptom critic women get regular screen std
957,69331,0,pleas free cme class sex gender differ md np rn ummslibrari
958,69331,5,fewer famili struggl pay medic bill cdc healthday may skip need care altogeth expert say
959,69331,14,latest women health mobil app ummslibrari resourc whlibguid
960,69331,6,attn women health research new resourc umass abt women health issu whlibguid
961,69331,3,umass women health libguid provid info resourc women health issu expert sourc whlibguid
962,69331,4,latest women health mobil app ummslibrari resourc whlibguid
963,69331,4,latest women health mobil app ummslibrari resourc whlibguid
964,69331,0,learn ebm research help md make angelinajolielik cancer tx decis whlibguid ummslibrari
965,69331,5,celebr women health week learn new ummslibrari resourc whlibguid
966,69331,8,women men brain respond differ hungri infant cri
967,69331,13,sex live often overlook casualti traumat brain injuri
968,69331,7,membran remodel yoga meet cell biolog
969,69331,14,new clue exercis may reduc breast cancer risk
970,69331,6,breast cancer death rate higher black women
971,69331,8,experiment vaccin show promis ovarian cancer
972,69331,8,older women miss mammogram tie wors breast cancer outcom
973,69331,5,iud safe contracept teen studi find
974,69331,13,brisk walk equal run heart health
975,69331,5,nearli 30 percent american high blood pressur cdc
976,69331,0,us coupl live togeth instead marri cdc find
977,69331,6,repeat birth teen girl still high cdc
978,69331,5,studi pinpoint women risk blood clot pregnanc
979,69331,4,breast cancer gene test wont help women
980,69331,2,consensu sex typic doesnt begin teen year studi find
981,69331,4,breast cancer spread lung surgeri may increas surviv
982,69331,12,fdawomen april minorityhealthmonth feel press health issu minor
983,69331,5,mani ovarian cancer patient deni bythebook care studi say
984,69331,10,million still lack access modern contracept studi say
985,69331,17,obes new mother may higher heart attack stroke risk
986,69331,3,heavier pregnant women may face higher csection risk
987,69331,5,petroleum jelli tie vagin infect risk studi
988,69331,5,african american breast cancer survivor face higher heart failur risk
989,69331,2,lessfrequ pap smear may miss cancer precursor
990,69331,1,combo treatment might beat epidur eas labor
991,69331,10,anxieti may common depress pregnanc
992,69331,3,motherhood may spur obsessivecompuls behavior
993,69331,4,csection rate vari wide us hospit
994,69331,3,progress wg intersect hivaid violenc women girl genderrel health dispar
995,69331,1,cdcstd hpv vaccin men particularli men sex w men std
996,69331,3,swhr check contribut writer newest articl endometriosi affect million women year
997,69331,2,dailyus hiv prevent approach prove ineffect among women nih studi
998,69331,10,evid smoke rais breast cancer risk
999,69331,4,advanc breast cancer inch young women
