Index,followers,rt,text
349,69331,14,retweet amp help 186 million uninsur women get readi oct 1 amp start open enrol
350,69331,16,stanford rape mean get defin prof estel freedman examin polit sexual violenc
351,69331,146,healthcaregov start 2014 health insur cant charg women higher premium men learn
352,69331,12,womenshealth health insur marketplac come soon see qualifi lower cost
353,69331,5,nihprev nation prevent council annual statu report avail read nat l improv publichealth goal
354,69331,5,sex gender differ free cme credit avail ummslibrari
355,69331,8,md rn np need cme credit take nih ce sex gender differ ummslibrari
356,69331,26,cdcstd cervic cancer usual symptom critic women get regular screen std
357,69331,0,pleas free cme class sex gender differ md np rn ummslibrari
358,69331,5,fewer famili struggl pay medic bill cdc healthday may skip need care altogeth expert say
359,69331,14,latest women health mobil app ummslibrari resourc whlibguid
360,69331,6,attn women health research new resourc umass abt women health issu whlibguid
361,69331,3,umass women health libguid provid info resourc women health issu expert sourc whlibguid
362,69331,4,latest women health mobil app ummslibrari resourc whlibguid
363,69331,4,latest women health mobil app ummslibrari resourc whlibguid
364,69331,0,learn ebm research help md make angelinajolielik cancer tx decis whlibguid ummslibrari
365,69331,5,celebr women health week learn new ummslibrari resourc whlibguid
366,69331,8,women men brain respond differ hungri infant cri
367,69331,13,sex live often overlook casualti traumat brain injuri
368,69331,7,membran remodel yoga meet cell biolog
369,69331,14,new clue exercis may reduc breast cancer risk
370,69331,6,breast cancer death rate higher black women
371,69331,8,experiment vaccin show promis ovarian cancer
372,69331,8,older women miss mammogram tie wors breast cancer outcom
373,69331,5,iud safe contracept teen studi find
374,69331,13,brisk walk equal run heart health
375,69331,5,nearli 30 percent american high blood pressur cdc
376,69331,0,us coupl live togeth instead marri cdc find
377,69331,6,repeat birth teen girl still high cdc
378,69331,5,studi pinpoint women risk blood clot pregnanc
379,69331,4,breast cancer gene test wont help women
380,69331,2,consensu sex typic doesnt begin teen year studi find
381,69331,4,breast cancer spread lung surgeri may increas surviv
382,69331,12,fdawomen april minorityhealthmonth feel press health issu minor
383,69331,5,mani ovarian cancer patient deni bythebook care studi say
384,69331,10,million still lack access modern contracept studi say
385,69331,17,obes new mother may higher heart attack stroke risk
386,69331,3,heavier pregnant women may face higher csection risk
387,69331,5,petroleum jelli tie vagin infect risk studi
388,69331,5,african american breast cancer survivor face higher heart failur risk
389,69331,2,lessfrequ pap smear may miss cancer precursor
390,69331,1,combo treatment might beat epidur eas labor
391,69331,10,anxieti may common depress pregnanc
392,69331,3,motherhood may spur obsessivecompuls behavior
393,69331,4,csection rate vari wide us hospit
394,69331,3,progress wg intersect hivaid violenc women girl genderrel health dispar
395,69331,1,cdcstd hpv vaccin men particularli men sex w men std
396,69331,3,swhr check contribut writer newest articl endometriosi affect million women year
397,69331,2,dailyus hiv prevent approach prove ineffect among women nih studi
398,69331,10,evid smoke rais breast cancer risk
399,69331,4,advanc breast cancer inch young women
400,69331,25,intim partner violenc screen guidanc new issu journal women health
401,69331,10,account close get news nih research women health nihorwh amp janineclaytonmd ff
402,69331,5,account close follow nihorwh amp janineclaytonmd nih womenshealth news
403,69331,3,thank follow us account close pleas follow nihorwh amp janineclaytonmd womenshealth news nih
404,69331,10,fund opportun gt
405,69331,14,could dark chocol help eas poor leg circul gt
406,69331,8,join manupchat today 2pm et minorityhealth partner discuss men health
407,69331,25,vitamin key longer life gt
408,69331,8,womenshealthr check research wide rang topic import women health
409,69331,11,yalesph racial dispar persist breast cancer therapi
410,69331,39,veteranshealth women veteran know support line question specif women health care call 1
411,69331,25,swhr women 2x like men advers reaction prescript drug womenshealthmatt
412,69331,10,swhr focus sex gender differ obes 2014 nation scientif x confer washington
413,69331,14,yale leptin also influenc brain cell control appetit yale research find
414,69331,8,umsph new um studi found mammographi led less latestag breast cancer
415,69331,7,short birth space link preterm deliveri gt
416,69331,7,hormon level womb tie autism risk boy gt
417,69331,0,regist dcoe webinar seri june 12 130 concuss affect men differ women gt
418,69331,9,diabet may bigger threat femal heart studi gt
419,69331,5,nih studi link high cholesterol level lower fertil gt
420,69331,6,bebrightpink womenshealthnih pl take bebrightpink challeng amp assessyourrisk breastovarian cancer go
421,69331,77,hhsgov natl women health week take pledg schedul wellwoman visit nwhw
422,69331,8,cdcstd check cdc health dispar amp inequ report highlight key healthdispar data
423,69331,3,nihorwh dyk men get physic activ women check today womenshealth nwhw infograph learn
424,69331,11,pay attent mental health nwhw sure get enough sleep amp manag stress
425,69331,4,join women across countri pledg get activ nwhw
426,69331,8,nihorwh sever factor play role vision dispar btw women men age menopaus econom issu neichat
427,69331,3,nihorwh fact everi cell bodi sex woman femal cell skin lung heart brain eye neichat
428,69331,4,nihorwh health factor differ men women even beyond reproduct system neichat
429,69331,10,nateyeinstitut rememb dilat eye exam way detect common eye diseas earli stage neichat
430,69331,7,nihorwh eye chang signal presenc mani underli condit high blood pressur diabet cancer autoimmun diseas
431,69331,12,janineclaytonmd women tend live longer men women get eye diseas sinc age key risk factor vision pr
432,69331,5,masseyeandear know 23 blind visual impair occur women learn neichat
433,69331,32,nat l women checkupday take care health schedul wellwoman visit nwhw
434,69331,1,nateyeinstitut look forward today neichat women eye health join nei nihorwh amp janineclaytonmd 23p et
435,69331,0,nateyeinstitut neichat
436,69331,9,major women health studi paid big dividend gt
437,69331,6,freez techniqu may work women earli breast cancer gt
438,69331,3,jobless unwant side effect chemo breast cancer gt
439,69331,29,rocktalk listen new nih resubmiss polici blog thank extramur com
440,69331,8,facebook make women feel bad bodi gt
441,69331,4,nihorwh news janineclaytonmd announc fund admin supplement grant sexgend research
442,69331,4,fertil drug may rais breast cancer risk studi gt
443,69331,5,diet soft drink contribut heart troubl women gt
444,69331,4,two surgeri pelvic prolaps found similarli effect safe gt
445,69331,9,alzheim strike women harder men report
446,69331,6,fda panel recommend hpv test replac pap smear gt
447,69331,3,time move vp mr presid readi move potu let thing letsmov watch
448,69331,23,heart attack risk rise hour angri outburst studi gt
449,69331,4,obes birth control pill rais risk multipl sclerosi gt
450,69331,4,obgyn group issu guidelin lower csection rate gt
451,69331,4,blood clot risk remain higher normal least 12 week women deliv babi gt
452,69331,8,expand dna test might allow person breast cancer treatment gt
453,69331,17,nih studi find regular aspirin use may reduc ovarian cancer risk gt
454,69331,1,mani young american hiv delay treatment studi gt
455,69331,10,mani women hot flash last 10 year menopaus gt
456,69331,3,ff women health research updat nih offic research women health nihorwh womenshealth
457,69331,3,hear loss tie faster brain shrinkag age gt
458,69331,3,firsttim cesarean rate dip 2012 cdc gt
459,69331,1,fund opportun mobil research research resourc enhanc mhealth research gt
460,69331,8,cervic cancer screen found benefit older women new studi gt
461,69331,11,ear tube may longterm benefit kid ear infect gt
462,69331,17,cancer prevent guidelin seem pay older women gt
463,69331,7,breastfeed might reduc mom odd rheumatoid arthriti gt
464,69331,58,womenshealth cervicalcanc easiest femal cancer prevent regular screen amp follow
465,69331,5,today perfect day set healthi goal year check idea gt
466,69331,12,pleas rememb drink respons tonight call cab happi safe healthi nye
467,69331,6,midlif job stress link later health problem gt
468,69331,2,health tip avoid food poison holiday travel gt
469,69331,4,claim virgin birth us near 1 percent studi gt
470,69331,6,heart diseas link dementia older postmenopaus women gt
471,69331,5,antidepress use pregnanc link autism gt
472,69331,1,womenshealth merri miseri fdafood parti part holiday cheer merri chang miseri w food
473,69331,6,expert dont wast money multivitamin gt
474,69331,90,usfda buy antibacteri soap reduc risk get infect data suggest
475,69331,8,nlmnew lose sleep holiday season well 7 step better sleep busi season
476,69331,6,womenshealth share gt need idea holiday meal makeov tri
477,69331,7,womenshealth open enrol marketplac plan end march 31 wait enrol
478,69331,4,unsur eat fish pregnantbreastfeed import benefit babi recommend
479,69331,4,diabet drug may affect cancer risk women studi gt
480,69331,15,womenshealth buy gift kiddi life awar potenti lead hazard toy jewelri
481,69331,5,new test may help predict surviv ovarian cancer gt
482,69331,20,wash hand one import thing prevent ill gt handwashingawarenessweek
483,69331,25,womenshealth import 1 4 peopl live hiv us woman get test gt
484,69331,4,even breast cancer gene test neg risk persist studi gt
485,69331,16,womenshealth lead health issu nativ american relat lifestyl know risk give power htt
486,69331,33,womenshealth caregiv stress emot physic strain caregiv learn latest blog post
487,69331,6,much tylenol pregnanc could affect develop
488,69331,6,pleas mind safeti prepar thanksgiv dinner 3x fire thanksgiv
489,69331,3,nurs mother tri use lactm research whether substanc pass breast milk
490,69331,1,nurs mother lactm easi tool use verifi substanc pass breast milk
491,69331,7,nlmsi mt cdcflu cdc recommend peopl either type 1 type 2 diabet get annual flu shot
492,69331,4,antibiot alway answer danger antibiot resist gt
493,69331,3,tip manag holiday care love one gt
494,69331,0,onsafeti 1 reason stand pan 3x fire thanksgiv averag day
495,69331,8,womanshospit bad workout one womanshalf runpink
496,69331,13,fdawomen peopl symptom 50 peopl sex hpv point live
497,69331,2,time month may affect women concuss recoveri
498,69331,6,beverag choic huge impact diabet idea drink besid water wdd
499,69331,25,surgeongener sgreport fact smoker w diabet higher risk heart kidney amp eye diseas quit smoke nation dia
500,69331,8,femal caregiv higher risk depress pleas take care familycaregiversmonth
501,69331,0,health risk cost much higher multipl birth studi
502,69331,30,womenshealth pleas gt smoke caus cancer problem top 11 way hurt women
503,69331,4,nondeliveri hospit stay may rais clot risk pregnanc
504,69331,4,care someon alzheim need help find resourc check
505,69331,17,healthi diabetesfriendli recip quick weeknight dinner diabetesawar
506,69331,10,gestat diabet occur 38 pregnant women understand risk factor pregnant
507,69331,10,nation diabet month 108 us women diabet check medlineplu resourc
508,69331,7,screen hpv may better pap test studi suggest
509,69331,42,womenshealth women like alzheim like take care someon w alzheim
510,69331,8,primari caregiv stress forget take time
511,69331,26,womenshealth singl mom breastfe hear advic singl mom made work itsonlynatur
512,69331,11,nation famili caregiv monthwheth mother take care child child care parent celebr
513,69331,8,infant expos smoke womb risk infect death studi
514,69331,4,12 percent women 50 satisfi bodi
515,69331,2,scandinavia studi find hpv vaccin safe
516,69331,11,scientist uncov breast milk potenti secret weapon hiv
517,69331,2,famili caregiv live longer peer
518,69331,2,stalk take mental toll victim studi confirm
519,69331,6,women health initi reaffirm use shortterm hormon replac therapi younger women
520,69331,41,womenshealth pleas gt help friend abus dvam
521,69331,691,whitehous mammogram 0 birth control 0 prevent care need stay healthi extra cost priceless obamacar
522,69331,15,due laps govern fund new post respons may origin account appropri enact
523,69331,1,nlmdimrc nnlmscr last day disast prepared month check dimrc mobil app take go
524,69331,25,womenshealth marketplac plan must cover contracept cost share love 0 copay birth control
525,69331,6,nihpainresearch know 918 women 1864 yo may experi vulvar pain lifetim vulvodynia painawar h
526,69331,40,sept 26 world contracept day 222 million women want avoid pregnanc lack access birth control
527,69331,3,nlmosp video inform clinicaltri deal wreproductivehealth
528,69331,6,women 1849 interest breastcanc riskprevent help clheming phd candid gwu take survey
529,69331,25,womenshealth pregnant new mom need take extra step prepar emerg gt
530,69331,63,womenshealth pleas exercis lower risk 10 differ diseas ill injuri wow
531,69331,2,nlmosp need research inform womeninthemilitari here good info
532,69331,2,lack support worri often prompt new mother stop breastfeed
533,69331,22,womenshealth pleas join us 926 4et bilingu twitter chat latino amp aca use oursalud cuidadodesalud nlirh n
534,69331,18,womenshealth fact peopl like quit smoke support
535,69331,1,risk develop ovarian cancer reduc pregnanc breastfeed children els lower risk
536,69331,6,nlm4caregiv breastfeed mother use lactm find drug may affect babi
537,69331,13,kidshealth via nprnew succeed breastfeed new mom could use help
538,69331,0,emilydownsideup mani labor induc 39 week necessarili lead cesarean
539,69331,4,let babi set deliveri date wait 39 week
540,69331,8,healthymo miss hbo documentari seri weightofthen kid view seri amp learn nih obes resourc htt
541,69331,2,nation childhood obes month gut microb diet interact affect obes
542,69331,14,womenshealth food check water check umm els goe emerg kit
543,69331,6,fdawomen trivia time blood pressur often greater may need treatment
544,69331,13,septemb ovarian cancer awar month learn protect
545,69331,32,womenshealth prenat care breastfeed support wellchild visit extra cost gt marketplac
546,69331,3,womanshospit cancer treatment complic healthi eat dinner session help sur
547,69331,16,cdcstd hiv transmiss unprotect vagin sex much higher risk women menlt usecondom
548,69331,4,ncitechtransf nci avon foundat center advanc innov launch breast cancer startup challeng
549,69331,14,retweet amp help 186 million uninsur women get readi oct 1 amp start open enrol
550,69331,16,stanford rape mean get defin prof estel freedman examin polit sexual violenc
551,69331,146,healthcaregov start 2014 health insur cant charg women higher premium men learn
552,69331,12,womenshealth health insur marketplac come soon see qualifi lower cost
553,69331,5,nihprev nation prevent council annual statu report avail read nat l improv publichealth goal
554,69331,5,sex gender differ free cme credit avail ummslibrari
555,69331,8,md rn np need cme credit take nih ce sex gender differ ummslibrari
556,69331,26,cdcstd cervic cancer usual symptom critic women get regular screen std
557,69331,0,pleas free cme class sex gender differ md np rn ummslibrari
558,69331,5,fewer famili struggl pay medic bill cdc healthday may skip need care altogeth expert say
559,69331,14,latest women health mobil app ummslibrari resourc whlibguid
560,69331,6,attn women health research new resourc umass abt women health issu whlibguid
561,69331,3,umass women health libguid provid info resourc women health issu expert sourc whlibguid
562,69331,4,latest women health mobil app ummslibrari resourc whlibguid
563,69331,4,latest women health mobil app ummslibrari resourc whlibguid
564,69331,0,learn ebm research help md make angelinajolielik cancer tx decis whlibguid ummslibrari
565,69331,5,celebr women health week learn new ummslibrari resourc whlibguid
566,69331,8,women men brain respond differ hungri infant cri
567,69331,13,sex live often overlook casualti traumat brain injuri
568,69331,7,membran remodel yoga meet cell biolog
569,69331,14,new clue exercis may reduc breast cancer risk
570,69331,6,breast cancer death rate higher black women
571,69331,8,experiment vaccin show promis ovarian cancer
572,69331,8,older women miss mammogram tie wors breast cancer outcom
573,69331,5,iud safe contracept teen studi find
574,69331,13,brisk walk equal run heart health
575,69331,5,nearli 30 percent american high blood pressur cdc
576,69331,0,us coupl live togeth instead marri cdc find
577,69331,6,repeat birth teen girl still high cdc
578,69331,5,studi pinpoint women risk blood clot pregnanc
579,69331,4,breast cancer gene test wont help women
580,69331,2,consensu sex typic doesnt begin teen year studi find
581,69331,4,breast cancer spread lung surgeri may increas surviv
582,69331,12,fdawomen april minorityhealthmonth feel press health issu minor
583,69331,5,mani ovarian cancer patient deni bythebook care studi say
584,69331,10,million still lack access modern contracept studi say
585,69331,17,obes new mother may higher heart attack stroke risk
586,69331,3,heavier pregnant women may face higher csection risk
587,69331,5,petroleum jelli tie vagin infect risk studi
588,69331,5,african american breast cancer survivor face higher heart failur risk
589,69331,2,lessfrequ pap smear may miss cancer precursor
590,69331,1,combo treatment might beat epidur eas labor
591,69331,10,anxieti may common depress pregnanc
592,69331,3,motherhood may spur obsessivecompuls behavior
593,69331,4,csection rate vari wide us hospit
594,69331,3,progress wg intersect hivaid violenc women girl genderrel health dispar
595,69331,1,cdcstd hpv vaccin men particularli men sex w men std
596,69331,3,swhr check contribut writer newest articl endometriosi affect million women year
597,69331,2,dailyus hiv prevent approach prove ineffect among women nih studi
598,69331,10,evid smoke rais breast cancer risk
599,69331,4,advanc breast cancer inch young women
600,69331,25,intim partner violenc screen guidanc new issu journal women health
601,69331,10,account close get news nih research women health nihorwh amp janineclaytonmd ff
602,69331,5,account close follow nihorwh amp janineclaytonmd nih womenshealth news
603,69331,3,thank follow us account close pleas follow nihorwh amp janineclaytonmd womenshealth news nih
604,69331,10,fund opportun gt
605,69331,14,could dark chocol help eas poor leg circul gt
606,69331,8,join manupchat today 2pm et minorityhealth partner discuss men health
607,69331,25,vitamin key longer life gt
608,69331,8,womenshealthr check research wide rang topic import women health
609,69331,11,yalesph racial dispar persist breast cancer therapi
610,69331,39,veteranshealth women veteran know support line question specif women health care call 1
611,69331,25,swhr women 2x like men advers reaction prescript drug womenshealthmatt
612,69331,10,swhr focus sex gender differ obes 2014 nation scientif x confer washington
613,69331,14,yale leptin also influenc brain cell control appetit yale research find
614,69331,8,umsph new um studi found mammographi led less latestag breast cancer
615,69331,7,short birth space link preterm deliveri gt
616,69331,7,hormon level womb tie autism risk boy gt
617,69331,0,regist dcoe webinar seri june 12 130 concuss affect men differ women gt
618,69331,9,diabet may bigger threat femal heart studi gt
619,69331,5,nih studi link high cholesterol level lower fertil gt
620,69331,6,bebrightpink womenshealthnih pl take bebrightpink challeng amp assessyourrisk breastovarian cancer go
621,69331,77,hhsgov natl women health week take pledg schedul wellwoman visit nwhw
622,69331,8,cdcstd check cdc health dispar amp inequ report highlight key healthdispar data
623,69331,3,nihorwh dyk men get physic activ women check today womenshealth nwhw infograph learn
624,69331,11,pay attent mental health nwhw sure get enough sleep amp manag stress
625,69331,4,join women across countri pledg get activ nwhw
626,69331,8,nihorwh sever factor play role vision dispar btw women men age menopaus econom issu neichat
627,69331,3,nihorwh fact everi cell bodi sex woman femal cell skin lung heart brain eye neichat
628,69331,4,nihorwh health factor differ men women even beyond reproduct system neichat
629,69331,10,nateyeinstitut rememb dilat eye exam way detect common eye diseas earli stage neichat
630,69331,7,nihorwh eye chang signal presenc mani underli condit high blood pressur diabet cancer autoimmun diseas
631,69331,12,janineclaytonmd women tend live longer men women get eye diseas sinc age key risk factor vision pr
632,69331,5,masseyeandear know 23 blind visual impair occur women learn neichat
633,69331,32,nat l women checkupday take care health schedul wellwoman visit nwhw
634,69331,1,nateyeinstitut look forward today neichat women eye health join nei nihorwh amp janineclaytonmd 23p et
635,69331,0,nateyeinstitut neichat
636,69331,9,major women health studi paid big dividend gt
637,69331,6,freez techniqu may work women earli breast cancer gt
638,69331,3,jobless unwant side effect chemo breast cancer gt
639,69331,29,rocktalk listen new nih resubmiss polici blog thank extramur com
640,69331,8,facebook make women feel bad bodi gt
641,69331,4,nihorwh news janineclaytonmd announc fund admin supplement grant sexgend research
642,69331,4,fertil drug may rais breast cancer risk studi gt
643,69331,5,diet soft drink contribut heart troubl women gt
644,69331,4,two surgeri pelvic prolaps found similarli effect safe gt
645,69331,9,alzheim strike women harder men report
646,69331,6,fda panel recommend hpv test replac pap smear gt
647,69331,3,time move vp mr presid readi move potu let thing letsmov watch
648,69331,23,heart attack risk rise hour angri outburst studi gt
649,69331,4,obes birth control pill rais risk multipl sclerosi gt
650,69331,4,obgyn group issu guidelin lower csection rate gt
651,69331,4,blood clot risk remain higher normal least 12 week women deliv babi gt
652,69331,8,expand dna test might allow person breast cancer treatment gt
653,69331,17,nih studi find regular aspirin use may reduc ovarian cancer risk gt
654,69331,1,mani young american hiv delay treatment studi gt
655,69331,10,mani women hot flash last 10 year menopaus gt
656,69331,3,ff women health research updat nih offic research women health nihorwh womenshealth
657,69331,3,hear loss tie faster brain shrinkag age gt
658,69331,3,firsttim cesarean rate dip 2012 cdc gt
659,69331,1,fund opportun mobil research research resourc enhanc mhealth research gt
660,69331,8,cervic cancer screen found benefit older women new studi gt
661,69331,11,ear tube may longterm benefit kid ear infect gt
662,69331,17,cancer prevent guidelin seem pay older women gt
663,69331,7,breastfeed might reduc mom odd rheumatoid arthriti gt
664,69331,58,womenshealth cervicalcanc easiest femal cancer prevent regular screen amp follow
665,69331,5,today perfect day set healthi goal year check idea gt
666,69331,12,pleas rememb drink respons tonight call cab happi safe healthi nye
667,69331,6,midlif job stress link later health problem gt
668,69331,2,health tip avoid food poison holiday travel gt
669,69331,4,claim virgin birth us near 1 percent studi gt
670,69331,6,heart diseas link dementia older postmenopaus women gt
671,69331,5,antidepress use pregnanc link autism gt
672,69331,1,womenshealth merri miseri fdafood parti part holiday cheer merri chang miseri w food
673,69331,6,expert dont wast money multivitamin gt
674,69331,90,usfda buy antibacteri soap reduc risk get infect data suggest
675,69331,8,nlmnew lose sleep holiday season well 7 step better sleep busi season
676,69331,6,womenshealth share gt need idea holiday meal makeov tri
677,69331,7,womenshealth open enrol marketplac plan end march 31 wait enrol
678,69331,4,unsur eat fish pregnantbreastfeed import benefit babi recommend
679,69331,4,diabet drug may affect cancer risk women studi gt
680,69331,15,womenshealth buy gift kiddi life awar potenti lead hazard toy jewelri
681,69331,5,new test may help predict surviv ovarian cancer gt
682,69331,20,wash hand one import thing prevent ill gt handwashingawarenessweek
683,69331,25,womenshealth import 1 4 peopl live hiv us woman get test gt
684,69331,4,even breast cancer gene test neg risk persist studi gt
685,69331,16,womenshealth lead health issu nativ american relat lifestyl know risk give power htt
686,69331,33,womenshealth caregiv stress emot physic strain caregiv learn latest blog post
687,69331,6,much tylenol pregnanc could affect develop
688,69331,6,pleas mind safeti prepar thanksgiv dinner 3x fire thanksgiv
689,69331,3,nurs mother tri use lactm research whether substanc pass breast milk
690,69331,1,nurs mother lactm easi tool use verifi substanc pass breast milk
691,69331,7,nlmsi mt cdcflu cdc recommend peopl either type 1 type 2 diabet get annual flu shot
692,69331,4,antibiot alway answer danger antibiot resist gt
693,69331,3,tip manag holiday care love one gt
694,69331,0,onsafeti 1 reason stand pan 3x fire thanksgiv averag day
695,69331,8,womanshospit bad workout one womanshalf runpink
696,69331,13,fdawomen peopl symptom 50 peopl sex hpv point live
697,69331,2,time month may affect women concuss recoveri
698,69331,6,beverag choic huge impact diabet idea drink besid water wdd
699,69331,25,surgeongener sgreport fact smoker w diabet higher risk heart kidney amp eye diseas quit smoke nation dia
700,69331,8,femal caregiv higher risk depress pleas take care familycaregiversmonth
701,69331,0,health risk cost much higher multipl birth studi
702,69331,30,womenshealth pleas gt smoke caus cancer problem top 11 way hurt women
