Index,text
0,intim partner violenc screen guidanc new issu journal women health
1,account close get news nih research women health nihorwh amp janineclaytonmd ff
2,account close follow nihorwh amp janineclaytonmd nih womenshealth news
3,thank follow us account close pleas follow nihorwh amp janineclaytonmd womenshealth news nih
4,fund opportun gt
5,could dark chocol help eas poor leg circul gt
6,join manupchat today 2pm et minorityhealth partner discuss men health
7,vitamin key longer life gt
8,womenshealthr check research wide rang topic import women health
9,yalesph racial dispar persist breast cancer therapi
10,veteranshealth women veteran know support line question specif women health care call 1
11,swhr women 2x like men advers reaction prescript drug womenshealthmatt
12,swhr focus sex gender differ obes 2014 nation scientif x confer washington
13,yale leptin also influenc brain cell control appetit yale research find
14,umsph new um studi found mammographi led less latestag breast cancer
15,short birth space link preterm deliveri gt
16,hormon level womb tie autism risk boy gt
17,regist dcoe webinar seri june 12 130 concuss affect men differ women gt
18,diabet may bigger threat femal heart studi gt
19,nih studi link high cholesterol level lower fertil gt
20,bebrightpink womenshealthnih pl take bebrightpink challeng amp assessyourrisk breastovarian cancer go
21,hhsgov natl women health week take pledg schedul wellwoman visit nwhw
22,cdcstd check cdc health dispar amp inequ report highlight key healthdispar data
23,nihorwh dyk men get physic activ women check today womenshealth nwhw infograph learn
24,pay attent mental health nwhw sure get enough sleep amp manag stress
25,join women across countri pledg get activ nwhw
26,nihorwh sever factor play role vision dispar btw women men age menopaus econom issu neichat
27,nihorwh fact everi cell bodi sex woman femal cell skin lung heart brain eye neichat
28,nihorwh health factor differ men women even beyond reproduct system neichat
29,nateyeinstitut rememb dilat eye exam way detect common eye diseas earli stage neichat
30,nihorwh eye chang signal presenc mani underli condit high blood pressur diabet cancer autoimmun diseas
31,janineclaytonmd women tend live longer men women get eye diseas sinc age key risk factor vision pr
32,masseyeandear know 23 blind visual impair occur women learn neichat
33,nat l women checkupday take care health schedul wellwoman visit nwhw
34,nateyeinstitut look forward today neichat women eye health join nei nihorwh amp janineclaytonmd 23p et
35,nateyeinstitut neichat
36,major women health studi paid big dividend gt
37,freez techniqu may work women earli breast cancer gt
38,jobless unwant side effect chemo breast cancer gt
39,rocktalk listen new nih resubmiss polici blog thank extramur com
40,facebook make women feel bad bodi gt
41,nihorwh news janineclaytonmd announc fund admin supplement grant sexgend research
42,fertil drug may rais breast cancer risk studi gt
43,diet soft drink contribut heart troubl women gt
44,two surgeri pelvic prolaps found similarli effect safe gt
45,alzheim strike women harder men report
46,fda panel recommend hpv test replac pap smear gt
47,time move vp mr presid readi move potu let thing letsmov watch
48,heart attack risk rise hour angri outburst studi gt
49,obes birth control pill rais risk multipl sclerosi gt
50,obgyn group issu guidelin lower csection rate gt
51,blood clot risk remain higher normal least 12 week women deliv babi gt
52,expand dna test might allow person breast cancer treatment gt
53,nih studi find regular aspirin use may reduc ovarian cancer risk gt
54,mani young american hiv delay treatment studi gt
55,mani women hot flash last 10 year menopaus gt
56,ff women health research updat nih offic research women health nihorwh womenshealth
57,hear loss tie faster brain shrinkag age gt
58,firsttim cesarean rate dip 2012 cdc gt
59,fund opportun mobil research research resourc enhanc mhealth research gt
60,cervic cancer screen found benefit older women new studi gt
61,ear tube may longterm benefit kid ear infect gt
62,cancer prevent guidelin seem pay older women gt
63,breastfeed might reduc mom odd rheumatoid arthriti gt
64,womenshealth cervicalcanc easiest femal cancer prevent regular screen amp follow
65,today perfect day set healthi goal year check idea gt
66,pleas rememb drink respons tonight call cab happi safe healthi nye
67,midlif job stress link later health problem gt
68,health tip avoid food poison holiday travel gt
69,claim virgin birth us near 1 percent studi gt
70,heart diseas link dementia older postmenopaus women gt
71,antidepress use pregnanc link autism gt
72,womenshealth merri miseri fdafood parti part holiday cheer merri chang miseri w food
73,expert dont wast money multivitamin gt
74,usfda buy antibacteri soap reduc risk get infect data suggest
75,nlmnew lose sleep holiday season well 7 step better sleep busi season
76,womenshealth share gt need idea holiday meal makeov tri
77,womenshealth open enrol marketplac plan end march 31 wait enrol
78,unsur eat fish pregnantbreastfeed import benefit babi recommend
79,diabet drug may affect cancer risk women studi gt
80,womenshealth buy gift kiddi life awar potenti lead hazard toy jewelri
81,new test may help predict surviv ovarian cancer gt
82,wash hand one import thing prevent ill gt handwashingawarenessweek
83,womenshealth import 1 4 peopl live hiv us woman get test gt
84,even breast cancer gene test neg risk persist studi gt
85,womenshealth lead health issu nativ american relat lifestyl know risk give power htt
86,womenshealth caregiv stress emot physic strain caregiv learn latest blog post
87,much tylenol pregnanc could affect develop
88,pleas mind safeti prepar thanksgiv dinner 3x fire thanksgiv
89,nurs mother tri use lactm research whether substanc pass breast milk
90,nurs mother lactm easi tool use verifi substanc pass breast milk
91,nlmsi mt cdcflu cdc recommend peopl either type 1 type 2 diabet get annual flu shot
92,antibiot alway answer danger antibiot resist gt
93,tip manag holiday care love one gt
94,onsafeti 1 reason stand pan 3x fire thanksgiv averag day
95,womanshospit bad workout one womanshalf runpink
96,fdawomen peopl symptom 50 peopl sex hpv point live
97,time month may affect women concuss recoveri
98,beverag choic huge impact diabet idea drink besid water wdd
99,surgeongener sgreport fact smoker w diabet higher risk heart kidney amp eye diseas quit smoke nation dia
100,femal caregiv higher risk depress pleas take care familycaregiversmonth
101,health risk cost much higher multipl birth studi
102,womenshealth pleas gt smoke caus cancer problem top 11 way hurt women
103,nondeliveri hospit stay may rais clot risk pregnanc
104,care someon alzheim need help find resourc check
105,healthi diabetesfriendli recip quick weeknight dinner diabetesawar
106,gestat diabet occur 38 pregnant women understand risk factor pregnant
107,nation diabet month 108 us women diabet check medlineplu resourc
108,screen hpv may better pap test studi suggest
109,womenshealth women like alzheim like take care someon w alzheim
110,primari caregiv stress forget take time
111,womenshealth singl mom breastfe hear advic singl mom made work itsonlynatur
112,nation famili caregiv monthwheth mother take care child child care parent celebr
113,infant expos smoke womb risk infect death studi
114,12 percent women 50 satisfi bodi
115,scandinavia studi find hpv vaccin safe
116,scientist uncov breast milk potenti secret weapon hiv
117,famili caregiv live longer peer
118,stalk take mental toll victim studi confirm
119,women health initi reaffirm use shortterm hormon replac therapi younger women
120,womenshealth pleas gt help friend abus dvam
121,whitehous mammogram 0 birth control 0 prevent care need stay healthi extra cost priceless obamacar
122,due laps govern fund new post respons may origin account appropri enact
123,nlmdimrc nnlmscr last day disast prepared month check dimrc mobil app take go
124,womenshealth marketplac plan must cover contracept cost share love 0 copay birth control
125,nihpainresearch know 918 women 1864 yo may experi vulvar pain lifetim vulvodynia painawar h
126,sept 26 world contracept day 222 million women want avoid pregnanc lack access birth control
127,nlmosp video inform clinicaltri deal wreproductivehealth
128,women 1849 interest breastcanc riskprevent help clheming phd candid gwu take survey
129,womenshealth pregnant new mom need take extra step prepar emerg gt
130,womenshealth pleas exercis lower risk 10 differ diseas ill injuri wow
131,nlmosp need research inform womeninthemilitari here good info
132,lack support worri often prompt new mother stop breastfeed
133,womenshealth pleas join us 926 4et bilingu twitter chat latino amp aca use oursalud cuidadodesalud nlirh n
134,womenshealth fact peopl like quit smoke support
135,risk develop ovarian cancer reduc pregnanc breastfeed children els lower risk
136,nlm4caregiv breastfeed mother use lactm find drug may affect babi
137,kidshealth via nprnew succeed breastfeed new mom could use help
138,emilydownsideup mani labor induc 39 week necessarili lead cesarean
139,let babi set deliveri date wait 39 week
140,healthymo miss hbo documentari seri weightofthen kid view seri amp learn nih obes resourc htt
141,nation childhood obes month gut microb diet interact affect obes
142,womenshealth food check water check umm els goe emerg kit
143,fdawomen trivia time blood pressur often greater may need treatment
144,septemb ovarian cancer awar month learn protect
145,womenshealth prenat care breastfeed support wellchild visit extra cost gt marketplac
146,womanshospit cancer treatment complic healthi eat dinner session help sur
147,cdcstd hiv transmiss unprotect vagin sex much higher risk women menlt usecondom
148,ncitechtransf nci avon foundat center advanc innov launch breast cancer startup challeng
149,retweet amp help 186 million uninsur women get readi oct 1 amp start open enrol
150,stanford rape mean get defin prof estel freedman examin polit sexual violenc
151,healthcaregov start 2014 health insur cant charg women higher premium men learn
152,womenshealth health insur marketplac come soon see qualifi lower cost
153,nihprev nation prevent council annual statu report avail read nat l improv publichealth goal
154,sex gender differ free cme credit avail ummslibrari
155,md rn np need cme credit take nih ce sex gender differ ummslibrari
156,cdcstd cervic cancer usual symptom critic women get regular screen std
157,pleas free cme class sex gender differ md np rn ummslibrari
158,fewer famili struggl pay medic bill cdc healthday may skip need care altogeth expert say
159,latest women health mobil app ummslibrari resourc whlibguid
160,attn women health research new resourc umass abt women health issu whlibguid
161,umass women health libguid provid info resourc women health issu expert sourc whlibguid
162,latest women health mobil app ummslibrari resourc whlibguid
163,latest women health mobil app ummslibrari resourc whlibguid
164,learn ebm research help md make angelinajolielik cancer tx decis whlibguid ummslibrari
165,celebr women health week learn new ummslibrari resourc whlibguid
166,women men brain respond differ hungri infant cri
167,sex live often overlook casualti traumat brain injuri
168,membran remodel yoga meet cell biolog
169,new clue exercis may reduc breast cancer risk
170,breast cancer death rate higher black women
171,experiment vaccin show promis ovarian cancer
172,older women miss mammogram tie wors breast cancer outcom
173,iud safe contracept teen studi find
174,brisk walk equal run heart health
175,nearli 30 percent american high blood pressur cdc
176,us coupl live togeth instead marri cdc find
177,repeat birth teen girl still high cdc
178,studi pinpoint women risk blood clot pregnanc
179,breast cancer gene test wont help women
180,consensu sex typic doesnt begin teen year studi find
181,breast cancer spread lung surgeri may increas surviv
182,fdawomen april minorityhealthmonth feel press health issu minor
183,mani ovarian cancer patient deni bythebook care studi say
184,million still lack access modern contracept studi say
185,obes new mother may higher heart attack stroke risk
186,heavier pregnant women may face higher csection risk
187,petroleum jelli tie vagin infect risk studi
188,african american breast cancer survivor face higher heart failur risk
189,lessfrequ pap smear may miss cancer precursor
190,combo treatment might beat epidur eas labor
191,anxieti may common depress pregnanc
192,motherhood may spur obsessivecompuls behavior
193,csection rate vari wide us hospit
194,progress wg intersect hivaid violenc women girl genderrel health dispar
195,cdcstd hpv vaccin men particularli men sex w men std
196,swhr check contribut writer newest articl endometriosi affect million women year
197,dailyus hiv prevent approach prove ineffect among women nih studi
198,evid smoke rais breast cancer risk
199,advanc breast cancer inch young women
